,Name,English_title,Score,Popularity,Rank,Members,Type,Episodes,Status,Aired,Premiered,Broadcast,Producers,Licensors,Studios,Source,Genres,Duration,Rating,Favorites,Themes,Demographics
98,Neko Neko Nihonshi 2nd Season,Meow Meow Japanese History,6.23,14083,8320,875,TV,32,Finished Airing,"Apr 5, 2017 to Feb 28, 2018",Spring 2017,Wednesdays at 18:45 (JST),"NHK,       Neft Film","None found, add some",Joker Films,Web manga,,9 min. per ep.,G - All Ages,1,"Anthropomorphic, Historical, Parody, Samurai",Kids
99,Neko Neko Nihonshi,Meow Meow Japanese History,6.23,9772,8319,3,TV,32,Finished Airing,"Apr 6, 2016 to Feb 22, 2017",Spring 2016,Wednesdays at 18:45 (JST),"None found, add some","None found, add some",Joker Films,Web manga,,9 min. per ep.,G - All Ages,8,"Anthropomorphic, Historical, Parody, Samurai",Kids
100,Obake no Q-tarou (1985),,6.23,13588,8321,1,TV,510,Finished Airing,"Apr 1, 1985 to Mar 29, 1987",Spring 1985,Unknown,"None found, add some","None found, add some",Shin-Ei Animation,Unknown,"Comedy, Slice of Life, Supernatural",15 min. per ep.,G - All Ages,1,School,Kids
101,Pokemon: Pikachu to Pokemon Ongakutai,Pikachu and the Pokemon Music Squad,6.23,7557,8322,6,Movie,1,Finished Airing,"Jul 18, 2015",,,"None found, add some",The Pokemon Company International,OLM,Game,"Adventure, Fantasy",15 min.,PG - Children,0,,Kids
102,Qin Shi Mingyue Tebie Pian: Di Zi Jiang Xi,Qin's Moon: Lady Xiang Descends,6.23,14797,8323,698,ONA,1,Finished Airing,"Feb 13, 2015",,,Chukong Technologies,"None found, add some",Sparkly Key Animation Studio,Novel,"Action, Fantasy",15 min.,PG-13 - Teens 13 or older,0,"Historical, Martial Arts",
103,Rokudenashi Blues 1993,,6.23,11762,8324,1,Movie,1,Finished Airing,"Jul 24, 1993",,,"None found, add some","None found, add some",Toei Animation,Manga,"Comedy, Drama, Sports",1 hr. 24 min.,R - 17+ (violence & profanity),1,"Combat Sports, Delinquents, School",Shounen
104,Sangokushi (1985),,6.23,12861,8325,1,TV Special,1,Finished Airing,"Mar 20, 1985",,,"None found, add some","None found, add some",Shin-Ei Animation,Unknown,,1 hr. 33 min.,R+ - Mild Nudity,4,Historical,
105,Sekai Meisaku Douwa Series,,6.23,15598,8326,571,TV,4,Finished Airing,"Apr 7, 1988 to Apr 28, 1988",Spring 1988,Thursdays at 18:00 (JST),"None found, add some","None found, add some",Toei Animation,Unknown,"Adventure, Fantasy, Supernatural",25 min. per ep.,G - All Ages,0,Historical,Kids
106,Jungle Taitei Movie,,6.22,11971,8327,1,Movie,1,Finished Airing,"Jul 31, 1966",,,Tezuka Productions,"None found, add some",Mushi Production,Unknown,Adventure,1 hr. 14 min.,G - All Ages,1,,Shounen
107,King of Prism: Shiny Seven Stars IV - Louis x Shin x Unknown,,6.22,14005,8329,892,Movie,1,Finished Airing,"May 4, 2019",,,"None found, add some","None found, add some",Tatsunoko Production,Original,Sports,1 hr. 9 min.,PG-13 - Teens 13 or older,0,"Idols (Male), Music",
108,Kidou Senshi SD Gundam Mk-I,Mobile Suit SD Gundam Mk-I,6.22,8496,8328,5,Special,3,Finished Airing,"Mar 12, 1988 to May 25, 1988",,,"None found, add some","None found, add some",Sunrise,Original,"Action, Comedy, Sci-Fi",10 min. per ep.,PG - Children,1,"Mecha, Parody",
109,Kitsune Tsuki,Fox Fears,6.22,14437,8330,786,Movie,1,Finished Airing,2015,,,Geidai Animation,"None found, add some","None found, add some",Original,Drama,7 min.,G - All Ages,0,,
110,Li Shi Zhentan Shiwusuo: A Day in Lungmen - Home Service,Lee's Detective Agency: A Day in Lungmen - Home Service,6.22,14408,8331,791,ONA,1,Finished Airing,"Oct 24, 2021",,,"None found, add some","None found, add some","HMCH,       Gravity Well",Game,"Action, Comedy, Mystery",3 min.,PG-13 - Teens 13 or older,0,"Anthropomorphic, Detective",
111,Mahou Shoujo Site Recaps,Magical Girl Site Recaps,6.22,8279,8332,5,Special,2,Finished Airing,"May 10, 2018 to Jun 13, 2018",,,Avex Pictures,"None found, add some",production doA,Manga,"Drama, Horror, Supernatural",16 min. per ep.,R - 17+ (violence & profanity),7,"Gore, Mahou Shoujo, Psychological",
112,Majokko Tickle,,6.22,11930,8333,1,TV,45,Finished Airing,"Mar 6, 1978 to Jan 29, 1979",Spring 1978,Unknown,"None found, add some","None found, add some",Toei Animation,Original,Comedy,24 min. per ep.,G - All Ages,3,,
113,Mamono Hunter Youko,Devil Hunter Yohko,6.22,5762,8334,13,OVA,5,Finished Airing,"Dec 1, 1990 to Jul 1, 1995",,,TOHO,ADV Films,Madhouse,Original,"Comedy, Fantasy, Horror, Supernatural",36 min. per ep.,R+ - Mild Nudity,30,,
114,Mamono-tachi no Kunou,,6.22,10930,8335,2,ONA,12,Finished Airing,"Oct 10, 2020 to Dec 24, 2020",,,"None found, add some","None found, add some","Doga Kobo,       AQUA ARIS",Manga,Comedy,2 min. per ep.,PG-13 - Teens 13 or older,3,,
115,Metallic Rouge,,6.22,2198,8336,93,TV,13,Finished Airing,"Jan 11, 2024 to Apr 4, 2024",Winter 2024,Thursdays at 00:55 (JST),"Dentsu,       Fuji TV,       GAGA,       Fujipacific Music,       BS Fuji,       bilibili,       Crunchyroll,       Line Digital Frontier","None found, add some",Bones,Original,"Action, Sci-Fi",22 min. per ep.,PG-13 - Teens 13 or older,359,,
116,Midnight Eye: Gokuu II,Goku II: Midnight Eye,6.22,7472,8337,6,OVA,1,Finished Airing,"Dec 22, 1989",,,"None found, add some","Discotek Media,       Urban Vision",Madhouse,Manga,"Action, Mystery, Sci-Fi",53 min.,R+ - Mild Nudity,3,"Adult Cast, Detective, Super Power",Seinen
117,Mini Hama: Minimum Hamatora,,6.22,8640,8338,4,TV,8,Finished Airing,"Nov 1, 2015 to Dec 21, 2015",Fall 2015,Mondays at 21:24 (JST),"None found, add some","None found, add some",Lerche,Mixed media,"Comedy, Mystery",5 min. per ep.,PG-13 - Teens 13 or older,1,"School, Super Power",
118,Miss Monochrome The Animation: Manager,,6.22,7600,8339,6,OVA,1,Finished Airing,"May 25, 2014",,,Starchild Records,"None found, add some",SANZIGEN,Original,"Comedy, Slice of Life",4 min.,G - All Ages,2,"Idols (Female), Music",
119,Mori no Tonto-tachi,A Christmas Adventure,6.22,14017,8340,886,TV,23,Finished Airing,"Oct 5, 1984 to Mar 29, 1985",Fall 1984,Unknown,"Fuji TV,       Zuiyo","None found, add some","Nippon Animation,       Shaft",Unknown,Fantasy,25 min. per ep.,G - All Ages,1,,Kids
120,Neko Machi,Cat City,6.22,12102,8341,1,OVA,1,Finished Airing,"Aug 1, 2006",,,"None found, add some","None found, add some",Toei Video,Unknown,"Fantasy, Horror",42 min.,PG-13 - Teens 13 or older,3,,
121,Ojamanga Yamada-kun,,6.22,14189,8342,848,TV,103,Finished Airing,"Sep 28, 1980 to Oct 10, 1982",Fall 1980,Sundays at 19:00 (JST),"Asatsu DK,       Tsuchida Productions","None found, add some","None found, add some",Unknown,"Comedy, Slice of Life",25 min. per ep.,None,3,,
122,One Piece: Barto no Himitsu no Heya!,One Piece: Barto's Secret Room,6.22,5710,8343,13,TV Special,4,Finished Airing,"Dec 26, 2021 to Oct 8, 2023",,,"None found, add some","None found, add some",Toei Animation,Manga,Comedy,23 min. per ep.,PG-13 - Teens 13 or older,25,,
123,Saint Beast: Ikusen no Hiru to Yoru-hen,,6.22,9097,8344,4,OVA,2,Finished Airing,"Dec 17, 2005 to Mar 18, 2006",,,"Lantis,       Tokyo Kids","None found, add some",Madhouse,Mixed media,Fantasy,25 min. per ep.,PG-13 - Teens 13 or older,6,,
124,Shiguang Dailiren x Wanglaoji: Guanjian Shike Hai de Kan Guang Lu a!,Link Click x Wanglaoji,6.22,11173,8345,2,ONA,1,Finished Airing,"Sep 26, 2021",,,"None found, add some","None found, add some","None found, add some",Original,Comedy,1 min.,PG-13 - Teens 13 or older,1,,
125,Shijian Qiutu,Time Prisoner,6.22,15155,8346,636,ONA,12,Finished Airing,"Oct 3, 2021 to Dec 12, 2021",,,Youku,"None found, add some","None found, add some",Original,"Action, Sci-Fi, Supernatural",14 min. per ep.,PG-13 - Teens 13 or older,1,Super Power,
126,Submarine 707R,,6.22,9812,8347,3,OVA,2,Finished Airing,"Sep 26, 2003 to Apr 28, 2004",,,"Aniplex,       Sony Music Entertainment",Geneon Entertainment USA,Group TAC,Manga,"Action, Adventure, Sci-Fi",50 min. per ep.,PG-13 - Teens 13 or older,3,Military,
127,Takara-sagashi,Treasure Hunting,6.22,11136,8349,2,Movie,1,Finished Airing,"Jun 4, 2011",,,"None found, add some","None found, add some",Studio Ghibli,Picture book,"Adventure, Fantasy",9 min.,G - All Ages,0,,Kids
128,Tabi Machi Late Show,,6.22,6592,8348,9,TV,4,Finished Airing,"Jan 8, 2016 to Jan 29, 2016",Winter 2016,Fridays at 23:17 (JST),Ultra Super Pictures,"None found, add some",CoMix Wave Films,Original,"Drama, Slice of Life",7 min. per ep.,PG - Children,5,,
129,Ushio to Tora: Comical Deformer Gekijou,Ushio and Tora: Comically Deformed Theater,6.22,9602,8350,3,OVA,1,Finished Airing,"Oct 1, 1993",,,"OB Planning,       Toshiba EMI,       TOHO,       Studio Jack,       Shogakukan",ADV Films,Pastel,Manga,"Action, Comedy",30 min.,PG-13 - Teens 13 or older,2,,
130,Giniro no Olynsis: Tokito,,6.20,6827,8451,8,TV,12,Finished Airing,"Oct 6, 2006 to Dec 22, 2006",Fall 2006,Unknown,"Happinet Pictures,       Nagoya Broadcasting Network,       Asahi Broadcasting","None found, add some",Toei Animation,Original,"Adventure, Drama, Romance",23 min. per ep.,PG-13 - Teens 13 or older,6,Mecha,
131,Hidamari Sketch x 365 Recap,,6.20,12286,8452,1,Special,1,Finished Airing,"Dec 23, 2009",,,"Aniplex,       Lantis","None found, add some",Shaft,4-koma manga,Slice of Life,50 min.,PG-13 - Teens 13 or older,0,"CGDCT, Iyashikei, School, Visual Arts",
132,Huckleberry no Bouken,,6.20,10803,8454,2,TV,26,Finished Airing,"Jan 2, 1976 to Jun 25, 1976",Winter 1976,Unknown,"None found, add some",Saban Entertainment,Group TAC,Novel,"Adventure, Drama",25 min. per ep.,G - All Ages,2,Historical,
133,Honoo no Mirage: Muyou no Michi,Mirage of Blaze Recap,6.20,11758,8453,1,TV Special,1,Finished Airing,"Feb 4, 2002",,,"None found, add some","None found, add some",Madhouse,Light novel,"Action, Boys Love, Drama, Supernatural",24 min.,PG-13 - Teens 13 or older,4,"Historical, Reincarnation, School",Shoujo
134,Hypersonic Music Club,,6.20,17648,8455,376,ONA,1,Finished Airing,"Aug 1, 2023",,,"None found, add some","None found, add some","None found, add some",Web manga,Sci-Fi,7 min.,PG-13 - Teens 13 or older,1,Music,
135,Ippatsu Kiki Musume,,6.20,7229,8456,7,TV,16,Finished Airing,"Oct 5, 1999 to Oct 29, 1999",Fall 1999,Not scheduled once per week,TBS,"None found, add some",Group TAC,Manga,"Action, Comedy, Ecchi",3 min. per ep.,R+ - Mild Nudity,9,,
136,Kamen Rider Den-O: Imagin Anime 3,,6.20,13888,8457,925,OVA,12,Finished Airing,"Oct 21, 2010",,,animate Film,"None found, add some","None found, add some",Unknown,"Action, Adventure, Comedy",4 min. per ep.,G - All Ages,1,Super Power,Kids
137,Kidou Senshi Gundam: Suisei no Majo Season 2 Recap,Mobile Suit Gundam: The Witch from Mercury Season 2 Recap,6.20,13539,8458,1,TV Special,1,Finished Airing,"May 14, 2023",,,"None found, add some","None found, add some",Sunrise,Original,"Action, Sci-Fi",24 min.,R - 17+ (violence & profanity),3,"Mecha, School, Space",
138,Konpeki no Kantai: Sourai Kaihatsu Monogatari,,6.20,15543,8459,578,Special,1,Finished Airing,1997,,,"None found, add some","None found, add some",J.C.Staff,Unknown,,39 min.,None,0,"Historical, Military",
139,Kuruneko: Kurunekobin,,6.20,15782,8460,545,Special,4,Finished Airing,"Dec 18, 2009 to Sep 3, 2010",,,"Kadokawa Pictures Japan,       Kansai Telecasting,       Tokai Television","None found, add some",DAX Production,Manga,"Comedy, Slice of Life",7 min. per ep.,G - All Ages,0,Pets,
140,Mahou no Star Magical Emi: Kumo Hikaru,,6.20,12385,8461,1,OVA,1,Finished Airing,"May 25, 2002",,,"None found, add some","None found, add some",Ajia-do,Original,"Comedy, Slice of Life",14 min.,G - All Ages,1,Mahou Shoujo,
141,Maicching Machiko-sensei,Miss Machiko,6.20,9087,8462,4,TV,95,Finished Airing,"Oct 8, 1981 to Oct 6, 1983",Fall 1981,Thursdays at 19:30 (JST),TV Tokyo,Discotek Media,Pierrot,Manga,"Comedy, Ecchi",25 min. per ep.,R+ - Mild Nudity,10,School,
142,Majutsushi Orphen Hagure Tabi: Kimluck-hen,Sorcerous Stabber Orphen: Battle of Kimluck,6.20,4126,8463,29,TV,11,Finished Airing,"Jan 20, 2021 to Mar 31, 2021",Winter 2021,Wednesdays at 21:00 (JST),"Genco,       Lantis,       MediaNet Pictures",Funimation,Studio Deen,Light novel,"Action, Adventure, Drama, Fantasy",23 min. per ep.,PG-13 - Teens 13 or older,87,Martial Arts,
