Name,English_title,Score,Popularity,Rank,Members,Type,Episodes,Status,Aired,Premiered,Broadcast,Producers,Licensors,Studios,Source,Genres,Duration,Rating,Favorites,Themes,Demographics
Nandaka Velonica,,5.95,12378,9733,1,TV,10,Finished Airing,"Mar 10, 2014 to Mar 21, 2014",Winter 2014,Not scheduled once per week,NHK,"None found, add some",Cyclone Graphics,Original,"Comedy, Fantasy",10 min. per ep.,G - All Ages,0,,Kids
Ninja Hattori-kun Plus Perman: Ninja Kaijuu Jippou tai Miracle Tamago,,5.95,14634,9734,739,Movie,1,Finished Airing,16-Mar-85,,,"None found, add some","None found, add some",Shin-Ei Animation,Unknown,"Adventure, Comedy, Sci-Fi",50 min.,G - All Ages,0,"Martial Arts, Super Power",
Ohayou! Spank (Movie),,5.95,14295,9735,821,Movie,1,Finished Airing,13-Mar-82,,,"None found, add some","None found, add some",TMS Entertainment,Unknown,"Comedy, Romance, Slice of Life",1 hr. 39 min.,G - All Ages,1,,
Patalliro Saiyuuki! Special,,5.95,13614,9736,1,Special,1,Finished Airing,25-Jan-06,,,"None found, add some","None found, add some",Magic Bus,Manga,"Adventure, Boys Love, Comedy, Fantasy",9 min.,PG-13 - Teens 13 or older,0,,Shoujo
Play Ball,,5.95,12494,9737,1,TV,13,Finished Airing,"Jul 5, 2005 to Sep 27, 2005",Summer 2005,Unknown,Magic Bus,"None found, add some",Eiken,Manga,Sports,24 min. per ep.,G - All Ages,1,Team Sports,Shounen
Pochacco no Wakuwaku Birthday,Pochacco in Exciting Birthday,5.95,16941,9738,427,OVA,1,Finished Airing,21-Oct-93,,,Sanrio,"None found, add some","None found, add some",Unknown,Fantasy,20 min.,G - All Ages,1,,Kids
Pokemon Anime Chou Hyakka: Pokemon Kingin Zukan Super Select,,5.95,16258,9739,493,OVA,1,Finished Airing,2000,,,"None found, add some","None found, add some","None found, add some",Game,"Adventure, Comedy",20 min.,PG - Children,0,,Kids
Saru Getchu: On Air 2nd,,5.95,14625,9740,740,TV,51,Finished Airing,"Oct 7, 2006 to Sep 29, 2007",Fall 2006,Unknown,"None found, add some","None found, add some",Xebec,Game,"Adventure, Comedy, Fantasy, Romance",10 min. per ep.,PG - Children,3,,Kids
Shuumatsu no Walküre II Mini Anime,,5.95,14209,9741,842,ONA,18,Finished Airing,"Apr 13, 2023 to Nov 23, 2023",,,"None found, add some","None found, add some",AQUA ARIS,Manga,Comedy,2 min. per ep.,PG-13 - Teens 13 or older,1,,
Sin: Nanatsu no Taizai Zange-roku,,5.95,5454,9742,15,ONA,12,Finished Airing,"Apr 14, 2017 to Jul 31, 2017",,,"None found, add some","None found, add some","Artland,       TNK",Other,"Fantasy, Ecchi",1 min. per ep.,R+ - Mild Nudity,21,,
Sore Ike! Anpanman: Kirakira Boshi no Namida,Go! Anpanman: The Shining Star's Tear,5.95,14622,9743,741,Movie,1,Finished Airing,03-Nov-89,,,"None found, add some","None found, add some","None found, add some",Unknown,"Adventure, Comedy",1 hr. 14 min.,PG - Children,1,Super Power,Kids
Sore Ike! Anpanman: Ruby no Negai,,5.95,14327,9744,816,Movie,1,Finished Airing,12-Jul-03,,,"None found, add some","None found, add some","None found, add some",Unknown,Comedy,51 min.,PG - Children,1,,Kids
Sugar Bunnies,,5.95,12638,9745,1,TV,26,Finished Airing,"Apr 3, 2007 to Sep 25, 2007",Spring 2007,Unknown,Sanrio,"None found, add some",Asahi Production,Unknown,,11 min. per ep.,G - All Ages,6,,Kids
Sugar Bunnies Fleur,,5.95,14084,9746,874,TV,26,Finished Airing,"Apr 7, 2009 to Sep 29, 2009",Spring 2009,Unknown,Sanrio,"None found, add some",Asahi Production,Unknown,,11 min. per ep.,PG - Children,2,,Kids
Takane no Jitensha,Takane's Bicycle,5.95,10697,9747,2,TV Special,1,Finished Airing,06-Jul-08,,,Imagine,"None found, add some",A-1 Pictures,Unknown,Fantasy,24 min.,G - All Ages,0,School,
Town Workers,,5.95,14186,9748,849,ONA,3,Finished Airing,18-Sep-14,,,"None found, add some","None found, add some",Rockwell Eyes,Original,Slice of Life,6 min. per ep.,PG-13 - Teens 13 or older,1,,
Track City,,5.95,12448,9749,1,TV,26,Finished Airing,"Jan 5, 2000 to May 30, 2002",Winter 2000,Unknown,"None found, add some","None found, add some",SBS TV Production,Unknown,Action,24 min. per ep.,PG - Children,0,Racing,
TV Yarou Nanaana: Kaibutsu Kraken wo Oe!,,5.95,12487,9750,1,TV,24,Finished Airing,"Apr 16, 2020 to Sep 24, 2020",Spring 2020,Thursdays at 19:53 (JST),TV Tokyo,"None found, add some",Studio Crocodile,Original,"Adventure, Comedy",3 min. per ep.,PG-13 - Teens 13 or older,2,,
Twin Angel Break,Twin Angels Break,5.95,5622,9751,14,TV,12,Finished Airing,"Apr 7, 2017 to Jun 23, 2017",Spring 2017,Fridays at 22:00 (JST),"Sammy,       Kadokawa","None found, add some",J.C.Staff,Game,Fantasy,23 min. per ep.,PG-13 - Teens 13 or older,19,Mahou Shoujo,
Wind: A Breath of Heart,,5.95,10232,9752,2,OVA,1,Finished Airing,27-Dec-02,,,Audio Tanaka,"None found, add some",Ajia-do,Visual novel,Comedy,16 min.,PG-13 - Teens 13 or older,0,School,
Xia Lan,,5.95,14290,9753,822,TV,156,Finished Airing,"Jan 29, 2012 to Jul 15, 2016",Winter 2012,Sundays at Unknown,"None found, add some","None found, add some",Rocen,Original,"Action, Adventure, Drama, Fantasy, Supernatural",25 min. per ep.,PG-13 - Teens 13 or older,2,"Historical, Martial Arts",
Yagami-kun no Katei no Jijou,,5.95,11208,9754,2,OVA,3,Finished Airing,25-May-90,,,Kitty Films,"None found, add some","Production I.G,       Kitty Film Mitaka Studio",Manga,Comedy,28 min. per ep.,PG-13 - Teens 13 or older,2,,
Zuori Qing Kong Pilot,Crystal Sky of Yesterday,5.95,12401,9755,1,ONA,1,Finished Airing,21-Jan-14,,,"None found, add some","None found, add some",Seven Stone Entertainment,Manga,"Drama, Romance, Slice of Life",4 min.,PG-13 - Teens 13 or older,1,School,
100-man-nen Chikyuu no Tabi: Bander Book,One-Million Year Trip: Bander Book,5.95,11007,9756,2,TV Special,1,Finished Airing,27-Aug-78,,,Nippon Television Network,"None found, add some",Tezuka Productions,Original,Sci-Fi,1 hr. 34 min.,R+ - Mild Nudity,3,,
AIKa,Agent AIKa,5.95,3718,9757,36,OVA,7,Finished Airing,"Apr 25, 1997 to Apr 25, 1999",,,Bandai Visual,"Bandai Entertainment,       Central Park Media",Studio Fantasia,Original,"Action, Adventure, Comedy, Sci-Fi, Ecchi",27 min. per ep.,R+ - Mild Nudity,64,,
Bakuen Campus Guardress,,5.95,9149,9758,4,OVA,4,Finished Airing,"May 27, 1994 to Nov 25, 1994",,,Shueisha,"None found, add some",Production I.G,Original,"Action, Comedy, Supernatural",30 min. per ep.,R+ - Mild Nudity,11,School,
Bernard-jou Iwaku.,Miss Bernard said.,5.95,4612,9759,22,TV,12,Finished Airing,"Oct 7, 2016 to Dec 23, 2016",Fall 2016,Fridays at 01:00 (JST),"DAX Production,       Dream Creation,       Gen'ei","None found, add some",Creators in Pack,Manga,Comedy,3 min. per ep.,PG-13 - Teens 13 or older,25,School,
Bonobono,,5.95,14894,9760,678,Movie,1,Finished Airing,13-Nov-93,,,"None found, add some","None found, add some",Group TAC,4-koma manga,Comedy,1 hr. 43 min.,G - All Ages,2,Anthropomorphic,
Bremen 4: Jigoku no Naka no Tenshi-tachi,Bremen 4,5.95,12446,9761,1,TV Special,1,Finished Airing,23-Aug-81,,,"None found, add some","None found, add some",Tezuka Productions,Unknown,Adventure,1 hr. 30 min.,G - All Ages,1,Anthropomorphic,Kids
Chocomatsu-san: Valentine's Day-hen,,5.95,12081,9762,1,ONA,3,Finished Airing,"Feb 13, 2021 to Feb 15, 2021",,,"None found, add some","None found, add some",Pierrot,Other,Comedy,4 min. per ep.,PG-13 - Teens 13 or older,4,Parody,
Choujin Locke: Shinsekai Sentai,Locke the Superman: New World Command,5.95,11959,9763,1,OVA,2,Finished Airing,"Aug 22, 1991 to Oct 24, 1991",,,Bandai,"None found, add some",Nippon Animation,Manga,"Action, Sci-Fi",50 min. per ep.,PG-13 - Teens 13 or older,0,Super Power,
Dou Hun Wei Zhi Xuan Yue Qiyuan,Spirit Guardians,5.95,13733,9764,970,ONA,12,Finished Airing,"Jun 19, 2018 to Sep 4, 2018",,,"None found, add some","None found, add some",Yi Chen Animation,Original,"Adventure, Fantasy",19 min. per ep.,PG-13 - Teens 13 or older,3,,
Ebiten: Kouritsu Ebisugawa Koukou Tenmonbu Specials,,5.95,8497,9765,5,Special,5,Finished Airing,"Nov 30, 2012 to Mar 29, 2013",,,AIC,Sentai Filmworks,AIC Classic,Manga,"Comedy, Ecchi",4 min. per ep.,R+ - Mild Nudity,3,"Parody, School",Shounen
Fire Emblem Heroes - Book V Ending Movie,,5.95,18509,9766,312,ONA,1,Finished Airing,28-Nov-21,,,"None found, add some","None found, add some",Anima,Game,Fantasy,3 min.,PG-13 - Teens 13 or older,3,,
Garugaku. II: Lucky Stars,,5.95,12371,9767,1,TV,50,Finished Airing,"Jan 10, 2022 to Mar 18, 2022",Winter 2022,Not scheduled once per week,"None found, add some","None found, add some",OLM,Mixed media,,3 min. per ep.,PG-13 - Teens 13 or older,11,"Idols (Female), Music, School",
gdgd Fairies 2 Episode 0,,5.95,13900,9768,919,Special,1,Finished Airing,28-Dec-12,,,"Strawberry Meets Pictures,       Bouncy","None found, add some","None found, add some",Original,"Comedy, Fantasy",14 min.,PG - Children,0,,
Gensou Jotan Ellcia,Ellcia,5.95,10005,9769,3,OVA,4,Finished Airing,"Oct 23, 1992 to Sep 23, 1993",,,"None found, add some",ADV Films,J.C.Staff,Original,"Adventure, Fantasy",41 min. per ep.,PG-13 - Teens 13 or older,1,,
Grimms Notes The Animation,,5.95,3340,9770,44,TV,12,Finished Airing,"Jan 11, 2019 to Mar 29, 2019",Winter 2019,Fridays at 01:58 (JST),"Square Enix,       Pony Canyon,       Avex Pictures",Sentai Filmworks,Brain's Base,Game,"Action, Adventure, Fantasy",24 min. per ep.,PG-13 - Teens 13 or older,61,,
Hallelujah: Unmei no Sentaku,,5.95,12715,9771,1,ONA,1,Finished Airing,28-Sep-20,,,XFLAG,"None found, add some",Yokohama Animation Lab,Game,"Action, Fantasy",54 min.,PG - Children,1,,
Hello Kitty no Match Uri Shoujo,Hello Kitty in The Little Match Girl,5.95,15064,9772,651,OVA,1,Finished Airing,23-Nov-01,,,Sanrio,"None found, add some","None found, add some",Unknown,Fantasy,10 min.,G - All Ages,1,,Kids
Hero Bank,,5.95,10116,9773,2,TV,51,Finished Airing,"Apr 7, 2014 to Mar 30, 2015",Spring 2014,Unknown,"Tokyo Movie Shinsha,       Sega,       TMS Music","None found, add some",TMS Entertainment,Game,,23 min. per ep.,PG - Children,10,Strategy Game,Kids
Hidari no O'Clock!!,,5.95,14062,9774,875,OVA,2,Finished Airing,05-Feb-90,,,"None found, add some","None found, add some",Toei Animation,Unknown,Drama,40 min. per ep.,PG-13 - Teens 13 or older,0,,
Isekai Maou to Shoukan Shoujo no Dorei Majutsu Ω Mini Anime,,5.95,8045,9775,5,ONA,18,Finished Airing,"Mar 14, 2021 to Jun 16, 2021",,,Half H.P Studio,"None found, add some","AQUA ARIS,       Magma Studio",Light novel,Comedy,1 min. per ep.,PG-13 - Teens 13 or older,15,Isekai,
Jiu Se Lu,,5.95,12106,9776,1,Movie,1,Finished Airing,1981,,,Shanghai Animation Film Studio,"None found, add some","None found, add some",Other,Supernatural,25 min.,G - All Ages,2,,
3 Choume no Tama: Onegai! Momo-chan wo Sagashite!!,,5.94,13865,9777,931,Movie,1,Finished Airing,14-Aug-93,,,Group TAC,"None found, add some","None found, add some",Unknown,Adventure,43 min.,G - All Ages,3,Pets,Kids
A Tang Qi Yu,Toys & Pets,5.94,17004,9778,421,Movie,1,Finished Airing,21-Jul-17,,,"None found, add some","None found, add some",Light Chaser Animation Studios,Original,"Adventure, Comedy",1 hr. 39 min.,G - All Ages,0,,Kids
Agigongryong Doolie (2009),Little Dino Dooly (2009),5.94,16136,9779,505,TV,26,Finished Airing,"Jan 8, 2009 to Feb 7, 2009",Winter 2009,Unknown,"None found, add some","None found, add some","None found, add some",Unknown,Adventure,20 min. per ep.,PG - Children,1,,Kids
Bai Gui Youeryuan,Hundred Spirits Kindergarten,5.94,15610,9780,568,ONA,10,Finished Airing,"Jul 14, 2018 to Sep 15, 2018",,,"None found, add some","None found, add some",Painting Dream,Manga,Comedy,4 min. per ep.,PG-13 - Teens 13 or older,0,,
Bio Hunter,,5.94,5388,9781,15,OVA,1,Finished Airing,08-Dec-95,,,BMG Japan,Urban Vision,Madhouse,Manga,"Action, Horror",58 min.,R+ - Mild Nudity,13,"Gore, Mythology",Seinen
Black★★Rock Shooter:  Dawn Fall,,5.94,3468,9782,41,TV,12,Finished Airing,"Apr 3, 2022 to Jun 19, 2022",Spring 2022,Sundays at 23:00 (JST),Unlimited Produce by TMS,"None found, add some","Bibury Animation Studios,       Bibury Animation CG",Other,"Action, Drama",23 min. per ep.,PG-13 - Teens 13 or older,346,Super Power,
Candy.zip,,5.94,15022,9783,661,Movie,1,Finished Airing,2017,,,Geidai Animation,"None found, add some","None found, add some",Original,Award Winning,4 min.,PG-13 - Teens 13 or older,0,,
Chinzei Hachirou Tametomo,,5.94,14636,9784,739,ONA,1,Finished Airing,10-Dec-20,,,"Sony Music Entertainment,       Hakuhodo,       Kamimine-chou","None found, add some",Production I.G,Original,"Action, Adventure, Comedy",4 min.,PG-13 - Teens 13 or older,0,Historical,
Cinderella Girls Gekijou: 5-shuunen Kinen Short Anime,,5.94,11241,9785,2,ONA,1,Finished Airing,28-Nov-16,,,"None found, add some","None found, add some",Gathering,Game,Comedy,3 min.,PG-13 - Teens 13 or older,0,,
Dorei-ku The Animation,,5.94,2773,9786,63,TV,12,Finished Airing,"Apr 13, 2018 to Jun 29, 2018",Spring 2018,Fridays at 01:00 (JST),"Hakuhodo DY Music & Pictures,       Futabasha,       Hakuhodo,       Kakao Japan,       Spacey Music Entertainment,       A-Craft,       Tohan Corporation",Sentai Filmworks,"TNK,       Zero-G",Web manga,"Drama, Suspense",24 min. per ep.,R - 17+ (violence & profanity),74,"Adult Cast, High Stakes Game, Psychological",
Eightman,8 Man,5.94,10877,9787,2,TV,56,Finished Airing,"Nov 7, 1963 to Dec 24, 1964",Fall 1963,Unknown,Nippon Animation,"None found, add some",TCJ,Manga,"Action, Drama, Sci-Fi",23 min. per ep.,PG-13 - Teens 13 or older,4,Mecha,
First Squad: The Moment of Truth,,5.94,3507,9788,41,Movie,1,Finished Airing,13-May-09,,,"None found, add some","Anchor Bay Films,       Manga Entertainment",Studio 4°C,Original,"Action, Supernatural",1 hr. 13 min.,R - 17+ (violence & profanity),58,"Historical, Military, Super Power",
Future Card Buddyfight Recap,,5.94,13969,9789,903,TV Special,1,Finished Airing,14-Jun-14,,,Bushiroad,"None found, add some","Xebec,       OLM",Card game,,24 min.,PG - Children,0,Strategy Game,
Ghost Messenger Movie,,5.94,12788,9790,1,Movie,1,Finished Airing,22-May-14,,,"None found, add some","None found, add some",Studio Animal,Unknown,"Action, Supernatural",1 hr. 18 min.,PG-13 - Teens 13 or older,0,,
Goulart Knights: Evoked the Beginning White,,5.94,9901,9791,3,OVA,1,Finished Airing,26-Sep-11,,,Lantis,"None found, add some",Studio Blanc.,Original,"Action, Drama, Fantasy",22 min.,PG-13 - Teens 13 or older,4,,
Gun-dou Musashi Recap,Gun Samurai Recap,5.94,15126,9792,641,TV Special,1,Finished Airing,25-Jun-06,,,TBS,"None found, add some",ACC Production,Original,"Adventure, Fantasy",25 min.,PG-13 - Teens 13 or older,0,Samurai,
Hana wa Saku: Touhoku ni Saku,Flowers Will Bloom In Tohoku,5.94,12878,9793,1,TV Special,1,Finished Airing,08-Sep-14,,,"NHK,       Cyclone Graphics","None found, add some","None found, add some",Other,Fantasy,5 min.,G - All Ages,1,,Kids
Haou Taikei Ryuu Knight: Adeu Legend II,Lord of Lords Ryu Knight: Adeu's Legend II,5.94,12755,9794,1,OVA,3,Finished Airing,"Dec 18, 1995 to Apr 25, 1996",,,"None found, add some","None found, add some",Sunrise,Unknown,"Action, Adventure, Fantasy",30 min. per ep.,PG-13 - Teens 13 or older,1,Mecha,
Hello Kitty no Hansel to Gretel,Hello Kitty & Dear Daniel in Hansel & Gretel,5.94,14941,9795,675,OVA,1,Finished Airing,24-Aug-01,,,Sanrio,"None found, add some","None found, add some",Unknown,Fantasy,15 min.,G - All Ages,1,,Kids
Hello Kitty no Yuki no Joou,Hello Kitty and Dear Daniel in The Snow Queen,5.94,14737,9796,713,OVA,1,Finished Airing,21-Dec-01,,,Sanrio,"None found, add some","None found, add some",Unknown,Fantasy,14 min.,G - All Ages,1,,Kids
Hokuto no Ken: Legend of Heroes,,5.94,9249,9797,3,Special,1,Finished Airing,2007,,,"None found, add some","None found, add some",Toei Animation,Manga,Action,6 min.,PG-13 - Teens 13 or older,4,Martial Arts,
Indie Anibox: Selma Danbaekjil Coffee,Indie Anibox: Selma's Protein Coffee,5.94,9725,9798,3,Movie,1,Finished Airing,20-Jun-08,,,"KOCCA Animation Studio,       Arc Studio","None found, add some",Studio Dadashow,Unknown,"Comedy, Drama, Romance, Sci-Fi",1 hr. 15 min.,G - All Ages,6,Samurai,
Jack to Mame no Ki (OVA),,5.94,12443,9799,1,OVA,1,Finished Airing,1989,,,"None found, add some","None found, add some",Studio 4°C,Unknown,"Adventure, Fantasy",13 min.,PG - Children,0,,Kids
"Kanojo, Okarishimasu Petit",Rent-a-Girlfriend Petit,5.94,4811,9800,20,ONA,14,Finished Airing,"Jul 17, 2020 to Oct 1, 2020",,,Jinnan Studio,"None found, add some",AQUA ARIS,Manga,Comedy,1 min. per ep.,PG-13 - Teens 13 or older,49,,
Kashou no Tsuki: Aki Kyougen,,5.94,8426,9801,5,OVA,2,Finished Airing,"Dec 19, 1998 to Jan 21, 1999",,,SME Visual Works,"None found, add some","Tokyo Kids,       Four Some",Manga,"Romance, Supernatural",30 min. per ep.,PG-13 - Teens 13 or older,6,Historical,Shoujo
Kemono to Chat,,5.94,11158,9802,2,OVA,1,Finished Airing,23-Oct-09,,,Usagi Ou,"None found, add some",Indeprox,4-koma manga,Comedy,28 min.,PG-13 - Teens 13 or older,0,,
Kidou Senshi Gundam 0083: Stardust Memory - Uchuu no Kagerou,Mobile Suit Gundam 0083: Stardust Memory - The Mayfly of Space,5.94,7428,9803,7,Special,1,Finished Airing,1992,,,"None found, add some","None found, add some",Sunrise,Radio,"Action, Drama, Sci-Fi",3 min.,PG-13 - Teens 13 or older,3,"Mecha, Military, Space",
Kiki to Lala no Mamatte Suteki!,,5.94,17192,9804,408,OVA,1,Finished Airing,21-Jun-95,,,Sanrio,"None found, add some","None found, add some",Unknown,,27 min.,G - All Ages,1,,Kids
Manga Nippon Mukashibanashi (Movie),,5.94,15794,9805,544,Movie,1,Finished Airing,13-Mar-82,,,"None found, add some","None found, add some","None found, add some",Unknown,,12 min.,G - All Ages,0,Historical,
Megumi,,5.94,10960,9806,2,ONA,1,Finished Airing,28-Mar-08,,,"None found, add some","None found, add some",Trans Arts,Other,,25 min.,G - All Ages,1,Historical,
MonHun Nikki Girigiri Airou Mura G,Monster Hunter Diary: Felyne Village on the Edge G,5.94,14477,9807,778,TV,13,Finished Airing,"Jul 1, 2011 to Sep 29, 2011",Summer 2011,Unknown,"None found, add some","None found, add some",DLE,Game,"Action, Comedy",3 min. per ep.,G - All Ages,0,,
Mori no Andou,,5.94,10026,9808,3,ONA,1,Finished Airing,Jan-06,,,"None found, add some","None found, add some","None found, add some",Original,Comedy,5 min.,PG - Children,37,,
Pachislo Kizoku Gin,,5.94,12594,9809,1,TV,23,Finished Airing,"Apr 12, 2001 to Sep 20, 2001",Spring 2001,Unknown,"Actas,       Yomiko Advertising,       Fuji TV","None found, add some",A-Line,Manga,"Action, Suspense",22 min. per ep.,,0,"High Stakes Game, Strategy Game",
Samurai Gun,,5.94,6479,9810,9,TV,12,Finished Airing,"Oct 4, 2004 to Dec 14, 2004",Fall 2004,Unknown,"Avex Entertainment,       TV Asahi",ADV Films,Studio Egg,Manga,Action,24 min. per ep.,R - 17+ (violence & profanity),9,Historical,Seinen
Seihou Tenshi Angel Links,Angel Links,5.94,6423,9811,10,TV,13,Finished Airing,"Apr 7, 1999 to Jun 30, 1999",Spring 1999,Wednesdays at 19:00 (JST),"None found, add some","Funimation,       Bandai Entertainment",Sunrise,Novel,"Action, Adventure, Comedy, Drama, Romance, Sci-Fi",24 min. per ep.,PG-13 - Teens 13 or older,7,Space,
Seikon no Qwaser Picture Drama,The Qwaser Of Stigmata Picture Drama,5.94,5156,9812,17,Special,16,Finished Airing,"Apr 21, 2010 to Nov 24, 2010",,,TAKI Corporation,"None found, add some",Hoods Entertainment,Manga,Ecchi,2 min. per ep.,R+ - Mild Nudity,10,,Seinen
Sengoku Kitan Youtouden Movie,Wrath of the Ninja,5.94,8085,9813,5,Movie,1,Finished Airing,27-May-89,,,"None found, add some",Central Park Media,J.C.Staff,Unknown,Action,1 hr. 26 min.,R - 17+ (violence & profanity),6,"Martial Arts, Samurai",
Sengoku Majin Goushougun (Movie),,5.94,13067,9814,1,Movie,1,Finished Airing,24-Apr-82,,,"None found, add some","None found, add some",Ashi Productions,Unknown,Sci-Fi,1 hr. 5 min.,,1,"Mecha, Parody",
Shinmai Renkinjutsushi no Tenpo Keiei Mini Anime,,5.94,13932,9815,910,ONA,13,Finished Airing,"Sep 30, 2022 to Dec 23, 2022",,,"None found, add some","None found, add some",ENGI,Light novel,"Comedy, Fantasy",30 sec. per ep.,PG-13 - Teens 13 or older,1,,
Shoka,,5.94,8242,9816,5,TV Special,1,Finished Airing,27-Mar-10,,,"None found, add some","None found, add some",Production I.G,Original,"Action, Fantasy",24 min.,PG-13 - Teens 13 or older,0,Historical,
Shounen Ashibe: Go! Go! Goma-chan 2,,5.94,13121,9817,1,TV,32,Finished Airing,"Apr 4, 2017 to Feb 13, 2018",Spring 2017,Unknown,"None found, add some","None found, add some","Bridge,       Husio Studio",4-koma manga,"Comedy, Slice of Life",9 min. per ep.,G - All Ages,2,Pets,Seinen
True Love Story,"True Love Story Summer Days, and yet...",5.94,8308,9818,5,OVA,3,Finished Airing,"Sep 26, 2003 to Apr 23, 2004",,,KSS,"None found, add some","Picture Magic,       A-Line",Visual novel,Romance,25 min. per ep.,PG-13 - Teens 13 or older,4,,
Tsuritama: Harikitte Contest,,5.94,9696,9819,3,Special,1,Finished Airing,21-Nov-12,,,"None found, add some","None found, add some",A-1 Pictures,Original,"Comedy, Sci-Fi, Slice of Life, Sports",18 min.,PG-13 - Teens 13 or older,4,,
Vampiyan Kids,,5.94,13073,9820,1,TV,23,Finished Airing,"Oct 13, 2001 to Mar 30, 2002",Fall 2001,Saturdays at 18:30 (JST),Fuji TV,"None found, add some",Production I.G,Original,"Comedy, Fantasy",23 min. per ep.,G - All Ages,2,,Kids
Shounen Ashibe (TV),,5.93,14191,9821,845,TV,37,Finished Airing,"Apr 11, 1991 to Dec 28, 1991",Spring 1991,Thursdays at 19:00 (JST),TBS,"None found, add some",Life Work,4-koma manga,"Comedy, Slice of Life",25 min. per ep.,G - All Ages,1,Pets,Seinen
Suki na Ko ga Megane wo Wasureta Short Episode,The Girl I Like Forgot Her Glasses Short Episode,5.93,13149,9822,1,ONA,4,Finished Airing,"Jul 31, 2023 to Sep 24, 2023",,,"None found, add some","None found, add some",GoHands,Manga,Comedy,46 sec. per ep.,PG-13 - Teens 13 or older,1,"Romantic Subtext, School",Shounen
Sword Art Online Fatal Bullet: The Third Episode - Pilot-ban,Sword Art Online Fatal Bullet: The Third Episode - Pilot,5.93,5307,9823,16,ONA,1,Finished Airing,08-Feb-18,,,Bandai Namco Entertainment,"None found, add some","None found, add some",Game,,3 min.,PG-13 - Teens 13 or older,43,Video Game,
Turning Mecard W Season 2,,5.93,15737,9824,552,TV,26,Finished Airing,"Mar 2, 2017 to Aug 24, 2017",Spring 2017,Thursdays at 17:00 (JST),"None found, add some","None found, add some","None found, add some",Unknown,Adventure,28 min. per ep.,PG - Children,2,"Mecha, Racing, Strategy Game",Kids
Warau Salesman Episode 0,,5.93,13150,9825,1,Special,1,Finished Airing,10-Oct-89,,,"None found, add some","None found, add some",Shin-Ei Animation,Manga,Supernatural,4 min.,PG-13 - Teens 13 or older,1,"Adult Cast, Psychological",Seinen
White Album 2 Picture Drama,,5.93,7208,9826,7,Special,2,Finished Airing,28-May-14,,,Starchild Records,"None found, add some",Satelight,Visual novel,"Drama, Ecchi",6 min. per ep.,R+ - Mild Nudity,5,,
Assassins Pride,,5.93,686,9827,345,TV,12,Finished Airing,"Oct 10, 2019 to Dec 26, 2019",Fall 2019,Thursdays at 23:30 (JST),"Sotsu,       AT-X,       KlockWorx,       Nippon Television Network,       Tokyo MX,       Avex Pictures,       GYAO!,       Kadokawa,       KLab,       entama",Sentai Filmworks,EMT Squared,Light novel,Fantasy,24 min. per ep.,PG-13 - Teens 13 or older,774,,
Bai Niao,,5.93,14635,9828,739,Movie,1,Finished Airing,13-Jun-17,,,"None found, add some","None found, add some","None found, add some",Unknown,,13 min.,G - All Ages,0,,
Balala Xiao Mo Xian: Feiyue Cai Ling Bao 2nd Season,Balala the Faries: Over the Rainbow Season 2,5.93,14157,9829,856,TV,26,Finished Airing,"May 9, 2017 to Jun 3, 2017",Spring 2017,Not scheduled once per week,"B.CMAY PICTURES,       Alpha Group Co. Ltd.","None found, add some",Qianqi Animation,Original,"Comedy, Fantasy",22 min. per ep.,PG - Children,2,Mahou Shoujo,
Bannou Yasai Ninninman,,5.93,8033,9830,5,Movie,1,Finished Airing,05-Mar-11,,,"None found, add some","None found, add some",P.A. Works,Original,"Comedy, Supernatural",24 min.,PG - Children,1,,
Bikkuriman 2000,,5.93,13870,9831,928,TV,68,Finished Airing,"Nov 1, 1999 to Feb 22, 2001",Fall 1999,Mondays at 18:30 (JST),Studio Comet,"None found, add some","None found, add some",Unknown,"Adventure, Fantasy",24 min. per ep.,G - All Ages,1,,Kids
Birth,,5.93,7125,9832,7,OVA,1,Finished Airing,21-Jul-84,,,"Victor Entertainment,       Harmony Gold","ADV Films,       Streamline Pictures","Kaname Productions,       Idol",Manga,"Action, Adventure, Comedy, Sci-Fi",1 hr. 19 min.,PG-13 - Teens 13 or older,20,,
Bus Tei Nite...,,5.93,17823,9833,362,Movie,1,Finished Airing,1980,,,"None found, add some","None found, add some","None found, add some",Original,Comedy,18 sec.,G - All Ages,0,,
Chain Chronicle: Short Animation,,5.93,6201,9834,10,OVA,8,Finished Airing,"Sep 6, 2014 to Dec 18, 2014",,,"Sotsu,       Sega","None found, add some",Jumonji,Game,"Action, Adventure, Fantasy",5 min. per ep.,PG-13 - Teens 13 or older,7,,
Cyborg 009: Kaijuu Sensou,Cyborg 009 and the Monster Wars,5.93,10463,9835,2,Movie,1,Finished Airing,19-Mar-67,,,"None found, add some","None found, add some",Toei Animation,Unknown,"Action, Adventure, Sci-Fi",1 hr.,PG - Children,1,,
Detatoko Princess,Suddenly Princess,5.93,8943,9836,4,OVA,3,Finished Airing,"Dec 1, 1997 to May 21, 1998",,,"None found, add some",Media Blasters,J.C.Staff,Manga,"Comedy, Fantasy",30 min. per ep.,PG-13 - Teens 13 or older,5,,
Dorami-chan: Aoi Straw Hat,,5.93,16185,9837,500,Movie,1,Finished Airing,12-Mar-94,,,"None found, add some","None found, add some","None found, add some",Unknown,Fantasy,15 min.,G - All Ages,0,,Kids
Futsuu tte Nandarou?,,5.93,16266,9838,492,Special,8,Finished Airing,"Nov 11, 2018 to Apr 9, 2019",,,"None found, add some","None found, add some","None found, add some",Original,Slice of Life,2 min. per ep.,G - All Ages,0,,
Getsumen to Heiki Mina Specials,,5.93,12061,9839,1,Special,2,Finished Airing,"Jun 6, 2007 to Aug 1, 2007",,,"None found, add some","None found, add some",Gonzo,Other,"Action, Comedy, Sci-Fi, Ecchi",22 min. per ep.,PG-13 - Teens 13 or older,0,"Parody, Super Power",
