Name,English_title,Score,Popularity,Rank,Members,Type,Episodes,Status,Aired,Premiered,Broadcast,Producers,Licensors,Studios,Source,Genres,Themes,Duration,Rating,Favorites,Demographics
Little Witch Academia (TV),Little Witch Academia,7.81,330,954,649,TV,25,Finished Airing,"Jan 9, 2017 to Jun 26, 2017",Winter 2017,Mondays at 00:00 (JST),"Ultra Super Pictures,       TOHO animation,       Good Smile Company","None found, add some",Trigger,Original,"Adventure, Comedy, Fantasy",School,24 min. per ep.,G - All Ages,"7,665",
Mairimashita! Iruma-kun 3rd Season,Welcome to Demon School! Iruma-kun Season 3,7.81,1252,956,192,TV,21,Finished Airing,"Oct 8, 2022 to Mar 4, 2023",Fall 2022,Saturdays at 18:25 (JST),"NHK,       NHK Enterprises","None found, add some",Bandai Namco Pictures,Manga,"Comedy, Fantasy","Isekai, School",24 min. per ep.,PG-13 - Teens 13 or older,"1,260",Shounen
Shanhe Jian Xin,Thousand Autumns,7.82,6367,951,10,ONA,16,Finished Airing,"Feb 8, 2021 to Mar 15, 2021",,,"Tencent Penguin Pictures,       Bytehoo","None found, add some",Motion Magic,Novel,"Action, Fantasy","Historical, Martial Arts",25 min. per ep.,PG-13 - Teens 13 or older,186,
Lupin III: The First,,7.81,3895,955,33,Movie,1,Finished Airing,"Dec 6, 2019",,,"TOHO,       HOTZIPANG,       Abe Shuuji Jimusho",GKIDS,"TMS Entertainment,       Marza Animation Planet",Manga,"Action, Adventure, Comedy, Mystery",Adult Cast,1 hr. 32 min.,PG-13 - Teens 13 or older,170,Seinen
Jungle wa Itsumo Hare nochi Guu,Haré+Guu,7.81,3802,952,34,TV,26,Finished Airing,"Apr 3, 2001 to Sep 25, 2001",Spring 2001,Tuesdays at 18:00 (JST),"Bandai Visual,       Sotsu","Funimation,       AN Entertainment",Shin-Ei Animation,Manga,"Comedy, Slice of Life","Gag Humor, School",23 min. per ep.,PG-13 - Teens 13 or older,420,Shounen
Kokoro ga Sakebitagatterunda.,The Anthem of the Heart,7.81,718,953,333,Movie,1,Finished Airing,"Sep 19, 2015",,,"Aniplex,       Dentsu,       Fuji TV,       Lawson HMV Entertainment,       Shogakukan",Aniplex of America,A-1 Pictures,Original,"Drama, Romance","Performing Arts, School",1 hr. 59 min.,PG-13 - Teens 13 or older,"1,932",
New Initial D Movie: Legend 2 - Tousou,Initial D Legend 2 Racer,7.81,3998,957,31,Movie,1,Finished Airing,"May 23, 2015",,,"Shochiku,       Kodansha,       Ultra Super Pictures,       Avex Pictures,       Sammy",Sentai Filmworks,"SANZIGEN,       LIDENFILMS",Manga,,Racing,1 hr. 1 min.,PG-13 - Teens 13 or older,47,Seinen
Seto no Hanayome OVA,My Bride is a Mermaid OVA,7.81,3020,959,53,OVA,2,Finished Airing,"Nov 3, 2008 to Jan 5, 2009",,,"None found, add some","None found, add some","Gonzo,       AIC",Manga,"Comedy, Fantasy, Romance, Slice of Life","Parody, School",29 min. per ep.,PG-13 - Teens 13 or older,29,Shounen
Planetarian: Hoshi no Hito,Planetarian: Storyteller of the Stars,7.81,3150,958,49,Movie,1,Finished Airing,"Sep 3, 2016",,,Visual Arts,Funimation,David Production,Visual novel,"Drama, Sci-Fi",,1 hr. 56 min.,PG-13 - Teens 13 or older,214,
Yuanshen: Weixing zhi Lu,Genshin Impact: The Road Not Taken,7.81,12471,961,1,ONA,1,Finished Airing,"May 24, 2024",,,miHoYoAnime,"None found, add some","None found, add some",Game,"Drama, Fantasy","Isekai, Music, Mythology",3 min.,G - All Ages,7,
Yuru Yuri♪♪,YuruYuri: Happy Go Lily ♪♪,7.81,1286,962,187,TV,12,Finished Airing,"Jul 3, 2012 to Sep 18, 2012",Summer 2012,Unknown,"Sotsu,       Pony Canyon,       DAX Production","NIS America, Inc.",Doga Kobo,Manga,"Comedy, Girls Love","CGDCT, Gag Humor, School",23 min. per ep.,PG-13 - Teens 13 or older,964,
Yamada-kun to Lv999 no Koi wo Suru,My Love Story with Yamada-kun at Lv999,7.81,564,960,408,TV,13,Finished Airing,"Apr 2, 2023 to Jun 25, 2023",Spring 2023,Sundays at 00:30 (JST),"Aniplex,       Movic,       Tokyo MX,       BS11,       Egg Firm,       Kadokawa,       COMICSMART",Aniplex of America,Madhouse,Web manga,Romance,Video Game,23 min. per ep.,PG-13 - Teens 13 or older,"4,289",
Eikoku Koi Monogatari Emma: Molders-hen,Emma: A Victorian Romance Season Two,7.81,4223,966,27,TV,12,Finished Airing,"Apr 17, 2007 to Jul 3, 2007",Spring 2007,Unknown,"None found, add some",Nozomi Entertainment,Ajia-do,Manga,"Drama, Romance","Adult Cast, Historical",25 min. per ep.,G - All Ages,111,Seinen
Zom 100: Zombie ni Naru made ni Shitai 100 no Koto,Zom 100: Bucket List of the Dead,7.81,424,963,530,TV,12,Finished Airing,"Jul 9, 2023 to Dec 26, 2023",Summer 2023,Sundays at 17:00 (JST),"Shogakukan-Shueisha Productions,       Shogakukan,       dugout",VIZ Media,BUG FILMS,Manga,"Action, Comedy, Horror, Supernatural, Suspense","Adult Cast, Survival",24 min. per ep.,R - 17+ (violence & profanity),"3,927",Seinen
Bungou Stray Dogs,Bungo Stray Dogs,7.81,92,965,1,TV,12,Finished Airing,"Apr 7, 2016 to Jun 23, 2016",Spring 2016,Thursdays at 01:05 (JST),"Lantis,       Movic,       KlockWorx,       Bandai Namco Live Creative,       Glovision,       Lawson HMV Entertainment,       Sony PCL,       Kadokawa","Funimation,       Crunchyroll",Bones,Manga,"Action, Mystery, Supernatural","Adult Cast, Detective, Organized Crime, Super Power",23 min. per ep.,R - 17+ (violence & profanity),"27,481",Seinen
Aoki Hagane no Arpeggio: Ars Nova Movie 2 - Cadenza,,7.81,3999,964,31,Movie,1,Finished Airing,"Oct 3, 2015",,,Sotsu,"None found, add some",SANZIGEN,Manga,"Action, Sci-Fi",,1 hr. 44 min.,PG-13 - Teens 13 or older,126,Seinen
Enen no Shouboutai: Ni no Shou,Fire Force Season 2,7.81,249,967,776,TV,24,Finished Airing,"Jul 4, 2020 to Dec 12, 2020",Summer 2020,Saturdays at 01:55 (JST),"Mainichi Broadcasting System,       Kodansha,       bilibili,       DMM pictures,       DMM Music",Funimation,David Production,Manga,"Action, Fantasy, Sci-Fi",Super Power,24 min. per ep.,PG-13 - Teens 13 or older,"2,902",Shounen
Flanders no Inu (Movie),The Dog of Flanders,7.81,4633,968,22,Movie,1,Finished Airing,"Mar 15, 1997",,,"Shochiku,       Fuji TV,       Pioneer LDC",Geneon Entertainment USA,Nippon Animation,Novel,Drama,"Historical, Pets, Visual Arts",1 hr. 42 min.,G - All Ages,84,
Hidamari Sketch x ☆☆☆ Specials,,7.81,5390,970,15,Special,2,Finished Airing,"Oct 23, 2010 to Oct 30, 2010",,,"Aniplex,       Lantis,       TBS,       Movic,       Houbunsha",Sentai Filmworks,Shaft,4-koma manga,Slice of Life,"CGDCT, Iyashikei, School, Visual Arts",24 min. per ep.,PG-13 - Teens 13 or older,10,
IDOLiSH7 Movie: LIVE 4bit - BEYOND THE PERiOD,,7.81,9856,971,3,Movie,2,Finished Airing,"May 20, 2023",,,Lantis,"None found, add some",Orange,Game,,"Idols (Male), Music",1 hr. 30 min. per ep.,PG-13 - Teens 13 or older,33,
Goku Sayonara Zetsubou Sensei,Goodbye Mr. Despair OAD,7.81,2727,969,65,OVA,3,Finished Airing,"Oct 17, 2008 to Feb 17, 2009",,,"None found, add some","None found, add some",Shaft,Manga,Comedy,"Gag Humor, Parody, School",25 min. per ep.,R - 17+ (violence & profanity),85,Shounen
Aggressive Retsuko (ONA) 3rd Season,Aggretsuko (ONA) 3rd Season,7.80,2228,972,91,ONA,10,Finished Airing,"Aug 27, 2020",,,"Sanrio,       Netflix","None found, add some",Fanworks,Other,Comedy,"Anthropomorphic, Workplace",16 min. per ep.,PG-13 - Teens 13 or older,259,
Baby Steps,,7.80,1568,973,147,TV,25,Finished Airing,"Apr 6, 2014 to Sep 21, 2014",Spring 2014,Unknown,NHK,"None found, add some",Pierrot,Manga,Sports,School,24 min. per ep.,PG-13 - Teens 13 or older,846,Shounen
Blue Period,,7.80,482,974,468,TV,12,Finished Airing,"Oct 2, 2021 to Dec 18, 2021",Fall 2021,Saturdays at 01:25 (JST),"Mainichi Broadcasting System,       Kodansha,       DMM pictures,       Bit grooove promotion,       DMM Music","None found, add some",Seven Arcs,Manga,Drama,"School, Visual Arts",23 min. per ep.,PG-13 - Teens 13 or older,"6,107",Seinen
Break Blade Movie 5: Shisen no Hate,Broken Blade 5,7.80,2964,975,55,Movie,1,Finished Airing,"Jan 22, 2011",,,KlockWorx,Sentai Filmworks,"Production I.G,       Xebec",Manga,"Action, Fantasy","Adult Cast, Mecha, Military",47 min.,R - 17+ (violence & profanity),28,Shounen
InuYasha Movie 3: Tenka Hadou no Ken,InuYasha the Movie 3: Swords of an Honorable Ruler,7.80,2058,977,102,Movie,1,Finished Airing,"Dec 20, 2003",,,"Kyoto Animation,       Shogakukan-Shueisha Productions,       Yomiuri Telecasting,       Nippon Television Network",VIZ Media,Sunrise,Manga,"Action, Adventure, Fantasy, Romance","Historical, Mythology, Time Travel",1 hr. 38 min.,PG-13 - Teens 13 or older,214,Shounen
Kuroko no Basket: Tip Off,Kuroko's Basketball: Tip Off,7.80,2026,980,105,Special,1,Finished Airing,"Feb 22, 2013",,,"Bandai Visual,       Lantis","None found, add some",Production I.G,Manga,Sports,"School, Team Sports",23 min.,PG-13 - Teens 13 or older,89,Shounen
Kobayashi-san Chi no Maid Dragon S: Nippon no Omotenashi - Attend wa Dragon desu,Miss Kobayashi's Dragon Maid S: Japanese Hospitality (The Attendant is a Dragon),7.80,2517,979,74,Special,1,Finished Airing,"Jan 19, 2022",,,"None found, add some","None found, add some",Kyoto Animation,Manga,"Fantasy, Slice of Life",,23 min.,PG-13 - Teens 13 or older,291,
City Hunter 3,,7.80,4679,976,22,TV,13,Finished Airing,"Oct 15, 1989 to Jan 21, 1990",Fall 1989,Unknown,"None found, add some","ADV Films,       Discotek Media",Sunrise,Manga,"Action, Comedy, Mystery",,24 min. per ep.,PG-13 - Teens 13 or older,50,Shounen
Jormungand,,7.80,650,978,366,TV,12,Finished Airing,"Apr 11, 2012 to Jun 27, 2012",Spring 2012,Wednesdays at 00:30 (JST),"Geneon Universal Entertainment,       Shogakukan-Shueisha Productions",Funimation,White Fox,Manga,"Action, Adventure","Adult Cast, Military, Organized Crime",24 min. per ep.,R+ - Mild Nudity,"3,101",Seinen
Little Witch Academia,,7.80,768,981,313,Movie,1,Finished Airing,"Mar 2, 2013",,,"Half H.P Studio,       Ultra Super Pictures","None found, add some",Trigger,Original,"Adventure, Comedy, Fantasy",School,26 min.,PG-13 - Teens 13 or older,"1,351",
Lucky☆Star: Original na Visual to Animation,Lucky☆Star OVA,7.80,1695,982,133,OVA,1,Finished Airing,"Sep 26, 2008",,,"Kadokawa Shoten,       Movic,       KlockWorx","Funimation,       Bandai Entertainment",Kyoto Animation,4-koma manga,Comedy,"CGDCT, School, Video Game",42 min.,PG-13 - Teens 13 or older,212,
Lupin the IIIrd: Jigen Daisuke no Bohyou,Lupin the Third: Jigen's Gravestone,7.80,4093,983,29,Movie,1,Finished Airing,"Jun 21, 2014",,,"TMS Entertainment,       TMS Music",Discotek Media,Telecom Animation Film,Manga,"Action, Adventure, Drama",Adult Cast,51 min.,R+ - Mild Nudity,89,Seinen
Maria-sama ga Miteru 3rd,Maria Watches Over Us 3rd,7.80,4577,986,23,OVA,5,Finished Airing,"Dec 29, 2006 to Jul 25, 2007",,,"None found, add some",Nozomi Entertainment,Studio Deen,Light novel,"Drama, Girls Love",School,51 min. per ep.,PG-13 - Teens 13 or older,101,Shoujo
Magi: Sinbad no Bouken,,7.80,1663,984,137,OVA,5,Finished Airing,"May 14, 2014 to Jul 15, 2015",,,"Aniplex,       Shogakukan","None found, add some",Lay-duce,Manga,"Action, Adventure, Fantasy",,24 min. per ep.,PG-13 - Teens 13 or older,254,Shounen
Mahoujin Guruguru (2017),Magical Circle,7.80,3872,985,33,TV,24,Finished Airing,"Jul 11, 2017 to Dec 20, 2017",Summer 2017,Wednesdays at 01:35 (JST),"TV Tokyo,       Square Enix,       Lantis,       Kadokawa Shoten,       AT-X,       Magic Capsule,       Sony Music Communications","None found, add some",Production I.G,Manga,"Adventure, Comedy, Fantasy",Parody,24 min. per ep.,PG-13 - Teens 13 or older,238,Shounen
Nodame Cantabile: Finale - Mine to Kiyora no Saikai,,7.80,3342,988,44,Special,1,Finished Airing,"Apr 7, 2010",,,"None found, add some","None found, add some",J.C.Staff,Manga,"Comedy, Romance","Adult Cast, Music",25 min.,PG-13 - Teens 13 or older,35,Josei
Meitantei Conan Movie 08: Ginyoku no Time Travel Recap,Detective Conan Movie 08: Time Travel of the Silver Sky Recap,7.80,4695,987,22,TV Special,1,Finished Airing,"Apr 30, 2004",,,"None found, add some","None found, add some",TMS Entertainment,Manga,"Adventure, Mystery",,25 min.,PG-13 - Teens 13 or older,8,
Ojamajo Doremi Na-i-sho,,7.80,6064,989,11,OVA,13,Finished Airing,"Jun 26, 2004 to Dec 11, 2004",,,"None found, add some","None found, add some",Toei Animation,Original,"Comedy, Fantasy",Mahou Shoujo,25 min. per ep.,G - All Ages,103,
Slayers Try,,7.80,2969,992,55,TV,26,Finished Airing,"Apr 4, 1997 to Sep 26, 1997",Spring 1997,Fridays at 18:30 (JST),SoftX,"Funimation,       Central Park Media",E&G Films,Light novel,"Action, Adventure, Comedy, Fantasy",,23 min. per ep.,PG-13 - Teens 13 or older,233,
Shadows House,,7.80,983,991,250,TV,13,Finished Airing,"Apr 11, 2021 to Jul 4, 2021",Spring 2021,Sundays at 00:30 (JST),"Aniplex,       WOWOW,       Tokyo MX,       Shueisha,       BS Asahi",Funimation,CloverWorks,Manga,"Fantasy, Mystery",,23 min. per ep.,PG-13 - Teens 13 or older,"2,022",Seinen
Oomuro-ke: Dear Sisters,,7.80,5733,990,13,Movie,1,Finished Airing,"Feb 2, 2024",,,"Lantis,       Cloud22","None found, add some","Passione,       Studio Lings",Manga,"Comedy, Girls Love","CGDCT, School",43 min.,PG-13 - Teens 13 or older,63,
Tamayura: Sotsugyou Shashin Part 3 - Akogare,,7.80,6296,994,10,Movie,1,Finished Airing,"Nov 28, 2015",,,"Shochiku,       flying DOG","None found, add some",TYO Animations,Original,Slice of Life,"CGDCT, Iyashikei",51 min.,G - All Ages,12,
Sonny Boy,,7.80,766,993,314,TV,12,Finished Airing,"Jul 16, 2021 to Oct 1, 2021",Summer 2021,Fridays at 00:30 (JST),"Shochiku,       Marui Group,       BS Asahi",Funimation,Madhouse,Original,"Award Winning, Mystery","Isekai, Super Power",24 min. per ep.,PG-13 - Teens 13 or older,"6,881",
Shingeki no Kyojin Movie 1: Guren no Yumiya,Attack on Titan: Crimson Bow and Arrow,7.79,1757,995,127,Movie,1,Finished Airing,"Nov 22, 2014",,,"Production I.G,       Dentsu,       Mainichi Broadcasting System,       Pony Canyon,       Kodansha,       Pony Canyon Enterprises",Funimation,Wit Studio,Manga,"Action, Drama, Suspense","Gore, Survival",1 hr. 58 min.,R - 17+ (violence & profanity),220,Shounen
Taishou Otome Otogibanashi,Taisho Otome Fairy Tale,7.79,1564,996,148,TV,12,Finished Airing,"Oct 9, 2021 to Dec 25, 2021",Fall 2021,Saturdays at 01:53 (JST),"Pony Canyon,       Bit grooove promotion",Funimation,SynergySP,Manga,"Comedy, Drama, Romance",Historical,23 min. per ep.,PG-13 - Teens 13 or older,"1,174",Shounen
The Last: Naruto the Movie,Naruto Shippuden the Movie 7: The Last,7.79,356,997,613,Movie,1,Finished Airing,"Dec 6, 2014",,,"TV Tokyo,       Shueisha",VIZ Media,Pierrot,Manga,"Action, Adventure, Fantasy, Romance",,1 hr. 52 min.,PG-13 - Teens 13 or older,"2,209",Shounen
Tokyo Ghoul,,7.79,10,998,2,TV,12,Finished Airing,"Jul 4, 2014 to Sep 19, 2014",Summer 2014,Fridays at 00:00 (JST),"Marvelous AQL,       TC Entertainment,       Shueisha",Funimation,Pierrot,Manga,"Action, Fantasy, Horror, Suspense","Gore, Psychological",24 min. per ep.,R - 17+ (violence & profanity),"50,551",Seinen
Undead Unluck,,7.79,972,999,253,TV,24,Finished Airing,"Oct 7, 2023 to Mar 23, 2024",Fall 2023,Saturdays at 01:23 (JST),"TMS Entertainment,       Mainichi Broadcasting System,       Magic Capsule,       Shueisha","None found, add some",David Production,Manga,"Action, Comedy, Fantasy",Super Power,23 min. per ep.,R - 17+ (violence & profanity),"1,452",Shounen
Wanmei Shijie,Perfect World,7.79,6470,1000,9,ONA,182,Currently Airing,"Apr 23, 2021 to ?",,,Tencent Penguin Pictures,"None found, add some",Foch Films,Novel,"Action, Adventure, Fantasy",,19 min. per ep.,PG-13 - Teens 13 or older,161,
Tteotda Keunyeo!!,There She Is!!,7.84,4448,901,25,ONA,5,Finished Airing,"Apr 20, 2003 to Dec 9, 2008",,,SamBakZa,"None found, add some","None found, add some",Original,"Comedy, Romance",Anthropomorphic,4 min. per ep.,G - All Ages,150,
Urusei Yatsura 2: Beautiful Dreamer,Urusei Yatsura Movie 2: Beautiful Dreamer,7.84,4805,902,21,Movie,1,Finished Airing,"Feb 11, 1984",,,"Kitty Films,       Studio Kyuuma","Central Park Media,       Discotek Media",Pierrot,Manga,"Action, Adventure, Comedy, Drama, Romance, Sci-Fi",,1 hr. 37 min.,PG-13 - Teens 13 or older,274,Shounen
Yume-iro Pâtissière,,7.84,2348,903,83,TV,50,Finished Airing,"Oct 4, 2009 to Sep 26, 2010",Fall 2009,Unknown,"Pierrot,       Yomiuri Telecasting,       DAX Production,       Shueisha",Maiden Japan,Studio Hibari,Manga,Gourmet,School,24 min. per ep.,G - All Ages,"1,154",Shoujo
Ano Hi Mita Hana no Namae wo Bokutachi wa Mada Shiranai. Movie,Anohana: The Flower We Saw That Day The Movie,7.84,827,904,296,Movie,1,Finished Airing,"Aug 31, 2013",,,Aniplex,Aniplex of America,A-1 Pictures,Original,"Drama, Supernatural",,1 hr. 39 min.,PG-13 - Teens 13 or older,625,
Dance Dance Danseur,,7.84,2328,905,84,TV,11,Finished Airing,"Apr 9, 2022 to Jun 18, 2022",Spring 2022,Saturdays at 01:25 (JST),"Mainichi Broadcasting System,       Shogakukan,       dugout,       DMM Music,       Creek","None found, add some",MAPPA,Manga,Drama,Performing Arts,23 min. per ep.,PG-13 - Teens 13 or older,633,Seinen
Durarara!! Specials,,7.84,1409,907,168,Special,2,Finished Airing,"Aug 25, 2010 to Feb 23, 2011",,,Aniplex,Aniplex of America,Brain's Base,Light novel,"Action, Comedy, Supernatural",,23 min. per ep.,R - 17+ (violence & profanity),158,
Dark Gathering,,7.84,1674,906,135,TV,25,Finished Airing,"Jul 10, 2023 to Dec 25, 2023",Summer 2023,Mondays at 01:05 (JST),"Sotsu,       Pony Canyon,       Kansai Telecasting,       NetEase,       BS Asahi,       CHOCOLATE",Sentai Filmworks,OLM,Manga,"Horror, Supernatural",Gore,23 min. per ep.,R - 17+ (violence & profanity),"1,010",Shounen
Hoozuki no Reitetsu OVA,,7.84,5144,909,17,OVA,4,Finished Airing,"Feb 23, 2015 to Mar 23, 2017",,,Starchild Records,"None found, add some","Studio Deen,       Wit Studio",Manga,"Comedy, Fantasy",Mythology,26 min. per ep.,PG-13 - Teens 13 or older,16,Seinen
Hanasaku Iroha Movie: Home Sweet Home,Hanasaku Iroha the Movie: Home Sweet Home,7.84,2206,908,92,Movie,1,Finished Airing,"Mar 9, 2013",,,"Sotsu,       Lantis,       Infinite","NIS America, Inc.",P.A. Works,Original,Drama,Workplace,1 hr. 6 min.,PG-13 - Teens 13 or older,96,
91 Days,,7.83,278,910,727,TV,12,Finished Airing,"Jul 9, 2016 to Oct 1, 2016",Summer 2016,Saturdays at 01:55 (JST),"Shochiku,       Mainichi Broadcasting System,       Shochiku Music Publishing","Funimation,       Crunchyroll",Shuka,Original,"Action, Drama, Suspense","Historical, Organized Crime",24 min. per ep.,R - 17+ (violence & profanity),"8,112",
Doraemon (1979),Doraemon,7.83,2755,911,64,TV,1787,Finished Airing,"Apr 2, 1979 to Mar 18, 2005",Spring 1979,Fridays at 19:00 (JST),"TV Asahi,       Asatsu DK","None found, add some",Shin-Ei Animation,Manga,"Adventure, Comedy, Fantasy, Sci-Fi",Anthropomorphic,11 min. per ep.,PG - Children,634,"KidsKids,         ShounenShounen"
Haikyuu!! Riku vs. Kuu,Haikyu!! Land vs. Air,7.83,793,913,305,OVA,2,Finished Airing,"Jan 22, 2020",,,"Dentsu,       Mainichi Broadcasting System,       Movic,       Sony Music Entertainment,       TOHO animation,       Shueisha",Sentai Filmworks,Production I.G,Manga,Sports,"School, Team Sports",22 min. per ep.,PG-13 - Teens 13 or older,623,Shounen
Grisaia no Meikyuu: Caprice no Mayu 0,The Labyrinth of Grisaia: The Cocoon of Caprice 0,7.83,1051,912,232,TV Special,1,Finished Airing,"Apr 12, 2015",,,"Frontier Works,       NBCUniversal Entertainment Japan,       Front Wing",Sentai Filmworks,8bit,Visual novel,Drama,,47 min.,R+ - Mild Nudity,703,
Hibike! Euphonium Movie 2: Todoketai Melody,Sound! Euphonium the Movie: May the Melody Reach You!,7.83,4003,914,31,Movie,1,Finished Airing,"Sep 30, 2017",,,"Lantis,       Shochiku,       Pony Canyon",Eleven Arts,Kyoto Animation,Novel,Drama,"Music, Performing Arts, School",1 hr. 55 min.,PG-13 - Teens 13 or older,35,
Hidamari Sketch x 365,,7.83,3929,915,32,TV,13,Finished Airing,"Jul 4, 2008 to Sep 26, 2008",Summer 2008,Fridays at 01:25 (JST),"Aniplex,       Lantis,       TBS,       Movic,       Houbunsha",Sentai Filmworks,Shaft,4-koma manga,Slice of Life,"CGDCT, Iyashikei, School, Visual Arts",24 min. per ep.,PG-13 - Teens 13 or older,171,
Hug tto! Precure,,7.83,5145,916,17,TV,49,Finished Airing,"Feb 4, 2018 to Jan 27, 2019",Winter 2018,Sundays at 08:30 (JST),"Asahi Broadcasting,       ABC Animation,       Echoes","None found, add some",Toei Animation,Original,"Action, Fantasy",Mahou Shoujo,24 min. per ep.,G - All Ages,266,
Id:Invaded,,7.83,630,917,373,TV,13,Finished Airing,"Jan 6, 2020 to Mar 23, 2020",Winter 2020,Mondays at 00:30 (JST),"Toei Animation,       BS11,       Kadokawa Media House,       NTT Plala,       Kadokawa,       Anima&Co.",Funimation,NAZ,Original,"Mystery, Sci-Fi, Suspense","Adult Cast, Detective, Psychological",24 min. per ep.,R - 17+ (violence & profanity),"2,931",
Jibaku Shounen Hanako-kun,Toilet-Bound Hanako-kun,7.83,368,918,597,TV,12,Finished Airing,"Jan 10, 2020 to Mar 27, 2020",Winter 2020,Fridays at 01:58 (JST),"Square Enix,       Studio Hibari,       Pony Canyon,       TBS,       Half H.P Studio,       Contents Seed",Funimation,Lerche,Manga,Supernatural,School,24 min. per ep.,PG-13 - Teens 13 or older,"11,894",Shounen
Kono Subarashii Sekai ni Shukufuku wo!: Kono Subarashii Choker ni Shukufuku wo!,KonoSuba: God's Blessing on This Wonderful World! - God's Blessing on This Wonderful Choker!,7.83,562,919,409,OVA,1,Finished Airing,"Jun 24, 2016",,,"Half H.P Studio,       Nippon Columbia",Discotek Media,Studio Deen,Light novel,"Comedy, Fantasy","Isekai, Parody",23 min.,PG-13 - Teens 13 or older,676,
Michiko to Hatchin,Michiko & Hatchin,7.83,1190,920,203,TV,22,Finished Airing,"Oct 16, 2008 to Mar 19, 2009",Fall 2008,Unknown,"Media Factory,       Shochiku,       Yomiko Advertising,       Fuji TV",Funimation,Manglobe,Original,"Action, Adventure",,22 min. per ep.,R - 17+ (violence & profanity),"2,468",
Owarimonogatari 2nd Season Recaps,Owarimonogatari Second Season Recaps,7.83,4346,921,26,TV Special,2,Finished Airing,"Aug 12, 2017 to Aug 13, 2017",,,"None found, add some","None found, add some",Shaft,Light novel,"Comedy, Mystery, Supernatural",Vampire,25 min. per ep.,R - 17+ (violence & profanity),43,
Seihou Bukyou Outlaw Star,Outlaw Star,7.83,1488,922,157,TV,24,Finished Airing,"Jan 9, 1998 to Jun 26, 1998",Winter 1998,Fridays at 01:15 (JST),"Sotsu,       Victor Entertainment","Funimation,       Bandai Entertainment",Sunrise,Manga,"Action, Adventure, Comedy, Sci-Fi",Space,25 min. per ep.,R+ - Mild Nudity,"2,173",Seinen
Seitokai Yakuindomo Movie,,7.83,2822,923,61,Movie,1,Finished Airing,"Jul 21, 2017",,,"KlockWorx,       Glovision,       King Records",Sentai Filmworks,GoHands,4-koma manga,Comedy,"Gag Humor, School",1 hr.,R - 17+ (violence & profanity),78,Shounen
Sekaiichi Hatsukoi 2,Sekai Ichi Hatsukoi - World's Greatest First Love 2,7.83,1487,924,158,TV,12,Finished Airing,"Oct 8, 2011 to Dec 24, 2011",Fall 2011,Saturdays at 01:05 (JST),"Lantis,       Kadokawa Shoten,       AT-X,       KlockWorx",Funimation,Studio Deen,Manga,Boys Love,"Adult Cast, Otaku Culture, Workplace",24 min. per ep.,PG-13 - Teens 13 or older,731,
Tentai Senshi Sunred 2nd Season,,7.83,7038,925,8,TV,26,Finished Airing,"Oct 3, 2009 to Mar 27, 2010",Fall 2009,Unknown,flying DOG,"None found, add some",AIC ASTA,Manga,Comedy,"Gag Humor, Parody, Super Power",13 min. per ep.,PG-13 - Teens 13 or older,27,Seinen
Uchouten Kazoku,The Eccentric Family,7.83,1408,926,168,TV,13,Finished Airing,"Jul 7, 2013 to Sep 29, 2013",Summer 2013,Sundays at 22:00 (JST),"Bandai Visual,       Yomiuri Telecasting,       Lantis,       Kids Station,       Magic Capsule,       Good Smile Company","NIS America, Inc.",P.A. Works,Novel,"Award Winning, Comedy, Drama, Fantasy","Anthropomorphic, Mythology",24 min. per ep.,PG-13 - Teens 13 or older,"1,496",
Uma Musume: Pretty Derby - Road to the Top,,7.83,5824,927,12,ONA,4,Finished Airing,"Apr 16, 2023 to May 7, 2023",,,"None found, add some","None found, add some",CygamesPictures,Game,Sports,"Anthropomorphic, Racing",25 min. per ep.,PG-13 - Teens 13 or older,92,
Wind Breaker,,7.83,1242,928,193,TV,13,Currently Airing,"Apr 5, 2024 to ?",Spring 2024,Fridays at 00:26 (JST),"Aniplex,       Mainichi Broadcasting System,       Kodansha,       Tohan Corporation",Aniplex of America,CloverWorks,Web manga,Action,"Delinquents, School",23 min. per ep.,PG-13 - Teens 13 or older,"1,239",
Shingeki no Kyojin: Lost Girls,Attack on Titan: Lost Girls,7.82,773,929,312,OVA,3,Finished Airing,"Dec 8, 2017 to Aug 9, 2018",,,"Production I.G,       Dentsu,       Mainichi Broadcasting System,       Pony Canyon,       Kodansha,       Pony Canyon Enterprises","None found, add some",Wit Studio,Novel,"Action, Drama",,25 min. per ep.,R - 17+ (violence & profanity),565,
Somali to Mori no Kamisama,Somali and the Forest Spirit,7.82,844,930,291,TV,12,Finished Airing,"Jan 10, 2020 to Mar 27, 2020",Winter 2020,Fridays at 00:30 (JST),"Movic,       Crunchyroll,       North Stars Pictures,       JY Animation,       CA-Cygames Anime Fund,       Mixer","None found, add some","Satelight,       HORNETS",Web manga,"Adventure, Drama, Fantasy",Childcare,23 min. per ep.,PG-13 - Teens 13 or older,"1,668",
Suzumiya Haruhi no Yuuutsu,The Melancholy of Haruhi Suzumiya,7.82,186,931,922,TV,14,Finished Airing,"Apr 3, 2006 to Jul 3, 2006",Spring 2006,Mondays at 00:00 (JST),"Lantis,       Kadokawa Shoten,       Kadokawa Pictures Japan,       KlockWorx","Funimation,       Bandai Entertainment,       Kadokawa Pictures USA",Kyoto Animation,Light novel,"Award Winning, Comedy, Mystery, Sci-Fi",School,23 min. per ep.,PG-13 - Teens 13 or older,"15,144",
Tanaka-kun wa Itsumo Kedaruge,Tanaka-kun is Always Listless,7.82,486,932,466,TV,12,Finished Airing,"Apr 9, 2016 to Jun 25, 2016",Spring 2016,Saturdays at 22:00 (JST),"Bandai Visual,       Dentsu,       Frontier Works,       Lantis,       Shochiku,       Mainichi Broadcasting System,       Movic,       Yahoo! Japan,       Grooove",Sentai Filmworks,SILVER LINK.,Web manga,Slice of Life,"Iyashikei, School",24 min. per ep.,PG-13 - Teens 13 or older,"4,323",
