Name,English_title,Score,Popularity,Rank,Members,Type,Episodes,Status,Aired,Premiered,Broadcast,Producers,Licensors,Studios,Source,Genres,Themes,Duration,Rating,Favorites,Demographics
Tasogare Otome x Amnesia,Dusk Maiden of Amnesia,7.82,567,933,405,TV,12,Finished Airing,"Apr 9, 2012 to Jun 25, 2012",Spring 2012,Mondays at 00:30 (JST),"Square Enix,       Media Factory",Sentai Filmworks,SILVER LINK.,Manga,"Horror, Mystery, Romance, Supernatural",School,23 min. per ep.,R - 17+ (violence & profanity),"4,602",Shounen
Working'!!,Wagnaria!!2,7.82,922,934,265,TV,13,Finished Airing,"Oct 1, 2011 to Dec 24, 2011",Fall 2011,Unknown,"Aniplex,       Yomiuri Telecasting,       Rakuonsha","NIS America, Inc.",A-1 Pictures,4-koma manga,Comedy,"Romantic Subtext, Workplace",24 min. per ep.,PG-13 - Teens 13 or older,462,Seinen
Xian Ni,Renegade Immortal,7.82,11318,935,2,ONA,76,Currently Airing,"Sep 25, 2023 to ?",,,Tencent Penguin Pictures,"None found, add some",BUILD DREAM,Novel,"Action, Adventure, Fantasy",Historical,25 min. per ep.,PG-13 - Teens 13 or older,38,
Yuusha-Ou GaoGaiGar,King of Braves GaoGaiGar,7.82,4650,936,22,TV,49,Finished Airing,"Feb 1, 1997 to Jan 31, 1998",Winter 1997,Saturdays at 17:00 (JST),"Victor Entertainment,       Nagoya Broadcasting Network,       Tokyu Agency","Media Blasters,       Discotek Media",Sunrise,Original,"Action, Adventure, Sci-Fi","Mecha, Super Power",25 min. per ep.,PG-13 - Teens 13 or older,356,
Akachan to Boku,Baby and Me,7.82,4551,937,23,TV,35,Finished Airing,"Jul 11, 1996 to Mar 26, 1997",Summer 1996,Wednesdays at 18:00 (JST),"TV Tokyo,       Yomiko Advertising,       Youmex","None found, add some",Pierrot,Manga,"Comedy, Drama",Childcare,25 min. per ep.,G - All Ages,155,Shoujo
Break Blade Movie 4: Sanka no Chi,Broken Blade 4,7.82,2900,939,58,Movie,1,Finished Airing,"Oct 30, 2010",,,KlockWorx,Sentai Filmworks,"Production I.G,       Xebec",Manga,"Action, Fantasy","Adult Cast, Mecha, Military",49 min.,R - 17+ (violence & profanity),29,Shounen
Beastars,,7.82,206,938,860,TV,12,Finished Airing,"Oct 10, 2019 to Dec 26, 2019",Fall 2019,Thursdays at 00:55 (JST),"Movic,       Fuji TV,       Bandai,       TOHO,       BS Fuji,       TOHO animation,       Q-Tec,       Akita Shoten,       Hakuhodo DY Media Partners,       Bandai Spirits,       Toho Music","None found, add some",Orange,Manga,"Drama, Suspense","Anthropomorphic, Psychological, School",22 min. per ep.,R - 17+ (violence & profanity),"9,705",Shounen
Capeta,,7.82,4227,940,27,TV,52,Finished Airing,"Oct 4, 2005 to Sep 26, 2006",Fall 2005,Tuesdays at 18:00 (JST),"TV Tokyo,       Sotsu,       Marvelous Entertainment,       Delfi Sound","None found, add some",Studio Comet,Manga,Sports,Racing,23 min. per ep.,PG - Children,305,Shounen
Danshi Koukousei no Nichijou Specials,Daily Lives of High School Boys Specials,7.82,1652,941,138,Special,6,Finished Airing,"Apr 3, 2012 to Sep 4, 2012",,,"None found, add some","NIS America, Inc.",Sunrise,Web manga,Comedy,"Gag Humor, School",3 min. per ep.,PG-13 - Teens 13 or older,191,
Gungrave,,7.82,1254,943,191,TV,26,Finished Airing,"Oct 7, 2003 to Mar 30, 2004",Fall 2003,Tuesdays at 01:30 (JST),Tohokushinsha Film Corporation,"Funimation,       Geneon Entertainment USA",Madhouse,Game,"Action, Drama, Sci-Fi","Adult Cast, Gore, Organized Crime, Super Power",25 min. per ep.,R - 17+ (violence & profanity),"2,414",
Haikyuu!! (OVA),,7.82,3946,944,32,OVA,10,Finished Airing,"Mar 4, 2020",,,Shueisha,"None found, add some","None found, add some",Manga,Sports,Team Sports,2 min. per ep.,PG-13 - Teens 13 or older,60,Shounen
Gekkan Shoujo Nozaki-kun,Monthly Girls' Nozaki-kun,7.82,179,942,932,TV,12,Finished Airing,"Jul 7, 2014 to Sep 22, 2014",Summer 2014,Mondays at 01:05 (JST),"TV Tokyo,       Frontier Works,       Media Factory,       AT-X,       Sony Music Communications",Sentai Filmworks,Doga Kobo,4-koma manga,"Comedy, Romance","Otaku Culture, School",24 min. per ep.,PG-13 - Teens 13 or older,"11,025",
Kara no Kyoukai Movie 4: Garan no Dou,The Garden of Sinners Chapter 4: The Hollow Shrine,7.82,1134,945,216,Movie,1,Finished Airing,"May 24, 2008",,,Notes,Aniplex of America,ufotable,Light novel,"Action, Mystery, Supernatural, Suspense",,46 min.,R - 17+ (violence & profanity),318,
Kidou Senshi Gundam: Senkou no Hathaway,Mobile Suit Gundam: Hathaway,7.82,3582,946,39,Movie,1,Finished Airing,"Jun 11, 2021",,,"None found, add some","None found, add some",Sunrise,Novel,"Action, Drama, Sci-Fi","Mecha, Military, Space",1 hr. 35 min.,PG-13 - Teens 13 or older,309,
Kuroko no Basket Movie 3: Winter Cup - Tobira no Mukou,Winter Cup Highlights Episode 3 – Winter Cup Highlights -Crossing the Door-,7.82,3420,947,43,Movie,1,Finished Airing,"Dec 3, 2016",,,"None found, add some","None found, add some",Production I.G,Manga,"Comedy, Sports",Team Sports,1 hr. 28 min.,PG-13 - Teens 13 or older,38,Shounen
Mushoku Tensei: Isekai Ittara Honki Dasu - Eris no Goblin Toubatsu,Mushoku Tensei: Jobless Reincarnation - Eris the Goblin Slayer,7.82,1358,948,176,Special,1,Finished Airing,"Mar 16, 2022",,,"Frontier Works,       TOHO animation,       Hakuhodo DY Music & Pictures,       BS11,       Egg Firm,       Kadokawa,       GREE Entertainment","None found, add some",Studio Bind,Light novel,"Adventure, Drama, Fantasy","Isekai, Reincarnation",23 min.,R - 17+ (violence & profanity),576,
One Piece Film: Red,,7.82,1388,949,170,Movie,1,Finished Airing,"Aug 6, 2022",,,"None found, add some",Crunchyroll,Toei Animation,Manga,"Action, Adventure, Award Winning, Comedy, Drama, Fantasy",Idols (Female),1 hr. 55 min.,PG-13 - Teens 13 or older,"1,645",Shounen
Otonari no Tenshi-sama ni Itsunomanika Dame Ningen ni Sareteita Ken,The Angel Next Door Spoils Me Rotten,7.82,767,950,314,TV,12,Finished Airing,"Jan 7, 2023 to Mar 25, 2023",Winter 2023,Saturdays at 22:30 (JST),"Pony Canyon,       Movic,       Magic Capsule,       TOHO animation,       Tokyo MX,       Good Smile Company,       Miracle Bus,       Pia,       SB Creative,       Toho Music","None found, add some",Project No.9,Light novel,Romance,School,23 min. per ep.,PG-13 - Teens 13 or older,"5,238",
Yuuki Yuuna wa Yuusha de Aru: Washio Sumi no Shou 2 - Tamashii,,7.79,5469,1002,14,Movie,1,Finished Airing,"Apr 15, 2017",,,Pony Canyon,"None found, add some",Studio Gokumi,Light novel,"Drama, Fantasy, Slice of Life",Mahou Shoujo,47 min.,PG-13 - Teens 13 or older,25,
Wolf's Rain,,7.79,729,1001,330,TV,26,Finished Airing,"Jan 7, 2003 to Jul 29, 2003",Winter 2003,Tuesdays at 02:10 (JST),"Bandai Visual,       Asatsu DK,       Fuji TV","Funimation,       Bandai Entertainment",Bones,Original,"Action, Adventure, Drama, Fantasy, Mystery, Sci-Fi",,23 min. per ep.,PG-13 - Teens 13 or older,"5,753",
Crayon Shin-chan,Shin Chan,7.79,2322,1003,84,TV,Unknown,Currently Airing,"Apr 13, 1992 to ?",Spring 1992,Fridays at 19:30 (JST),TV Asahi,Funimation,Shin-Ei Animation,Manga,"Comedy, Ecchi",School,21 min.,G - All Ages,"1,265",Seinen
Digimon Adventure: Bokura no War Game!,Digimon: The Movie,7.79,2416,1004,79,Movie,1,Finished Airing,"Mar 4, 2000",,,"None found, add some","Discotek Media,       Saban Entertainment",Toei Animation,Original,"Adventure, Comedy, Sci-Fi",,41 min.,PG - Children,355,Kids
Dragon Ball Z Special 2: Zetsubou e no Hankou!! Nokosareta Chousenshi - Gohan to Trunks,Dragon Ball Z: The History of Trunks,7.79,1938,1005,112,TV Special,1,Finished Airing,"Feb 24, 1993",,,"None found, add some",Funimation,Toei Animation,Manga,"Adventure, Drama, Fantasy",,48 min.,PG-13 - Teens 13 or older,182,Shounen
Emiya-san Chi no Kyou no Gohan,Today's Menu for the Emiya Family,7.79,1708,1006,133,ONA,13,Finished Airing,"Jan 25, 2018 to Jan 1, 2019",,,"Aniplex,       Kadokawa",Aniplex of America,ufotable,Web manga,"Gourmet, Slice of Life",Iyashikei,13 min. per ep.,PG-13 - Teens 13 or older,745,
Go! Princess Precure,Go! Princess Pretty Cure,7.79,4984,1007,19,TV,50,Finished Airing,"Feb 1, 2015 to Jan 31, 2016",Winter 2015,Sundays at 08:30 (JST),"None found, add some","None found, add some",Toei Animation,Original,"Action, Comedy, Fantasy","Mahou Shoujo, School",24 min. per ep.,G - All Ages,335,
Gochuumon wa Usagi desu ka?? Dear My Sister,Is the order a rabbit?? Dear My Sister,7.79,3428,1008,42,Movie,1,Finished Airing,"Nov 11, 2017",,,Showgate,"None found, add some",production doA,4-koma manga,Slice of Life,"CGDCT, Iyashikei, Workplace",1 hr.,PG-13 - Teens 13 or older,131,
Igano Kabamaru,,7.79,6075,1009,11,TV,24,Finished Airing,"Oct 20, 1983 to Mar 29, 1984",Fall 1983,Thursdays at 19:00 (JST),TOHO,"None found, add some",Group TAC,Manga,"Action, Adventure, Comedy, Romance",School,23 min. per ep.,PG-13 - Teens 13 or older,139,Shoujo
Inu-Ou,Inu-Oh,7.79,4165,1010,28,Movie,1,Finished Airing,"May 28, 2022",,,"Asmik Ace,       Tohokushinsha Film Corporation",GKIDS,Science SARU,Novel,"Award Winning, Fantasy","Historical, Music, Performing Arts",1 hr. 37 min.,R - 17+ (violence & profanity),179,
Isekai Ojisan,Uncle from Another World,7.79,672,1011,354,TV,13,Finished Airing,"Jul 6, 2022 to Mar 8, 2023",Summer 2022,Wednesdays at 22:00 (JST),"Movic,       AT-X,       Sammy,       BS11,       Kadokawa Media House,       Kadokawa","None found, add some",AtelierPontdarc,Web manga,"Comedy, Fantasy","Adult Cast, Isekai, Otaku Culture, Parody",24 min. per ep.,PG-13 - Teens 13 or older,"2,014",
Kimi no Koto ga Daidaidaidaidaisuki na 100-nin no Kanojo,"The 100 Girlfriends Who Really, Really, Really, Really, Really Love You",7.79,1141,1012,214,TV,12,Finished Airing,"Oct 8, 2023 to Dec 24, 2023",Fall 2023,Sundays at 22:30 (JST),"Lantis,       Movic,       Bushiroad,       Tokyo MX,       Shueisha,       NetEase,       Bushiroad Move,       Bandai Namco Filmworks,       Bandai Namco Music Live","None found, add some",Bibury Animation Studios,Manga,"Comedy, Romance","Harem, Parody, School",23 min. per ep.,PG-13 - Teens 13 or older,"2,242",Seinen
Last Exile,,7.79,1360,1013,176,TV,26,Finished Airing,"Apr 8, 2003 to Sep 30, 2003",Spring 2003,Tuesdays at 01:30 (JST),"GDH,       Victor Entertainment,       TV Tokyo Music","Funimation,       Geneon Entertainment USA",Gonzo,Original,"Action, Adventure, Sci-Fi",,24 min. per ep.,PG-13 - Teens 13 or older,"1,863",
Meitantei Conan Movie 07: Meikyuu no Crossroad,Detective Conan Movie 07: Crossroad in the Ancient Capital,7.79,3060,1014,52,Movie,1,Finished Airing,"Apr 19, 2003",,,"None found, add some","None found, add some",TMS Entertainment,Manga,"Adventure, Comedy, Mystery",Detective,1 hr. 48 min.,PG-13 - Teens 13 or older,37,Shounen
Meitantei Conan Movie 09: Suihei Senjou no Strategy,Detective Conan Movie 09: Strategy Above the Depths,7.79,3120,1015,50,Movie,1,Finished Airing,"Apr 9, 2005",,,"None found, add some","None found, add some",TMS Entertainment,Manga,"Adventure, Comedy, Mystery",Detective,1 hr. 50 min.,PG-13 - Teens 13 or older,22,Shounen
New Initial D Movie: Legend 1 - Kakusei,Initial D Legend 1 Awakening,7.79,3600,1016,39,Movie,1,Finished Airing,"Aug 24, 2014",,,"Shochiku,       Kodansha,       Ultra Super Pictures,       Avex Pictures,       Sammy",Sentai Filmworks,"SANZIGEN,       LIDENFILMS",Manga,Action,Racing,1 hr. 2 min.,PG-13 - Teens 13 or older,82,Seinen
Psycho-Pass 3: First Inspector,,7.79,2111,1017,98,ONA,3,Finished Airing,"Mar 27, 2020",,,"Dentsu,       Fuji TV,       Nitroplus,       Sony Music Entertainment,       TOHO animation,       MAGNET","None found, add some",Production I.G,Original,"Action, Mystery, Sci-Fi","Adult Cast, Detective, Psychological",46 min. per ep.,R - 17+ (violence & profanity),160,
Saint☆Oniisan (Movie),Saint☆Young Men (Movie),7.79,2139,1018,96,Movie,1,Finished Airing,"May 10, 2013",,,"Aniplex,       Kodansha,       TOHO,       Three S Studio","None found, add some",A-1 Pictures,Manga,Comedy,,1 hr. 29 min.,PG-13 - Teens 13 or older,468,Seinen
Kekkai Sensen & Beyond,Blood Blockade Battlefront & Beyond,7.78,516,1020,440,TV,12,Finished Airing,"Oct 8, 2017 to Dec 24, 2017",Fall 2017,Sundays at 03:08 (JST),"Nihon Ad Systems,       Mainichi Broadcasting System,       TOHO animation,       Shueisha",Funimation,Bones,Manga,"Action, Fantasy","Super Power, Vampire",24 min. per ep.,R - 17+ (violence & profanity),"1,697",Shounen
Jungle wa Itsumo Hare nochi Guu Deluxe,Haré+Guu Deluxe,7.78,5818,1019,12,OVA,6,Finished Airing,"Aug 25, 2002 to Jan 25, 2003",,,Bandai Visual,"Funimation,       AN Entertainment",Shin-Ei Animation,Manga,"Comedy, Slice of Life",Gag Humor,26 min. per ep.,PG-13 - Teens 13 or older,22,Shounen
Liang Bu Yi 2nd Season,No Doubt In Us 2nd Season,7.78,8703,1021,4,ONA,24,Finished Airing,"Oct 26, 2022 to Apr 19, 2023",,,"bilibili,       Paper Plane Animation Studio","None found, add some","None found, add some",Manga,"Comedy, Romance",Historical,14 min. per ep.,PG-13 - Teens 13 or older,23,
Macross F Movie 1: Itsuwari no Utahime,Macross Frontier: The False Songstress,7.78,4008,1022,31,Movie,1,Finished Airing,"Nov 21, 2009",,,"Bandai Visual,       Big West,       KlockWorx,       Bandai Namco Games","None found, add some","Satelight,       8bit",Original,"Action, Romance, Sci-Fi","Mecha, Military, Music, Space",1 hr. 59 min.,PG-13 - Teens 13 or older,58,
Meitantei Conan Movie 12: Senritsu no Full Score,Detective Conan Movie 12: Full Score of Fear,7.78,3204,1023,48,Movie,1,Finished Airing,"Apr 19, 2008",,,"Shogakukan-Shueisha Productions,       Tokyo Movie Shinsha,       Big Bang","None found, add some",TMS Entertainment,Manga,"Adventure, Comedy, Mystery",Detective,1 hr. 56 min.,PG-13 - Teens 13 or older,24,Shounen
Mind Game,,7.78,2292,1024,87,Movie,1,Finished Airing,"Aug 7, 2004",,,Beyond C.,GKIDS,Studio 4°C,Manga,"Adventure, Avant Garde, Award Winning, Comedy, Romance","Adult Cast, Psychological",1 hr. 43 min.,R - 17+ (violence & profanity),"1,130",
Seikai no Senki II,Banner of the Stars II,7.78,4499,1026,24,TV,10,Finished Airing,"Jul 11, 2001 to Sep 26, 2001",Summer 2001,Unknown,"Bandai Visual,       WOWOW","Funimation,       Bandai Entertainment",Sunrise,Light novel,"Action, Romance, Sci-Fi","Military, Space",25 min. per ep.,PG-13 - Teens 13 or older,123,
Shiguang Dailiren Fanwai Pian: Biwu Zhaoqin,Link Click Episode 5.5,7.78,3540,1027,40,ONA,1,Finished Airing,"May 28, 2021",,,"Haoliners Animation League,       bilibili,       BeDream","None found, add some",LAN Studio,Original,"Drama, Mystery, Supernatural, Suspense","Adult Cast, Time Travel",22 min.,PG-13 - Teens 13 or older,93,
Saiyuuki Gaiden,,7.78,5652,1025,13,OVA,3,Finished Airing,"Mar 25, 2011 to Nov 25, 2011",,,"TV Tokyo,       Dentsu,       Frontier Works,       Hakuhodo DY Media Partners",Sentai Filmworks,Anpro,Manga,"Action, Adventure, Drama, Fantasy",Mythology,29 min. per ep.,R - 17+ (violence & profanity),74,Shounen
Shin Kidou Senki Gundam Wing: Endless Waltz Tokubetsu-hen,Mobile Suit Gundam Wing: Endless Waltz,7.78,2832,1028,60,Movie,1,Finished Airing,"Aug 1, 1998",,,"Bandai Visual,       Sotsu",Bandai Entertainment,Sunrise,Original,"Action, Drama, Sci-Fi","Mecha, Military, Space",1 hr. 34 min.,PG-13 - Teens 13 or older,194,
Star☆Twinkle Precure: Hoshi no Uta ni Omoi wo Komete,,7.78,8873,1029,4,Movie,1,Finished Airing,"Oct 19, 2019",,,"None found, add some","None found, add some",Toei Animation,Original,"Action, Fantasy",Mahou Shoujo,1 hr. 12 min.,G - All Ages,17,
Tomo-chan wa Onnanoko!,Tomo-chan Is a Girl!,7.78,579,1030,398,TV,13,Finished Airing,"Jan 5, 2023 to Mar 30, 2023",Winter 2023,Thursdays at 00:30 (JST),"Aniplex,       Seikaisha,       Crunchyroll,       INSPION Edge,       Three S Studio","None found, add some",Lay-duce,Web manga,"Comedy, Romance",School,23 min. per ep.,PG-13 - Teens 13 or older,"2,897",
Yuukoku no Moriarty OVA,Moriarty the Patriot OVA,7.78,3553,1031,40,OVA,2,Finished Airing,"Apr 27, 2022",,,"Mainichi Broadcasting System,       Shueisha,       Yomiuri TV Enterprise,       Bandai Namco Arts,       Bandai Spirits","None found, add some",Production I.G,Manga,"Mystery, Suspense","Adult Cast, Historical, Psychological",23 min. per ep.,R - 17+ (violence & profanity),158,Shounen
Aria the Crepuscolo,,7.78,5804,1032,12,Movie,1,Finished Airing,"Mar 5, 2021",,,Shochiku,"None found, add some",J.C.Staff,Manga,"Fantasy, Sci-Fi, Slice of Life",Iyashikei,1 hr.,PG-13 - Teens 13 or older,41,Shounen
Beastars 2nd Season,,7.78,511,1033,444,TV,12,Finished Airing,"Jan 7, 2021 to Mar 25, 2021",Winter 2021,Thursdays at 00:55 (JST),"Movic,       Fuji TV,       Bandai,       BS Fuji,       TOHO animation,       Q-Tec,       Akita Shoten,       Hakuhodo DY Media Partners,       Bandai Spirits,       Toho Music","None found, add some",Orange,Manga,"Drama, Suspense","Anthropomorphic, Psychological, School",22 min. per ep.,R - 17+ (violence & profanity),"2,216",Shounen
Chuan Shu Zijiu Zhinan,Scumbag System,7.78,4908,1034,19,ONA,10,Finished Airing,"Sep 10, 2020 to Oct 1, 2020",,,"Tencent Penguin Pictures,       iQIYI,       Sony Music Solutions","None found, add some",Djinn Power,Web novel,"Comedy, Drama, Fantasy","Historical, Isekai, Mythology",19 min. per ep.,R - 17+ (violence & profanity),515,
"Clannad: After Story - Mou Hitotsu no Sekai, Kyou-hen","Clannad: After Story - Another World, Kyou Chapter",7.78,924,1035,265,Special,1,Finished Airing,"Jul 1, 2009",,,Animation Do,Sentai Filmworks,Kyoto Animation,Visual novel,"Drama, Romance",School,23 min.,PG-13 - Teens 13 or older,583,
Code Geass: Hangyaku no Lelouch R2 Special Edition - Zero Requiem,Code Geass: Lelouch of the Rebellion R2 Special Edition - Zero Requiem,7.78,3163,1036,49,OVA,1,Finished Airing,"Jul 24, 2009",,,"None found, add some","None found, add some",Sunrise,Original,Action,"Mecha, Military, Super Power",1 hr. 56 min.,R - 17+ (violence & profanity),84,
Digimon Adventure,Digimon: Digital Monsters,7.78,570,1038,404,TV,54,Finished Airing,"Mar 7, 1999 to Mar 26, 2000",Spring 1999,Sundays at 09:00 (JST),"Yomiko Advertising,       Fuji TV","Discotek Media,       Saban Entertainment,       Flatiron Film Company",Toei Animation,Other,"Action, Adventure, Comedy, Fantasy",Isekai,24 min. per ep.,PG - Children,"5,405",Kids
Free! Movie 5: The Final Stroke - Kouhen,,7.78,4040,1039,30,Movie,1,Finished Airing,"Apr 22, 2022",,,ABC Animation,"None found, add some",Kyoto Animation,Original,Sports,School,1 hr. 45 min.,PG-13 - Teens 13 or older,195,
Coquelicot-zaka kara,From Up on Poppy Hill,7.78,1179,1037,206,Movie,1,Finished Airing,"Jul 16, 2011",,,Nippon Television Network,GKIDS,Studio Ghibli,Manga,"Award Winning, Romance","Historical, School",1 hr. 35 min.,G - All Ages,"1,212",Shoujo
Giant Robo the Animation: Chikyuu ga Seishi Suru Hi,Giant Robo the Animation: The Day the Earth Stood Still,7.78,4261,1040,27,OVA,7,Finished Airing,"Jul 23, 1992 to Jan 25, 1998",,,Bandai Visual,"Media Blasters,       Discotek Media,       NYAV Post,       Manga Entertainment",Phoenix Entertainment,Manga,"Action, Drama, Sci-Fi","Mecha, Super Power",49 min. per ep.,PG-13 - Teens 13 or older,435,Shounen
Ginga Eiyuu Densetsu: Die Neue These - Kaikou,Legend of the Galactic Heroes: Die Neue These,7.78,2297,1041,86,TV,12,Finished Airing,"Apr 3, 2018 to Jun 26, 2018",Spring 2018,Tuesdays at 21:00 (JST),Shochiku,Funimation,Production I.G,Novel,"Drama, Sci-Fi","Adult Cast, Military, Space",25 min. per ep.,R - 17+ (violence & profanity),605,
Heike Monogatari,The Heike Story,7.78,2390,1042,81,TV,11,Finished Airing,"Jan 13, 2022 to Mar 24, 2022",Winter 2022,Thursdays at 01:05 (JST),"Dentsu,       Pony Canyon,       Fuji TV,       Asmik Ace,       BS Fuji,       bilibili",Funimation,Science SARU,Book,"Drama, Supernatural","Historical, Samurai",23 min. per ep.,PG-13 - Teens 13 or older,680,
Innocence,Ghost in the Shell 2: Innocence,7.78,1447,1043,163,Movie,1,Finished Airing,"Mar 6, 2004",,,"Bandai Visual,       Dentsu,       Kodansha,       d-rights,       Tokuma Shoten,       Nippon Television Network","Funimation,       Bandai Entertainment",Production I.G,Manga,"Action, Award Winning, Mystery, Sci-Fi","Adult Cast, Detective, Mecha, Military, Psychological",1 hr. 39 min.,R - 17+ (violence & profanity),"1,053",
Jin-Rou,Jin-Roh: The Wolf Brigade,7.78,1320,1044,182,Movie,1,Finished Airing,"Jun 3, 2000",,,"None found, add some","Bandai Entertainment,       Discotek Media",Production I.G,Manga,"Action, Award Winning, Drama, Romance, Suspense","Adult Cast, Military, Psychological",1 hr. 42 min.,R - 17+ (violence & profanity),"1,956",
Akage no Anne,Anne of Green Gables,7.77,3839,1045,34,TV,50,Finished Airing,"Jan 7, 1979 to Dec 30, 1979",Winter 1979,Sundays at 19:30 (JST),"None found, add some","None found, add some",Nippon Animation,Novel,Drama,Historical,25 min. per ep.,G - All Ages,810,
Break Blade Movie 3: Kyoujin no Ato,Broken Blade 3,7.77,2876,1046,59,Movie,1,Finished Airing,"Sep 25, 2010",,,KlockWorx,Sentai Filmworks,"Production I.G,       Xebec",Manga,"Action, Fantasy","Adult Cast, Mecha, Military",47 min.,R - 17+ (violence & profanity),27,Shounen
Date A Live IV,,7.77,971,1047,253,TV,12,Finished Airing,"Apr 8, 2022 to Jun 24, 2022",Spring 2022,Fridays at 22:00 (JST),"AT-X,       Nippon Columbia,       Docomo Anime Store,       Kadokawa Media House,       Kadokawa",Crunchyroll,Geek Toys,Light novel,"Action, Fantasy, Romance, Sci-Fi","Harem, School",23 min. per ep.,R - 17+ (violence & profanity),"3,458",
Fanren Xiu Xian Chuan 3rd Season,A Record of Mortal's Journey to Immortality Season 3,7.76,13120,1074,1,ONA,48,Currently Airing,"Nov 25, 2023 to ?",,,"None found, add some","None found, add some","Original Force,       Wonder Cat Animation",Web novel,"Action, Adventure, Fantasy","Historical, Martial Arts",20 min. per ep.,PG-13 - Teens 13 or older,12,
Ginga Tetsudou 999,Galaxy Express 999,7.77,3594,1048,39,TV,113,Finished Airing,"Sep 14, 1978 to Mar 26, 1981",Fall 1978,Thursdays at 19:00 (JST),Fuji TV,Discotek Media,Toei Animation,Manga,"Adventure, Drama, Sci-Fi",Space,24 min. per ep.,G - All Ages,462,
Gochuumon wa Usagi desu ka??,Is the Order a Rabbit??,7.77,1709,1049,132,TV,12,Finished Airing,"Oct 10, 2015 to Dec 26, 2015",Fall 2015,Saturdays at 21:30 (JST),"Frontier Works,       AT-X,       Magic Capsule,       Bushiroad,       Showgate,       Houbunsha,       NBCUniversal Entertainment Japan,       i0+,       Hakuhodo DY Music & Pictures,       RAY",Sentai Filmworks,"Kinema Citrus,       White Fox",4-koma manga,Slice of Life,"CGDCT, Iyashikei, Workplace",23 min. per ep.,PG-13 - Teens 13 or older,865,
