Name,English_title,Score,Popularity,Rank,Members,Type,Episodes,Status,Aired,Producers,Licensors,Studios,Source,Genres,Themes,Duration,Rating,Favorites,Premiered,Broadcast,Demographics
The iDOLM@STER Shiny Festa,,7.18,5021,3339,18,OVA,3,Finished Airing,25-Oct-12,"None found, add some","None found, add some",A-1 Pictures,Game,"Comedy, Drama","Idols (Female), Music",23 min. per ep.,PG-13 - Teens 13 or older,16,,,
Thermae Romae Novae,,7.18,4371,3340,26,ONA,11,Finished Airing,28-Mar-22,"None found, add some","None found, add some",NAZ,Manga,Comedy,"Adult Cast, Historical, Time Travel",29 min. per ep.,PG-13 - Teens 13 or older,93,,,Seinen
Toushou Daimos,Daimos,7.18,7735,3341,6,TV,44,Finished Airing,"Apr 1, 1978 to Jan 27, 1979",Studio Nue,Discotek Media,"Sunrise,       Toei Animation",Original,"Adventure, Drama, Romance, Sci-Fi",Mecha,24 min. per ep.,PG-13 - Teens 13 or older,33,Spring 1978,Unknown,
UQ Holder! Mahou Sensei Negima! 2 OVA,,7.18,4193,3342,28,OVA,3,Finished Airing,"Sep 8, 2017 to Jun 8, 2018",Kodansha,Sentai Filmworks,J.C.Staff,Manga,"Action, Fantasy, Sci-Fi",,22 min. per ep.,PG-13 - Teens 13 or older,27,,,Shounen
Utawarerumono OVA,,7.18,4723,3343,21,OVA,3,Finished Airing,"Jun 5, 2009 to Jun 23, 2010",Frontier Works,Sentai Filmworks,Chaos Project,Visual novel,"Action, Comedy, Fantasy",,29 min. per ep.,R+ - Mild Nudity,13,,,
Wu Shan Wu Xing,Fog Hill of Five Elements,7.18,9928,3344,3,ONA,1,Finished Airing,31-Dec-16,"None found, add some","None found, add some",Samsara Animation Studio,Original,"Action, Fantasy",,5 min.,PG-13 - Teens 13 or older,9,,,
Yes! Precure 5 GoGo!,,7.18,5992,3345,11,TV,48,Finished Airing,"Feb 3, 2008 to Jan 25, 2009",Asahi Broadcasting,"None found, add some",Toei Animation,Original,"Action, Fantasy","Mahou Shoujo, School",24 min. per ep.,G - All Ages,37,Winter 2008,Sundays at 08:30 (JST),
Youkai Apartment no Yuuga na Nichijou,Elegant Yokai Apartment Life,7.18,2640,3346,68,TV,26,Finished Airing,"Jul 3, 2017 to Dec 25, 2017","TMS Entertainment,       Kodansha,       Asmik Ace,       JR East Marketing & Communications,       Sumitomo","None found, add some",Shin-Ei Animation,Novel,"Slice of Life, Supernatural","Mythology, School",23 min. per ep.,PG-13 - Teens 13 or older,219,Summer 2017,Mondays at 23:00 (JST),
Zoids Genesis,,7.18,5288,3347,16,TV,50,Finished Airing,"Apr 10, 2005 to Mar 26, 2006","None found, add some",VIZ Media,Shogakukan Music & Digital Entertainment,Original,"Action, Adventure, Comedy","Mecha, Military",25 min. per ep.,PG-13 - Teens 13 or older,31,Spring 2005,Unknown,
Aikatsu Friends!,,7.18,5872,3348,12,TV,50,Finished Airing,"Apr 5, 2018 to Mar 28, 2019","TV Tokyo,       Dentsu,       Echoes","None found, add some",Bandai Namco Pictures,Game,Slice of Life,"Idols (Female), Music, School",24 min. per ep.,PG - Children,78,Spring 2018,Thursdays at 18:25 (JST),
Ansatsu Kyoushitsu: Jump Festa 2013 Special,Assassination Classroom: Jump Festa 2013 Special,7.18,2406,3349,80,Special,1,Finished Airing,06-Oct-13,Kansai Telecasting,"None found, add some",Brain's Base,Manga,"Action, Comedy",,31 min.,PG-13 - Teens 13 or older,431,,,Shounen
Ayashi no Ceres,"Ceres, Celestial Legend",7.18,2785,3350,62,TV,24,Finished Airing,"Apr 20, 2000 to Sep 28, 2000",Bandai Visual,"VIZ Media,       Discotek Media",Pierrot,Manga,"Adventure, Drama, Horror, Romance, Supernatural","Psychological, Reincarnation",21 min. per ep.,R - 17+ (violence & profanity),491,Spring 2000,Thursdays at 18:30 (JST),Shoujo
Bleach: Memories in the Rain,,7.18,1746,3351,128,Special,1,Finished Airing,18-Dec-04,"None found, add some","None found, add some",Pierrot,Manga,"Action, Adventure, Drama, Fantasy",,29 min.,PG-13 - Teens 13 or older,236,,,Shounen
Chuunibyou demo Koi ga Shitai! Ren Lite,"Love, Chunibyo & Other Delusions!: Heart Throb Lite Shorts",7.18,2252,3352,89,ONA,6,Finished Airing,"Dec 26, 2013 to Mar 16, 2014","None found, add some",Sentai Filmworks,Kyoto Animation,Light novel,Comedy,School,4 min. per ep.,PG-13 - Teens 13 or older,67,,,
Cybersix,,7.18,6113,3353,11,TV,13,Finished Airing,"Sep 6, 1999 to Nov 29, 1999",Tokyo Movie Shinsha,Discotek Media,Telecom Animation Film,Other,"Action, Adventure, Romance, Sci-Fi",,23 min. per ep.,PG-13 - Teens 13 or older,72,Fall 1999,Mondays at 20:30 (JST),
Date A Live II,,7.18,333,3354,643,TV,10,Finished Airing,"Apr 12, 2014 to Jun 14, 2014","Kadokawa Shoten,       AT-X,       Nippon Columbia",Funimation,Production IMS,Light novel,"Action, Fantasy, Romance, Sci-Fi","Harem, School",28 min. per ep.,R - 17+ (violence & profanity),"2,235",Spring 2014,Saturdays at 01:35 (JST),
Denki-gai no Honya-san,Denki-gai,7.18,1731,3355,130,TV,12,Finished Airing,"Oct 2, 2014 to Dec 18, 2014","Sotsu,       Pony Canyon,       DAX Production,       Comic Umenohone,       Mobcast",Ponycan USA,Shin-Ei Animation,Manga,Comedy,"Otaku Culture, Workplace",23 min. per ep.,PG-13 - Teens 13 or older,280,Fall 2014,Thursdays at 22:30 (JST),Seinen
Dimension W,,7.18,817,3356,299,TV,12,Finished Airing,"Jan 10, 2016 to Mar 27, 2016","Bandai Visual,       Square Enix,       Lantis,       Tokyo MX,       Good Smile Company,       Q-Tec,       I Will",Funimation,"Orange,       Studio 3Hz",Manga,"Action, Sci-Fi",,24 min. per ep.,R - 17+ (violence & profanity),832,Winter 2016,Sundays at 22:30 (JST),Seinen
Dr. Slump: Arale-chan,,7.18,5243,3357,16,TV,243,Finished Airing,"Apr 8, 1981 to Feb 19, 1986","Fuji TV,       Harmony Gold","None found, add some",Toei Animation,Manga,"Comedy, Sci-Fi",Gag Humor,25 min. per ep.,PG-13 - Teens 13 or older,78,Spring 1981,Wednesdays at 19:00 (JST),Shounen
Druaga no Tou: The Sword of Uruk,Tower of Druaga: The Sword of Uruk,7.18,2490,3358,75,TV,12,Finished Airing,"Jan 9, 2009 to Mar 27, 2009","Sotsu Music Publishing,       Future Vision Music",Funimation,Gonzo,Game,"Action, Adventure, Fantasy",,24 min. per ep.,PG-13 - Teens 13 or older,89,Winter 2009,Fridays at 01:30 (JST),
Figure 17: Tsubasa & Hikaru,,7.18,5552,3359,14,TV,13,Finished Airing,"May 27, 2001 to May 26, 2002","Bandai Visual,       Genco,       MediaNet",Media Blasters,OLM,Original,"Sci-Fi, Slice of Life",,47 min. per ep.,PG-13 - Teens 13 or older,80,Spring 2001,Unknown,
Futari wa Precure: Splash☆Star,,7.18,5534,3360,14,TV,49,Finished Airing,"Feb 5, 2006 to Jan 28, 2007",Asahi Broadcasting,"None found, add some",Toei Animation,Original,"Action, Comedy, Fantasy",Mahou Shoujo,24 min. per ep.,G - All Ages,83,Winter 2006,Unknown,
Ganbarist! Shun,,7.18,9230,3361,3,TV,30,Finished Airing,"Jul 1, 1996 to Mar 10, 1997",Yomiuri Telecasting,"None found, add some",Sunrise,Manga,"Comedy, Sports",,26 min. per ep.,PG-13 - Teens 13 or older,13,Summer 1996,Mondays at 19:00 (JST),Shounen
Hetalia Axis Powers Fan Disc,,7.18,5672,3362,13,OVA,1,Finished Airing,25-May-10,Frontier Works,Funimation,Studio Deen,Web manga,Comedy,"Historical, Parody",10 min.,PG-13 - Teens 13 or older,20,,,
Hikikomari Kyuuketsuki no Monmon,The Vexations of a Shut-In Vampire Princess,7.18,2088,3363,100,TV,12,Finished Airing,"Oct 7, 2023 to Dec 30, 2023","NBCUniversal Entertainment Japan,       Tokyo MX,       DMM.com,       Kadokawa Media House,       BS NTV,       Good Smile Film,       Bit grooove promotion,       SB Creative,       Yostar",Sentai Filmworks,Project No.9,Light novel,"Comedy, Fantasy",Vampire,23 min. per ep.,PG-13 - Teens 13 or older,741,Fall 2023,Saturdays at 22:30 (JST),
Hoshikuzu Telepath,Stardust Telepath,7.18,3115,3364,50,TV,12,Finished Airing,"Oct 9, 2023 to Dec 25, 2023","Movic,       AT-X,       Nippon Columbia,       KlockWorx,       Asmik Ace,       Studio Mausu,       Houbunsha,       Hakuhodo DY Music & Pictures,       BS NTV,       San Blas Animation","None found, add some",Studio Gokumi,4-koma manga,"Comedy, Supernatural","CGDCT, School",23 min. per ep.,PG-13 - Teens 13 or older,331,Fall 2023,Mondays at 21:00 (JST),
Ihatov Gensou: Kenji no Haru,Spring and Chaos,7.18,6561,3365,9,Movie,1,Finished Airing,14-Dec-96,"None found, add some",Tokyopop,Group TAC,Novel,"Drama, Slice of Life","Anthropomorphic, Historical",56 min.,PG-13 - Teens 13 or older,48,,,
Irregular Hunter X: The Day of Sigma,Megaman X - The Day of Sigma,7.18,5921,3366,12,OVA,1,Finished Airing,15-Dec-05,"None found, add some",Capcom,Xebec,Game,"Action, Sci-Fi",,30 min.,PG - Children,56,,,
Jin Zhan Fashi,The Melee Mage,7.18,12453,3367,1,ONA,20,Finished Airing,"Nov 2, 2023 to Dec 21, 2023",Tencent Penguin Pictures,"None found, add some",2:10 AM Animation,Novel,"Action, Adventure, Fantasy",Video Game,17 min. per ep.,PG-13 - Teens 13 or older,6,,,
Ajin OVA,,7.17,3288,3368,45,OVA,2,Finished Airing,"May 6, 2016 to Oct 7, 2016","None found, add some",Sentai Filmworks,Polygon Pictures,Manga,"Action, Horror, Mystery, Supernatural",,21 min. per ep.,R - 17+ (violence & profanity),27,,,Seinen
"Ano Natsu de Matteru: Bokutachi wa Koukou Saigo no Natsu wo Sugoshinagara, Ano Natsu de Matteiru.","Waiting in the Summer: In Our Last Summer of High School, We Await That Summer",7.17,3149,3369,49,Special,1,Finished Airing,29-Aug-14,Geneon Universal Entertainment,Sentai Filmworks,J.C.Staff,Original,"Drama, Romance, Sci-Fi",,26 min.,PG-13 - Teens 13 or older,42,,,
Arifureta Shokugyou de Sekai Saikyou 2nd Season,Arifureta: From Commonplace to World's Strongest Season 2,7.17,612,3370,383,TV,12,Finished Airing,"Jan 13, 2022 to Mar 31, 2022","None found, add some",Crunchyroll,"asread.,       studio MOTHER",Light novel,"Action, Adventure, Fantasy","Harem, Isekai",23 min. per ep.,PG-13 - Teens 13 or older,"4,286",Winter 2022,Thursdays at 23:30 (JST),
Baka to Test to Shoukanjuu: Spinout! Sore ga Bokura no Nichijou,,7.17,3708,3371,36,Special,6,Finished Airing,"Sep 21, 2011 to Feb 22, 2012","None found, add some","None found, add some",SILVER LINK.,Light novel,"Comedy, Romance","School, Super Power",5 min. per ep.,PG-13 - Teens 13 or older,26,,,
Chuukan Kanriroku Tonegawa,Mr. Tonegawa: Middle Management Blues,7.17,3461,3372,41,TV,24,Finished Airing,"Jul 4, 2018 to Dec 26, 2018","VAP,       Half H.P Studio,       Nippon Television Network,       Nippon Television Music",Sentai Filmworks,Madhouse,Manga,"Comedy, Drama","Adult Cast, Parody, Psychological, Workplace",23 min. per ep.,PG-13 - Teens 13 or older,120,Summer 2018,Wednesdays at 00:00 (JST),Seinen
D.C.II S.S.: Da Capo II Second Season,,7.17,4060,3373,30,TV,13,Finished Airing,"Apr 6, 2008 to Jun 29, 2008","Starchild Records,       Lantis,       GANSIS","None found, add some",feel.,Visual novel,"Comedy, Drama, Fantasy, Romance",Harem,24 min. per ep.,PG-13 - Teens 13 or older,50,Spring 2008,Unknown,
Devilman: Tanjou-hen,Devilman: The Birth,7.17,3972,3374,32,OVA,1,Finished Airing,01-Nov-87,"Triangle Staff,       Kodansha,       Dynamic Planning,       King Records","Discotek Media,       Manga Entertainment",Oh! Production,Manga,"Horror, Sci-Fi, Supernatural","Gore, Mythology",50 min.,R+ - Mild Nudity,322,,,Shounen
Doraemon: Nobita's the Night Before a Wedding,,7.17,9539,3375,3,Movie,1,Finished Airing,06-Mar-99,"None found, add some","None found, add some","None found, add some",Unknown,Fantasy,,26 min.,PG - Children,0,,,
Genius Party Beyond,,7.17,4826,3376,20,Movie,5,Finished Airing,11-Oct-08,Beyond C.,GKIDS,Studio 4°C,Original,"Avant Garde, Fantasy, Sci-Fi",Music,16 min. per ep.,R - 17+ (violence & profanity),72,,,
Girls & Panzer: Saishuushou Part 4 Specials,,7.17,11410,3377,2,Special,2,Finished Airing,27-Mar-24,"None found, add some","None found, add some",Actas,Original,Comedy,"Military, School",13 min. per ep.,PG-13 - Teens 13 or older,0,,,
"Gyakuten Saiban: Sono ""Shinjitsu"", Igi Ari! Season 2",Ace Attorney Season 2,7.17,3473,3378,41,TV,23,Finished Airing,"Oct 6, 2018 to Mar 30, 2019","Aniplex,       Capcom",Funimation,CloverWorks,Game,"Comedy, Drama, Mystery","Adult Cast, Detective, Workplace",24 min. per ep.,PG-13 - Teens 13 or older,146,Fall 2018,Saturdays at 17:30 (JST),
Hakozume: Kouban Joshi no Gyakushuu,Police in a Pod,7.17,3037,3379,53,TV,13,Finished Airing,"Jan 5, 2022 to Mar 30, 2022","Magic Capsule,       Kadokawa",Funimation,Madhouse,Manga,Comedy,"Adult Cast, Workplace",23 min. per ep.,PG-13 - Teens 13 or older,167,Winter 2022,Wednesdays at 23:30 (JST),Seinen
High Card,,7.17,1911,3380,114,TV,12,Finished Airing,"Jan 9, 2023 to Mar 27, 2023","TMS Entertainment,       Sammy,       Kadokawa,       NetEase","None found, add some",Studio Hibari,Mixed media,"Action, Fantasy","Adult Cast, Organized Crime, Super Power",23 min. per ep.,R - 17+ (violence & profanity),570,Winter 2023,Mondays at 20:00 (JST),
Jashin-chan Dropkick Episode 12,Dropkick On My Devil! Episode 12,7.17,3866,3381,33,ONA,1,Finished Airing,01-Oct-18,"BookLive,       ibis Capital Partners,       Global Solutions","None found, add some",Nomad,Web manga,"Comedy, Supernatural","CGDCT, Gag Humor, Mythology",23 min.,PG-13 - Teens 13 or older,17,,,
Kanashimi no Belladonna,Belladonna of Sadness,7.17,3102,3382,51,Movie,1,Finished Airing,30-Jun-73,"None found, add some","Discotek Media,       Cinelicious Pics",Mushi Production,Book,"Avant Garde, Drama",Historical,1 hr. 27 min.,R+ - Mild Nudity,737,,,
Kiddy Grade,,7.17,3243,3383,46,TV,24,Finished Airing,"Oct 9, 2002 to Mar 19, 2003",gimik,Funimation,Gonzo,Original,"Action, Sci-Fi","Mecha, Space, Super Power",23 min. per ep.,R+ - Mild Nudity,255,Fall 2002,Unknown,
Kidou Senshi Gundam 00: Tenshi-tachi no Kiseki,,7.17,7228,3384,7,Special,1,Finished Airing,25-Sep-08,"None found, add some",Bandai Entertainment,Sunrise,Original,"Action, Sci-Fi",Mecha,24 min.,PG-13 - Teens 13 or older,5,,,
Kidou Senshi Gundam SEED Destiny,Mobile Suit Gundam SEED Destiny,7.17,1974,3385,109,TV,50,Finished Airing,"Oct 9, 2004 to Oct 1, 2005","Sotsu,       Mainichi Broadcasting System,       Sony Music Entertainment","Nozomi Entertainment,       Bandai Entertainment,       NYAV Post",Sunrise,Original,"Action, Drama, Romance, Sci-Fi","Mecha, Military, Space",24 min. per ep.,R - 17+ (violence & profanity),"1,103",Fall 2004,Unknown,
Kimi ga Nozomu Eien,Rumbling Hearts,7.17,1610,3386,143,TV,14,Finished Airing,"Oct 5, 2003 to Jan 4, 2004","Lantis,       Media Factory,       Age",Funimation,Studio Fantasia,Visual novel,"Drama, Romance",Love Polygon,23 min. per ep.,R+ - Mild Nudity,"1,061",Fall 2003,Sundays at 00:50 (JST),
Kimi ni Todoke: Kataomoi,Kimi ni Todoke: From Me to You - Unrequited Love,7.17,2461,3387,77,TV Special,1,Finished Airing,05-Jan-11,"None found, add some","NIS America, Inc.",Production I.G,Manga,Romance,,23 min.,PG-13 - Teens 13 or older,51,,,Shoujo
Kono Bijutsu-bu ni wa Mondai ga Aru!,This Art Club Has a Problem!,7.17,789,3388,306,TV,12,Finished Airing,"Jul 8, 2016 to Sep 23, 2016","TBS,       DAX Production,       ASCII Media Works,       King Records",Maiden Japan,feel.,Manga,"Comedy, Romance","School, Visual Arts",24 min. per ep.,PG-13 - Teens 13 or older,800,Summer 2016,Fridays at 02:28 (JST),Seinen
Kujira no Kora wa Sajou ni Utau,Children of the Whales,7.17,1059,3389,231,TV,12,Finished Airing,"Oct 8, 2017 to Dec 24, 2017","Bandai Visual,       Lantis,       Magic Capsule,       Hakuhodo DY Music & Pictures,       Akita Shoten,       Sony PCL,       Contents Seed","None found, add some",J.C.Staff,Manga,"Drama, Fantasy, Mystery, Sci-Fi",,23 min. per ep.,PG-13 - Teens 13 or older,"1,017",Fall 2017,Sundays at 23:00 (JST),Shoujo
Naruto SD: Rock Lee no Seishun Full-Power Ninden,Naruto Spin-Off: Rock Lee & His Ninja Pals,7.17,2101,3390,99,TV,51,Finished Airing,"Apr 3, 2012 to Mar 26, 2013","TV Tokyo,       Shueisha",VIZ Media,Pierrot,Manga,"Action, Comedy",Parody,24 min. per ep.,PG-13 - Teens 13 or older,296,Spring 2012,Tuesdays at 18:00 (JST),Shounen
Naruto: Honoo no Chuunin Shiken! Naruto vs. Konohamaru!!,Naruto Shippuden: Chunin Exam on Fire! Naruto vs. Konohamaru!,7.17,2392,3391,80,Movie,1,Finished Airing,30-Jul-11,Shueisha,VIZ Media,Pierrot,Manga,"Action, Adventure","Martial Arts, Super Power",14 min.,PG-13 - Teens 13 or older,40,,,Shounen
Nogizaka Haruka no Himitsu Purezza ♪,Haruka Nogizaka's Secret Purezza,7.17,2567,3392,72,TV,12,Finished Airing,"Oct 6, 2009 to Dec 22, 2009","ASCII Media Works,       Studio Mausu,       Studio Jack",Discotek Media,Diomedéa,Light novel,"Comedy, Romance","Otaku Culture, School",24 min. per ep.,PG-13 - Teens 13 or older,93,Fall 2009,Tuesdays at 02:14 (JST),
Obey Me!,,7.17,3303,3393,45,ONA,12,Finished Airing,"Jul 16, 2021 to Dec 24, 2021","Sotsu,       Bouncy,       Toei Advertising,       Colored Pencil Animation",Funimation,Colored Pencil Animation Japan,Game,"Comedy, Fantasy",Mythology,5 min. per ep.,PG-13 - Teens 13 or older,818,,,
One Piece: Umi no Heso no Daibouken-hen,One Piece: Adventure in the Ocean's Navel,7.17,3620,3394,38,TV Special,1,Finished Airing,20-Dec-00,"None found, add some","None found, add some",Toei Animation,Manga,"Action, Adventure, Fantasy",,49 min.,PG-13 - Teens 13 or older,24,,,Shounen
Papa no Iukoto wo Kikinasai!: Pokkapoka,,7.17,3529,3395,40,Special,1,Finished Airing,11-Jul-12,"None found, add some",Sentai Filmworks,feel.,Light novel,"Comedy, Romance",Childcare,23 min.,PG-13 - Teens 13 or older,19,,,
Phi Brain: Kami no Puzzle,Phi-Brain ~ Puzzle of God,7.17,1973,3396,109,TV,25,Finished Airing,"Oct 2, 2011 to Apr 1, 2012",NHK,Sentai Filmworks,Sunrise,Original,"Action, Mystery, Suspense","High Stakes Game, Strategy Game",24 min. per ep.,PG-13 - Teens 13 or older,234,Fall 2011,Unknown,
Ple Ple Pleiades × Kagejitsu!,,7.17,7094,3397,7,ONA,1,Finished Airing,31-Oct-23,"None found, add some","None found, add some",Studio PuYUKAI,Original,"Comedy, Fantasy",,10 min.,PG-13 - Teens 13 or older,8,,,
Red Shoes,Red Shoes and the Seven Dwarfs,7.17,13014,3398,1,Movie,1,Finished Airing,25-Jul-19,Locus Corporation,"None found, add some","None found, add some",Original,"Comedy, Romance",,1 hr. 32 min.,G - All Ages,6,,,
Sarusuberi: Miss Hokusai,Miss Hokusai,7.17,3774,3399,35,Movie,1,Finished Airing,09-May-15,"Sunrise,       TV Tokyo,       Bandai Visual,       OLM,       Asatsu DK,       DandeLion Animation Studio,       Trans Cosmos,       Production GoodBook,       Asahi Shimbun,       Tokyo Theatres","NYAV Post,       GKIDS",Production I.G,Manga,"Award Winning, Drama, Supernatural","Historical, Visual Arts",1 hr. 30 min.,PG-13 - Teens 13 or older,59,,,Seinen
Shin Hakkenden,,7.17,7512,3400,6,TV,26,Finished Airing,"Apr 3, 1999 to Sep 25, 1999",TV Tokyo,"None found, add some",Public & Basic,Original,"Action, Adventure, Sci-Fi",Martial Arts,24 min. per ep.,PG-13 - Teens 13 or older,21,Spring 1999,Unknown,
Sola,,7.17,2076,3401,101,TV,13,Finished Airing,"Apr 7, 2007 to Jun 30, 2007",Lantis,Bandai Entertainment,Nomad,Manga,"Drama, Romance, Supernatural",,23 min. per ep.,PG-13 - Teens 13 or older,412,Spring 2007,Unknown,
Street Fighter II Movie,Street Fighter II: The Animated Movie,7.17,3933,3402,32,Movie,1,Finished Airing,06-Aug-94,"None found, add some","Discotek Media,       Manga Entertainment",Group TAC,Game,Action,Martial Arts,1 hr. 41 min.,R+ - Mild Nudity,158,,,
Suzuka,,7.17,1872,3403,116,TV,26,Finished Airing,"Jul 7, 2005 to Dec 29, 2005","Marvelous Entertainment,       Starchild Records,       Studio Jack",Funimation,Studio Comet,Manga,"Drama, Romance, Sports",,23 min. per ep.,PG-13 - Teens 13 or older,649,Summer 2005,Thursdays at 01:00 (JST),Shounen
Tensei shitara Slime Datta Ken 2nd Season: Kanwa - Veldora Nikki 2,That Time I Got Reincarnated as a Slime Season 2: Tales - Veldora's Journal 2,7.17,2927,3404,57,TV Special,1,Finished Airing,29-Jun-21,"None found, add some","None found, add some",8bit,Manga,"Action, Adventure, Comedy, Fantasy",Isekai,23 min.,PG-13 - Teens 13 or older,286,,,
Tobe! Isami,Soar High! Isami,7.17,10076,3405,3,TV,50,Finished Airing,"Apr 8, 1995 to Mar 30, 1996","None found, add some",Hirameki International,Group TAC,Original,"Action, Adventure, Comedy, Romance",,25 min. per ep.,PG-13 - Teens 13 or older,14,Spring 1995,Saturdays at 18:00 (JST),
Uta no☆Prince-sama♪ Maji Love 2000%,Uta no Prince Sama 2,7.17,1918,3406,113,TV,13,Finished Airing,"Apr 4, 2013 to Jun 27, 2013","Showgate,       King Records",Sentai Filmworks,A-1 Pictures,Visual novel,"Comedy, Romance","Idols (Male), Music, Reverse Harem, School",25 min. per ep.,PG-13 - Teens 13 or older,542,Spring 2013,Unknown,Josei
Yoru wa Neko to Issho,Nights with a Cat,7.17,5650,3407,13,TV,30,Finished Airing,"Aug 4, 2022 to Jan 11, 2023",Kadokawa,"None found, add some",Studio PuYUKAI,Web manga,Comedy,Pets,2 min. per ep.,G - All Ages,108,Summer 2022,Thursdays at 01:00 (JST),
Yowamushi Pedal: Re:Generation,,7.17,7975,3408,5,Movie,1,Finished Airing,13-Oct-17,"None found, add some","None found, add some",TMS Entertainment,Manga,Sports,,1 hr. 30 min.,PG-13 - Teens 13 or older,2,,,Shounen
Yuu☆Yuu☆Hakusho: Meikai Shitou-hen - Honoo no Kizuna,Yu Yu Hakusho the Movie: Poltergeist Report,7.17,4073,3409,30,Movie,1,Finished Airing,09-Apr-94,"Movic,       A-Line",Central Park Media,Pierrot,Manga,"Action, Fantasy","Martial Arts, Mythology",1 hr. 34 min.,PG-13 - Teens 13 or older,36,,,Shounen
Zutto Mae kara Suki deshita. Kokuhaku Jikkou Iinkai: Kinyoubi no Ohayou,I've Always Liked You: A Friday's Good Morning,7.17,4430,3410,25,Special,1,Finished Airing,26-Oct-16,Aniplex,"None found, add some",Qualia Animation,Music,Romance,School,3 min.,PG - Children,29,,,
Shin Shirayuki-hime Densetsu Prétear,Prétear: The New Legend of Snow White,7.16,2734,3411,64,TV,13,Finished Airing,"Apr 4, 2001 to Jun 27, 2001","Kadokawa Shoten,       Rondo Robe","ADV Films,       Funimation",HAL Film Maker,Manga,"Drama, Fantasy, Romance","Mahou Shoujo, Reverse Harem, Super Power",23 min. per ep.,PG-13 - Teens 13 or older,432,Spring 2001,Wednesdays at 18:30 (JST),Shoujo
Tenchi Souzou Design-bu,Heaven's Design Team,7.16,2421,3412,79,TV,12,Finished Airing,"Jan 7, 2021 to Mar 25, 2021","Dentsu,       Kodansha,       AT-X,       Studio Mausu,       BS Fuji,       Tokyo MX,       Avex Pictures,       TV Aichi","None found, add some",Asahi Production,Manga,"Comedy, Fantasy","Educational, Gag Humor, Mythology, Workplace",23 min. per ep.,PG-13 - Teens 13 or older,291,Winter 2021,Thursdays at 23:30 (JST),Seinen
Tetsuwan Atom (1980),Astro Boy (1980),7.16,5444,3413,15,TV,52,Finished Airing,"Oct 1, 1980 to Dec 23, 1981",Nippon Television Network,"Discotek Media,       Manga Entertainment",Tezuka Productions,Manga,"Action, Adventure, Sci-Fi",,24 min. per ep.,G - All Ages,95,Fall 1980,Unknown,Shounen
The iDOLM@STER Cinderella Girls,,7.16,2472,3414,76,TV,13,Finished Airing,"Jan 10, 2015 to Apr 11, 2015","Aniplex,       Half H.P Studio,       Nippon Columbia,       Bandai Namco Games,       Anime Consortium Japan,       Cygames","None found, add some",A-1 Pictures,Game,"Comedy, Drama","Idols (Female), Music",24 min. per ep.,PG-13 - Teens 13 or older,474,Winter 2015,Saturdays at 00:00 (JST),
The iDOLM@STER Prologue SideM: Episode of Jupiter,The iDOLM@STER Side M: Episode of Jupiter,7.16,7771,3415,6,Special,1,Finished Airing,01-Oct-17,"Aniplex,       Lantis,       Bandai Namco Live Creative,       Bandai Namco Entertainment,       ABC Animation","None found, add some",A-1 Pictures,Game,,"Idols (Male), Music",34 min.,PG-13 - Teens 13 or older,13,,,
Vandread,,7.16,2312,3416,85,TV,13,Finished Airing,"Oct 3, 2000 to Dec 19, 2000","GDH,       Dentsu,       Media Factory","Funimation,       Geneon Entertainment USA",Gonzo,Original,"Action, Sci-Fi, Ecchi","Mecha, Space",22 min. per ep.,PG-13 - Teens 13 or older,432,Fall 2000,Tuesdays at 18:30 (JST),
"Wake Up, Girls! Shichinin no Idol","Wake Up, Girls! The Movie",7.16,4483,3417,24,Movie,1,Finished Airing,10-Jan-14,"TV Tokyo,       Avex Entertainment,       Sotsu,       Sega,       Gakken,       Rakuonsha,       AT-X,       TOHO,       DIVE II Entertainment,       Good Smile Company",Sentai Filmworks,"Tatsunoko Production,       Ordet",Original,Drama,"Idols (Female), Music",52 min.,PG-13 - Teens 13 or older,19,,,
Yawara!: Zutto Kimi no Koto ga...,,7.16,9670,3418,3,TV Special,1,Finished Airing,19-Jul-96,Kitty Films,"None found, add some",Madhouse,Manga,"Comedy, Romance, Sports",Combat Sports,1 hr. 32 min.,PG-13 - Teens 13 or older,3,,,Seinen
ACCA: 13-ku Kansatsu-ka - Regards,ACCA: 13-Territory Inspection Department - Regards,7.16,5153,3419,17,OVA,1,Finished Airing,14-Feb-20,Lantis,"None found, add some",Madhouse,Manga,"Drama, Fantasy, Mystery","Adult Cast, Detective",47 min.,PG-13 - Teens 13 or older,22,,,Seinen
Area no Kishi,The Knight in the Area,7.16,2493,3420,75,TV,37,Finished Airing,"Jan 7, 2012 to Sep 29, 2012","TV Asahi,       Imagine","None found, add some",Shin-Ei Animation,Manga,"Comedy, Sports","School, Team Sports",25 min. per ep.,PG-13 - Teens 13 or older,220,Winter 2012,Saturdays at 06:00 (JST),Shounen
B: The Beginning,,7.16,682,3421,349,ONA,12,Finished Airing,02-Mar-18,Netflix,"None found, add some",Production I.G,Original,"Action, Mystery, Supernatural, Suspense","Detective, Psychological",23 min. per ep.,R - 17+ (violence & profanity),"1,409",,,
Bakuman.: Deraman.,,7.16,5152,3422,17,Special,2,Finished Airing,"Sep 29, 2012 to Jan 2, 2013",NHK,"None found, add some",J.C.Staff,Manga,Comedy,"Otaku Culture, School",25 min. per ep.,PG-13 - Teens 13 or older,11,,,Shounen
Blood-C: The Last Dark,,7.16,2047,3423,103,Movie,1,Finished Airing,02-Jun-12,"Aniplex,       Dentsu,       Shochiku,       Kadokawa Shoten,       Mainichi Broadcasting System,       Dwango",Funimation,Production I.G,Original,"Action, Horror, Supernatural","Gore, Vampire",1 hr. 46 min.,R+ - Mild Nudity,236,,,
Boku no Hero Academia: Ikinokore! Kesshi no Survival Kunren,My Hero Academia: Make It! Do-or-Die Survival Training,7.16,1339,3424,180,ONA,2,Finished Airing,16-Aug-20,"None found, add some",Funimation,Bones,Manga,Action,"School, Super Power",23 min. per ep.,PG-13 - Teens 13 or older,188,,,Shounen
