Name,English_title,Score,Popularity,Rank,Members,Type,Episodes,Status,Aired,Producers,Licensors,Studios,Source,Genres,Themes,Duration,Rating,Favorites,Premiered,Broadcast,Demographics
Chirin no Suzu,Ringing Bell,7.11,5607,3680,14,Movie,1,Finished Airing,11-Mar-78,Sanrio,Discotek Media,Sunrise,Picture book,"Adventure, Drama, Fantasy",,46 min.,PG-13 - Teens 13 or older,81,,,
ChroNoiR Episode.0,,7.11,10584,3681,2,ONA,1,Finished Airing,28-Jul-23,"None found, add some","None found, add some",A-1 Pictures,Mixed media,Supernatural,Vampire,8 min.,R - 17+ (violence & profanity),34,,,
D.C.if: Da Capo if,,7.11,5297,3682,16,OVA,2,Finished Airing,"Dec 25, 2008 to Mar 25, 2009","None found, add some","None found, add some",Zexcs,Visual novel,"Drama, Romance",Harem,26 min. per ep.,PG-13 - Teens 13 or older,19,,,
Dokidoki♡Densetsu: Mahoujin Guruguru,Magical Circle Guru Guru 2,7.11,8896,3683,4,TV,38,Finished Airing,"Apr 4, 2000 to Dec 26, 2000","TV Tokyo,       Sotsu","None found, add some",Nippon Animation,Manga,"Adventure, Comedy, Fantasy",,23 min. per ep.,G - All Ages,6,Spring 2000,Tuesdays at 18:00 (JST),Shounen
Dragon Ball Z Movie 09: Ginga Girigiri!! Bucchigiri no Sugoi Yatsu,Dragon Ball Z: Bojack Unbound,7.11,1801,3684,123,Movie,1,Finished Airing,10-Jul-93,"None found, add some",Funimation,Toei Animation,Manga,"Action, Adventure, Comedy, Fantasy, Sci-Fi",,50 min.,PG-13 - Teens 13 or older,59,,,Shounen
Futari wa Precure: Max Heart Movie 2 - Yukizora no Tomodachi,,7.11,7419,3685,7,Movie,1,Finished Airing,10-Dec-05,"None found, add some","None found, add some",Toei Animation,Original,"Comedy, Fantasy",Mahou Shoujo,1 hr. 11 min.,G - All Ages,8,,,
Hakuouki: Hekketsuroku - Kyoto Kaisouroku,,7.11,5591,3686,14,TV Special,1,Finished Airing,03-Oct-10,"None found, add some","None found, add some",Studio Deen,Visual novel,"Action, Drama, Supernatural","Historical, Samurai",23 min.,R - 17+ (violence & profanity),15,,,Josei
Hakuouki: Reimeiroku OVA,,7.11,8620,3687,4,OVA,2,Finished Airing,22-May-13,"None found, add some","None found, add some",Studio Deen,Visual novel,"Action, Supernatural",,11 min. per ep.,PG-13 - Teens 13 or older,1,,,Josei
Happiness Charge Precure! Movie: Ningyou no Kuni no Ballerina,,7.11,8990,3688,4,Movie,1,Finished Airing,11-Oct-14,Kinoshita Group Holdings,"None found, add some",Toei Animation,Original,Fantasy,Mahou Shoujo,1 hr. 11 min.,G - All Ages,3,,,
Higeki no Genkyou to Naru Saikyou Gedou Last Boss Joou wa Tami no Tame ni Tsukushimasu.,The Most Heretical Last Boss Queen: From Villainess to Savior,7.11,2274,3689,88,TV,12,Finished Airing,"Jul 7, 2023 to Sep 22, 2023","Mainichi Broadcasting System,       Movic,       Tokyo MX,       BS11,       Ichijinsha,       Nichion,       FuRyu,       MAGNET,       Myrica Music,       AQUA ARIS,       Pia",Sentai Filmworks,OLM,Light novel,Fantasy,"Isekai, Reincarnation",23 min. per ep.,PG-13 - Teens 13 or older,425,Summer 2023,Fridays at 00:00 (JST),Josei
Jigoku Sensei Nube OVA,Hell Teacher Nube,7.11,9407,3690,3,OVA,3,Finished Airing,"Jun 12, 1998 to May 14, 1999",Toei Video,"None found, add some",Toei Animation,Manga,"Action, Comedy, Horror, Supernatural","Mythology, School",30 min. per ep.,PG-13 - Teens 13 or older,6,,,Shounen
Junketsu no Maria,Maria the Virgin Witch,7.11,1512,3691,154,TV,12,Finished Airing,"Jan 11, 2015 to Mar 29, 2015","Bandai Visual,       Lantis,       Kodansha,       I Will",Funimation,Production I.G,Manga,"Comedy, Fantasy, Romance",Historical,24 min. per ep.,R - 17+ (violence & profanity),245,Winter 2015,Sundays at 22:30 (JST),Seinen
Kenkou Zenrakei Suiei-bu Umishou,,7.11,3560,3692,39,TV,13,Finished Airing,"Jul 4, 2007 to Sep 26, 2007","Marvelous Entertainment,       Pony Canyon,       Pony Canyon Enterprises,       Geneon Entertainment","None found, add some",Artland,Manga,"Comedy, Sports, Ecchi",School,25 min. per ep.,PG-13 - Teens 13 or older,94,Summer 2007,Wednesdays at 02:00 (JST),Shounen
Kenyuu Densetsu Yaiba,Legendary Brave Swordsman Yaiba,7.11,6574,3693,9,TV,52,Finished Airing,"Apr 9, 1993 to Apr 1, 1994","TV Tokyo,       Shogakukan-Shueisha Productions,       Television Hokkaido Broadcasting","None found, add some",Pastel,Manga,"Action, Comedy, Fantasy",Martial Arts,22 min. per ep.,PG-13 - Teens 13 or older,42,Spring 1993,Fridays at 18:30 (JST),Shounen
Kiniro no Corda: Secondo Passo,,7.11,3845,3694,33,TV Special,2,Finished Airing,"Mar 26, 2009 to Jun 5, 2009",Koei,"None found, add some",Yumeta Company,Visual novel,Romance,"Music, Performing Arts, Reverse Harem, School",25 min. per ep.,PG-13 - Teens 13 or older,57,,,Josei
Kirakira☆Precure A La Mode,,7.11,5649,3695,13,TV,49,Finished Airing,"Feb 5, 2017 to Jan 28, 2018","Asatsu DK,       Asahi Broadcasting,       ABC Animation,       Echoes","None found, add some",Toei Animation,Original,"Action, Fantasy, Gourmet",Mahou Shoujo,24 min. per ep.,G - All Ages,144,Winter 2017,Sundays at 08:30 (JST),
Konjiki no Gash Bell!!: Mecha Vulkan no Raishuu,Zatch Bell! Attack of Mechavulcan,7.11,7295,3696,7,Movie,1,Finished Airing,06-Aug-05,"None found, add some",Discotek Media,Toei Animation,Unknown,"Adventure, Supernatural",,1 hr. 24 min.,PG-13 - Teens 13 or older,4,,,Shounen
Kuzu no Honkai,Scum's Wish,7.11,293,3697,690,TV,12,Finished Airing,"Jan 13, 2017 to Mar 31, 2017","Aniplex,       Dentsu,       Square Enix,       Studio Hibari,       Fuji TV,       Kyoraku Industrial Holdings,       Kansai Telecasting",Sentai Filmworks,Lerche,Manga,"Drama, Romance","Love Polygon, School",22 min. per ep.,R+ - Mild Nudity,"6,451",Winter 2017,Fridays at 00:55 (JST),Seinen
Lord El-Melloi II Sei no Jikenbo: Rail Zeppelin Grace Note - Hakamori to Neko to Majutsushi,"Lord El-Melloi II's Case Files: Rail Zeppelin Grace Note - A Grave Keeper, a Cat, and a Mage",7.11,2767,3698,63,TV Special,1,Finished Airing,31-Dec-18,Magic Capsule,Aniplex of America,TROYCA,Light novel,"Fantasy, Mystery, Supernatural",,24 min.,PG-13 - Teens 13 or older,46,,,
Madan no Ou to Vanadis,Lord Marksman and Vanadis,7.11,657,3699,361,TV,13,Finished Airing,"Oct 4, 2014 to Dec 27, 2014","Media Factory,       Movic",Funimation,Satelight,Light novel,"Action, Adventure, Fantasy, Ecchi","Harem, Military",24 min. per ep.,R - 17+ (violence & profanity),"1,036",Fall 2014,Saturdays at 20:00 (JST),
Monster Musume no Iru Nichijou OVA,Monster Musume: Everyday Life with Monster Girls OVA,7.11,1950,3700,111,OVA,2,Finished Airing,"Nov 12, 2016 to Apr 13, 2017","None found, add some",Sentai Filmworks,Lerche,Manga,"Comedy, Fantasy, Romance, Ecchi","Anthropomorphic, Harem",24 min. per ep.,R+ - Mild Nudity,129,,,Seinen
Mou Ippon!,"""Ippon"" again!",7.11,4596,3701,23,TV,13,Finished Airing,"Jan 9, 2023 to Apr 3, 2023","TV Tokyo,       Pony Canyon,       Akita Shoten,       MAGNET,       CHOCOLATE,       Three S Studio",Sentai Filmworks,Bakken Record,Manga,Sports,"Combat Sports, School",23 min. per ep.,PG-13 - Teens 13 or older,59,Winter 2023,Mondays at 01:35 (JST),Shounen
Musashi no Ken,,7.11,10002,3702,3,TV,72,Finished Airing,"Apr 18, 1985 to Sep 26, 1986","None found, add some","None found, add some",Eiken,Manga,Sports,Combat Sports,24 min. per ep.,G - All Ages,11,Spring 1985,Unknown,Shounen
Myself; Yourself,,7.11,1291,3703,186,TV,13,Finished Airing,"Oct 3, 2007 to Dec 26, 2007","Marvelous Entertainment,       Pony Canyon,       Happinet Pictures,       5pb.",Maiden Japan,Doga Kobo,Visual novel,"Drama, Romance",School,25 min. per ep.,PG-13 - Teens 13 or older,774,Fall 2007,Wednesdays at 02:15 (JST),
Nils no Fushigi na Tabi,Wonderful Adventures of Nils,7.11,7260,3704,7,TV,52,Finished Airing,"Jan 8, 1980 to Mar 17, 1981","None found, add some",Discotek Media,Pierrot,Novel,"Adventure, Fantasy",,25 min. per ep.,G - All Ages,30,Winter 1980,Unknown,Kids
Oseam,,7.11,7555,3705,6,Movie,1,Finished Airing,01-May-03,"None found, add some","None found, add some","None found, add some",Novel,"Adventure, Drama, Supernatural",Historical,1 hr. 17 min.,G - All Ages,18,,,
Robin Hood no Daibouken,The Great Adventures of Robin Hood,7.11,6620,3706,9,TV,52,Finished Airing,"Jul 29, 1990 to Oct 28, 1992",NHK,"None found, add some",Tatsunoko Production,Unknown,"Adventure, Romance",Historical,25 min. per ep.,G - All Ages,38,Summer 1990,Unknown,
Saraba Uchuu Senkan Yamato: Ai no Senshi-tachi,Farewell to Space Battleship Yamato: In the Name of Love,7.11,8682,3707,4,Movie,1,Finished Airing,05-Aug-78,"None found, add some","None found, add some",Group TAC,Original,"Action, Drama, Sci-Fi","Adult Cast, Military, Space",2 hr. 32 min.,PG-13 - Teens 13 or older,10,,,
"Seija Musou: Salaryman, Isekai de Ikinokoru Tame ni Ayumu Michi",The Great Cleric,7.11,2028,3708,105,TV,12,Finished Airing,"Jul 7, 2023 to Sep 29, 2023","TBS,       Kodansha,       NBCUniversal Entertainment Japan,       BS11,       Crunchyroll,       Nichion,       Micro Magazine Publishing,       MAGNET","None found, add some","Yokohama Animation Lab,       Cloud Hearts",Light novel,"Comedy, Fantasy","Isekai, Reincarnation",24 min. per ep.,PG-13 - Teens 13 or older,327,Summer 2023,Fridays at 01:28 (JST),
Shakugan no Shana-tan Movie,,7.11,4495,3709,24,Special,1,Finished Airing,21-Sep-07,"None found, add some","None found, add some",J.C.Staff,Light novel,"Adventure, Comedy, Fantasy",Parody,5 min.,PG-13 - Teens 13 or older,13,,,
Tate no Yuusha no Nariagari Season 3,The Rising of the Shield Hero Season 3,7.11,538,3710,428,TV,12,Finished Airing,"Oct 6, 2023 to Dec 22, 2023","Frontier Works,       AT-X,       Nippon Columbia,       NTT Docomo,       Glovision,       Good Smile Company,       Sammy,       Crunchyroll,       Kadokawa","None found, add some",Kinema Citrus,Light novel,"Action, Adventure, Drama, Fantasy",Isekai,23 min. per ep.,PG-13 - Teens 13 or older,"6,122",Fall 2023,Fridays at 21:00 (JST),
Tennis no Oujisama: Another Story II - Ano Toki no Bokura Specials,The Prince of Tennis OVA Another Story II Bonus,7.11,8575,3711,4,Special,2,Finished Airing,"Aug 26, 2011 to Oct 26, 2011",M.S.C,"None found, add some",Production I.G,Manga,Sports,,3 min. per ep.,PG-13 - Teens 13 or older,2,,,Shounen
Urara Meirochou,Urara Meirocho,7.11,1719,3712,132,TV,12,Finished Airing,"Jan 6, 2017 to Mar 24, 2017","TBS,       Magic Capsule,       Houbunsha,       NBCUniversal Entertainment Japan,       Nichion",Sentai Filmworks,J.C.Staff,4-koma manga,"Comedy, Fantasy",CGDCT,24 min. per ep.,PG-13 - Teens 13 or older,415,Winter 2017,Fridays at 01:58 (JST),Seinen
Zhu Tian Ji,Thousands of worlds,7.11,11910,3713,1,ONA,26,Finished Airing,"Jan 28, 2022 to Jul 15, 2022",Youku,"None found, add some",2:10 AM Animation,Manga,"Action, Adventure, Fantasy",Martial Arts,14 min. per ep.,PG-13 - Teens 13 or older,24,,,
Soukou Kihei Votoms: The Last Red Shoulder,Armored Trooper Votoms: The Last Red Shoulder,7.1,8740,3714,4,OVA,1,Finished Airing,21-Aug-85,"None found, add some",Maiden Japan,Sunrise,Original,"Action, Drama, Sci-Fi","Mecha, Military",54 min.,PG-13 - Teens 13 or older,3,,,
Star Wars: Visions,,7.1,2212,3715,91,ONA,9,Finished Airing,22-Sep-21,"None found, add some","None found, add some","Production I.G,       Kinema Citrus,       Kamikaze Douga,       Trigger,       Studio Colorido,       Geno Studio,       Science SARU",Other,"Action, Adventure, Sci-Fi","Military, Space",15 min. per ep.,PG-13 - Teens 13 or older,374,,,
Tenchi Muyou! Manatsu no Eve,Tenchi the Movie 2: Daughter of Darkness,7.1,5317,3716,16,Movie,1,Finished Airing,02-Aug-97,"Genco,       Pioneer LDC,       Nippon Cultural Broadcasting","Funimation,       Geneon Entertainment USA",AIC,Original,"Action, Comedy, Sci-Fi",Space,59 min.,R+ - Mild Nudity,15,,,
Tonari no Kaibutsu-kun: Tonari no Gokudou-kun,My Little Monster OVA,7.1,2025,3717,105,OVA,1,Finished Airing,12-Aug-13,"None found, add some","None found, add some",Brain's Base,Manga,"Comedy, Romance",Historical,27 min.,PG-13 - Teens 13 or older,62,,,Shoujo
Tonari no Yamada-kun,My Neighbors the Yamadas,7.1,3166,3718,49,Movie,1,Finished Airing,17-Jul-99,Tokuma Shoten,"Disney Platform Distribution,       GKIDS",Studio Ghibli,4-koma manga,"Award Winning, Comedy, Slice of Life",,1 hr. 43 min.,G - All Ages,108,,,
Toriko Movie: Bishokushin no Special Menu,Toriko the Movie: Secret Recipe of Gourmet God!,7.1,7363,3719,7,Movie,1,Finished Airing,27-Jul-13,"Yomiko Advertising,       Toei Video,       Bandai,       Nippon Columbia,       Happinet Pictures,       Bandai Namco Games,       Shueisha",Discotek Media,Toei Animation,Manga,"Action, Adventure, Comedy, Fantasy",,1 hr. 21 min.,PG-13 - Teens 13 or older,4,,,Shounen
Virtua Fighter,,7.1,6012,3720,11,TV,35,Finished Airing,"Oct 9, 1995 to Jun 27, 1996","Aniplex,       TMS Entertainment,       Yomiko Advertising,       Sega,       Half H.P Studio,       TV Tokyo Music,       Sony Music Entertainment","Media Blasters,       Discotek Media",Tokyo Movie Shinsha,Game,Action,Martial Arts,22 min. per ep.,PG-13 - Teens 13 or older,40,Fall 1995,Mondays at 18:30 (JST),
Xian Wu Chuan,Legend of Xianwu,7.1,12497,3721,1,ONA,26,Finished Airing,"Mar 19, 2023 to Sep 3, 2023","Youku,       Dongyao Dongman","None found, add some",Xiaoming Taiji,Web novel,"Action, Adventure, Fantasy","Historical, Martial Arts",15 min. per ep.,PG-13 - Teens 13 or older,12,,,
Ze Tian Ji 5th Season,,7.1,10879,3722,2,ONA,12,Finished Airing,"Mar 16, 2020 to May 25, 2020","Tencent Penguin Pictures,       China Literature Limited","None found, add some",Foch Films,Novel,"Action, Adventure, Fantasy",,21 min. per ep.,PG-13 - Teens 13 or older,2,,,
30-pun de Wakaru! Kore made no Love Live!,Love Live! School Idol Project in 30 Minutes,7.1,6426,3723,10,ONA,2,Finished Airing,"Apr 24, 2015 to May 22, 2015","None found, add some","None found, add some",Sunrise,Other,Slice of Life,"Idols (Female), Music, School",30 min. per ep.,PG-13 - Teens 13 or older,24,,,
Adachi to Shimamura,Adachi and Shimamura,7.1,1245,3724,193,TV,12,Finished Airing,"Oct 9, 2020 to Dec 25, 2020","Pony Canyon,       Kadokawa",Funimation,Tezuka Productions,Light novel,Girls Love,School,24 min. per ep.,PG-13 - Teens 13 or older,"1,553",Fall 2020,Fridays at 01:58 (JST),
Ai Yori Aoshi,,7.1,1946,3725,111,TV,24,Finished Airing,"Apr 11, 2002 to Sep 26, 2002","Movic,       Fuji TV,       Pioneer LDC,       Cosmic Ray","Funimation,       Geneon Entertainment USA",J.C.Staff,Manga,"Comedy, Drama, Romance",Harem,23 min. per ep.,PG-13 - Teens 13 or older,457,Spring 2002,Unknown,Seinen
Alice to Zouroku,Alice & Zoroku,7.1,1839,3726,119,TV,12,Finished Airing,"Apr 2, 2017 to Jun 25, 2017","Bandai Visual,       Lantis,       Tokuma Shoten,       Tokyo MX,       Hakuhodo DY Music & Pictures,       Sony PCL",Funimation,J.C.Staff,Manga,"Adventure, Mystery",Super Power,23 min. per ep.,PG-13 - Teens 13 or older,236,Spring 2017,Sundays at 22:30 (JST),Seinen
Amanchu! Advance,,7.1,3936,3727,32,TV,12,Finished Airing,"Apr 7, 2018 to Jun 23, 2018","Production I.G,       Frontier Works,       Shochiku,       AT-X,       flying DOG,       Tokyo MX,       Mag Garden","None found, add some",J.C.Staff,Manga,Slice of Life,"Iyashikei, School",23 min. per ep.,PG-13 - Teens 13 or older,34,Spring 2018,Saturdays at 23:00 (JST),Shounen
Anime Sanjuushi,The Three Musketeers,7.1,8127,3728,5,TV,52,Finished Airing,"Oct 9, 1987 to Feb 17, 1989","NHK,       Gakken","None found, add some",Gallop,Novel,"Adventure, Drama, Romance",Historical,25 min. per ep.,G - All Ages,27,Fall 1987,Unknown,
Ao no Exorcist: Kyoto Fujouou-hen OVA,Blue Exorcist: Kyoto Saga OVA,7.1,2569,3729,71,OVA,2,Finished Airing,"Apr 4, 2017 to Oct 4, 2017","None found, add some","None found, add some",A-1 Pictures,Manga,"Action, Fantasy",Mythology,24 min. per ep.,PG-13 - Teens 13 or older,58,,,Shounen
Bastard!! Ankoku no Hakaishin: Jigoku no Chinkonka-hen,"Bastard‼ Heavy Metal, Dark Fantasy Season 2",7.1,5332,3730,16,ONA,15,Finished Airing,31-Jul-23,"Warner Bros. Japan,       Shueisha,       Felix Film","None found, add some",LIDENFILMS,Manga,"Action, Adventure, Fantasy, Ecchi",Gore,23 min. per ep.,R+ - Mild Nudity,60,,,Seinen
Chikyuu Bouei Kigyou Dai-Guard,Dai-Guard: Terrestrial Defense Corp.,7.1,6412,3731,10,TV,26,Finished Airing,"Oct 5, 1999 to Mar 28, 2000","Sotsu,       TV Tokyo Music","ADV Films,       Discotek Media",Xebec,Original,"Adventure, Comedy, Sci-Fi","Mecha, Military",23 min. per ep.,PG-13 - Teens 13 or older,34,Fall 1999,Tuesdays at 18:00 (JST),
Digimon Adventure 02 Movies,Digimon Movie 02 - Digimon Hurricane Touchdown! Supreme Evolution! The Golden Digimentals.,7.1,3255,3732,46,Movie,2,Finished Airing,08-Jul-00,Bandai Visual,"Discotek Media,       Saban Entertainment",Toei Animation,Original,"Adventure, Fantasy, Sci-Fi",,32 min. per ep.,PG - Children,43,,,Kids
Dirty Pair OVA,,7.1,6961,3733,8,OVA,10,Finished Airing,"Dec 21, 1987 to Apr 21, 1988","None found, add some","ADV Films,       Nozomi Entertainment","Sunrise,       Kino Production",Light novel,"Adventure, Comedy, Sci-Fi",,24 min. per ep.,PG-13 - Teens 13 or older,19,,,
Doraemon Movie 06: Nobita no Little Star Wars,Doraemon the Movie: Nobita's Little Space War,7.1,7349,3734,7,Movie,1,Finished Airing,16-Mar-85,"None found, add some","None found, add some",Shin-Ei Animation,Unknown,"Fantasy, Sci-Fi",Space,1 hr. 38 min.,PG - Children,4,,,
Doraemon: The Day When I Was Born,,7.1,9366,3735,3,Movie,1,Finished Airing,09-Mar-02,"None found, add some","None found, add some",Shin-Ei Animation,Unknown,"Comedy, Fantasy, Sci-Fi",,28 min.,PG - Children,0,,,"KidsKids,         ShounenShounen"
Dorohedoro: Ma no Omake,Dorohedoro: Bonus Curse or Extra Evil,7.1,2993,3736,54,Special,6,Finished Airing,17-Jun-20,"None found, add some","None found, add some",MAPPA,Manga,"Action, Comedy, Fantasy, Horror",,5 min. per ep.,R+ - Mild Nudity,86,,,Seinen
Fei Ren Zai,Non-Human,7.1,8798,3737,4,ONA,48,Finished Airing,"Mar 29, 2018 to Jun 27, 2019",Tencent Penguin Pictures,"None found, add some",Fenz,Manga,"Comedy, Supernatural",Mythology,5 min. per ep.,PG-13 - Teens 13 or older,21,,,
Galaxy Angel 3 Specials,Galaxy Angel AA,7.1,9311,3738,3,Special,2,Finished Airing,28-Nov-03,Broccoli,"Nozomi Entertainment,       Bandai Entertainment","None found, add some",Unknown,"Comedy, Sci-Fi",,13 min. per ep.,PG - Children,3,,,
Guilty Crown: Kiseki - Reassortment,Guilty Crown Locus: Reassortment,7.1,3604,3739,39,TV Special,1,Finished Airing,03-Jan-12,"None found, add some","None found, add some",Production I.G,Original,"Action, Sci-Fi",Super Power,48 min.,R - 17+ (violence & profanity),39,,,
Haiyore! Nyaruko-san: Yasashii Teki no Shitome-kata,,7.1,3923,3740,32,OVA,1,Finished Airing,23-Nov-12,"None found, add some","None found, add some",Xebec,Light novel,"Comedy, Sci-Fi",Parody,14 min.,PG-13 - Teens 13 or older,19,,,
Hatenkou Yuugi,Hatenkou Yugi,7.1,3654,3741,38,TV,10,Finished Airing,"Jan 5, 2008 to Mar 8, 2008","Frontier Works,       Sotsu",Sentai Filmworks,Studio Deen,Manga,"Adventure, Comedy, Drama, Fantasy, Romance",,24 min. per ep.,PG-13 - Teens 13 or older,169,Winter 2008,Saturdays at 02:30 (JST),Josei
Hayate no Gotoku! OVA,,7.1,5699,3742,13,OVA,3,Finished Airing,"Jun 18, 2014 to Dec 16, 2014","None found, add some","None found, add some",Manglobe,Manga,"Comedy, Romance","Harem, Parody",24 min. per ep.,PG-13 - Teens 13 or older,3,,,Shounen
Himouto! Umaru-chan,,7.1,291,3743,693,TV,12,Finished Airing,"Jul 9, 2015 to Sep 24, 2015","AT-X,       TOHO animation,       Good Smile Company,       Shueisha,       BS11,       Jinnan Studio,       RAY",Sentai Filmworks,Doga Kobo,Manga,Comedy,"Otaku Culture, School",24 min. per ep.,PG-13 - Teens 13 or older,"4,522",Summer 2015,Thursdays at 02:14 (JST),Seinen
Hoshi no Koe,Voices of a Distant Star,7.1,1494,3744,157,OVA,1,Finished Airing,02-Feb-02,"None found, add some","ADV Films,       GKIDS",CoMix Wave Films,Original,"Action, Award Winning, Drama, Romance, Sci-Fi","Mecha, Space",24 min.,PG-13 - Teens 13 or older,538,,,
Junkers Come Here,,7.1,7458,3745,6,Movie,1,Finished Airing,18-Mar-95,"Bandai Visual,       Kadokawa Shoten",Bandai Entertainment,Triangle Staff,Novel,"Award Winning, Drama",,1 hr. 39 min.,G - All Ages,7,,,
Kamisama Kazoku,,7.1,3189,3746,48,TV,13,Finished Airing,"May 18, 2006 to Aug 10, 2006","Animax,       Sony Music Entertainment","None found, add some",Toei Animation,Light novel,"Comedy, Drama, Fantasy, Romance",,25 min. per ep.,PG-13 - Teens 13 or older,87,Spring 2006,Thursdays at 22:30 (JST),
Karin,,7.1,1345,3747,179,TV,24,Finished Airing,"Nov 3, 2005 to May 11, 2006","WOWOW,       Frontier Works,       Kadokawa Shoten,       Half H.P Studio","Funimation,       Geneon Entertainment USA",J.C.Staff,Manga,"Comedy, Romance, Supernatural","School, Vampire",23 min. per ep.,PG-13 - Teens 13 or older,762,Fall 2005,Fridays at 00:00 (JST),Shounen
Kazemakase Tsukikage Ran,Carried by the Wind: Tsukikage Ran,7.1,5119,3748,17,TV,13,Finished Airing,"Jan 26, 2000 to Apr 19, 2000",Bandai Visual,Bandai Entertainment,Madhouse,Original,"Adventure, Comedy","Historical, Martial Arts, Samurai",23 min. per ep.,PG-13 - Teens 13 or older,83,Winter 2000,Wednesdays at 19:00 (JST),
Kimi ga Aruji de Shitsuji ga Ore de,They Are My Noble Masters,7.1,1836,3749,119,TV,13,Finished Airing,"Jan 6, 2008 to Mar 30, 2008","Lantis,       Studio Jack,       Good Smile Company","None found, add some",A.C.G.T.,Visual novel,"Comedy, Romance, Ecchi","Harem, Parody",25 min. per ep.,R+ - Mild Nudity,240,Winter 2008,Sundays at 02:00 (JST),
Koe no Katachi Specials,A Silent Voice Specials,7.1,4394,3750,25,Special,2,Finished Airing,17-May-17,"None found, add some","None found, add some",Kyoto Animation,Manga,,Music,2 min. per ep.,PG-13 - Teens 13 or older,45,,,
Kyoushoku Soukou Guyver (1989),The Guyver: Bio-Booster Armor,7.1,5496,3751,14,OVA,6,Finished Airing,"Sep 25, 1989 to Feb 25, 1990",animate Film,Manga Entertainment,Visual 80,Manga,"Action, Horror, Sci-Fi","Gore, Super Power",29 min. per ep.,PG-13 - Teens 13 or older,123,,,Shounen
Lupin III: $1 Money Wars,Lupin III: Missed by a Dollar,7.1,7132,3752,7,TV Special,1,Finished Airing,28-Jul-00,"VAP,       Tohokushinsha Film Corporation","Funimation,       Discotek Media",TMS Entertainment,Manga,"Action, Adventure, Comedy, Mystery",Adult Cast,1 hr. 30 min.,PG-13 - Teens 13 or older,1,,,Seinen
Lupin III: Dead or Alive,,7.1,5971,3753,12,Movie,1,Finished Airing,20-Apr-96,"VAP,       Tohokushinsha Film Corporation","Funimation,       Discotek Media",Tokyo Movie Shinsha,Manga,"Action, Adventure, Comedy, Mystery",Adult Cast,1 hr. 37 min.,PG-13 - Teens 13 or older,8,,,Seinen
Mouretsu Pirates: Abyss of Hyperspace,Bodacious Space Pirates the Movie: Abyss of Hyperspace,7.1,5663,3754,13,Movie,1,Finished Airing,22-Feb-14,"Starchild Records,       Sankyo",Sentai Filmworks,Satelight,Light novel,Sci-Fi,Space,1 hr. 32 min.,PG-13 - Teens 13 or older,15,,,
Nanatsu no Taizai Movie 1: Tenkuu no Torawarebito,The Seven Deadly Sins the Movie: Prisoners of the Sky,7.1,810,3755,301,Movie,1,Finished Airing,18-Aug-18,"Aniplex,       Kodansha","None found, add some",A-1 Pictures,Manga,"Action, Adventure, Fantasy",,1 hr. 39 min.,PG-13 - Teens 13 or older,341,,,Shounen
Nobunaga no Shinobi,Ninja Girl & Samurai Master,7.1,4259,3756,27,TV,26,Finished Airing,"Oct 4, 2016 to Mar 28, 2017","None found, add some","None found, add some",TMS Entertainment,4-koma manga,Comedy,Historical,3 min. per ep.,PG-13 - Teens 13 or older,35,Fall 2016,Tuesdays at 21:55 (JST),
Onegai☆Teacher,Please Teacher!,7.1,1351,3757,178,TV,12,Finished Airing,"Jan 10, 2002 to Mar 28, 2002","Bandai Visual,       Genco","Nozomi Entertainment,       Bandai Entertainment",Daume,Original,"Drama, Romance, Sci-Fi",School,22 min. per ep.,PG-13 - Teens 13 or older,974,Winter 2002,Thursdays at Unknown,
PriPara Movie: Mi~nna de Kagayake! Kirarin☆Star Live!,,7.1,11276,3758,2,Movie,1,Finished Airing,04-Mar-17,"None found, add some","None found, add some",Tatsunoko Production,Game,Slice of Life,"Idols (Female), Music, School",1 hr. 5 min.,PG - Children,3,,,
Rain Town,,7.1,4378,3759,25,ONA,1,Finished Airing,04-Mar-11,"None found, add some","None found, add some","None found, add some",Original,Drama,,10 min.,G - All Ages,45,,,
Rec: Yurusarezarumono,,7.1,4490,3760,24,TV Special,1,Finished Airing,30-Jun-06,"None found, add some","None found, add some",Shaft,Manga,"Comedy, Romance","Adult Cast, Showbiz",13 min.,PG-13 - Teens 13 or older,4,,,Seinen
Sansha Sanyou,"Three Leaves, Three Colors",7.1,2766,3761,63,TV,12,Finished Airing,"Apr 11, 2016 to Jun 27, 2016","AT-X,       DAX Production,       Houbunsha,       TOHO animation,       RAY",Funimation,Doga Kobo,4-koma manga,"Comedy, Slice of Life","CGDCT, School",24 min. per ep.,PG-13 - Teens 13 or older,124,Spring 2016,Mondays at 00:00 (JST),
Shachiku-san wa Youjo Yuurei ni Iyasaretai.,Miss Shachiku and the Little Baby Ghost,7.1,3678,3762,37,TV,12,Finished Airing,"Apr 7, 2022 to Jun 23, 2022","Pony Canyon,       APDREAM,       Bit grooove promotion,       Happinet Phantom Studios,       Bergamo","None found, add some",Project No.9,Manga,"Comedy, Supernatural",Workplace,23 min. per ep.,PG-13 - Teens 13 or older,142,Spring 2022,Thursdays at 21:00 (JST),Shounen
Kaiketsu Zorori,,7.09,9251,3763,3,TV,52,Finished Airing,"Feb 1, 2004 to Feb 6, 2005",Nagoya Broadcasting Network,"None found, add some",Ajia-do,Unknown,"Adventure, Comedy",,24 min. per ep.,PG - Children,42,Winter 2004,Unknown,
Kindaichi Shounen no Jikenbo Returns 2nd Season: Akechi Keibu no Jikenbo,,7.09,11198,3764,2,Special,1,Finished Airing,26-Dec-15,Yomiuri Telecasting,"None found, add some",Toei Animation,Manga,Mystery,,47 min.,R - 17+ (violence & profanity),0,,,Shounen
Love Hina,,7.09,916,3765,267,TV,24,Finished Airing,"Apr 19, 2000 to Sep 27, 2000","TV Tokyo,       Yomiko Advertising","Funimation,       Bandai Entertainment",Xebec,Manga,"Comedy, Romance, Ecchi",Harem,23 min. per ep.,PG-13 - Teens 13 or older,"1,477",Spring 2000,Wednesdays at 22:28 (JST),Shounen
