Name,Anime_url,Review
Monster Strike: Mermaid Rhapsody,https://myanimelist.net/anime/33546/Monster_Strike__Mermaid_Rhapsody,[]
Nagasaki 1945: Angelus no Kane,https://myanimelist.net/anime/3465/Nagasaki_1945__Angelus_no_Kane,[]
Otome wa Boku ni Koishiteru Special,https://myanimelist.net/anime/2615/Otome_wa_Boku_ni_Koishiteru_Special,"['This is my FIRST review, so please don\'t hate me or anything >_>;I LOVED this.  This was the most best thing I\'ve ever seen yet, even though it was short, I wanted more. D:Alright well enough loving.The Story here in the special is just like your old, average Cinderella Story.Cinderella works for her 2  ugly step-sisters and her step-mom,Then one day they received a letter to go to the ball and blah..Then the 2 step-sisters goes and buys a dress or whatever,Then.. blah blah blah,  Cinderella wants to go to the ball so her friends, the mices or mouses made a dress...for her but then later her step sisters ripped itThen they left her then Cinderella cries, but then Fairy God Mother shows up,and Cinderella has her new dress on, then she turned some of her friends to Horses, and so, they got everything prepared and they went to the BALL!The Prince was sitting in his chair and there wasn\'t any girls that interested him, but then later... DUN DUN DUN DUNNN. CINDERELLA COMES!And so, The Prince and Cinderella dances together~ but then later it was late, and it was the time that Cinderella\'s Fairy Godmother told her about. And so, Cinderella had to run before the prince will see her in her old, raggy dress and she ran down stairs! And so, her glass slipper is left on one of the steps, and then Cinderella runned for her life!  Then later there was news thats related to the glass slipper. And so, the Prince went to EVERY girls houses, and then last, it was Cinderella\'s house. And so they came in, and they tried the 2 Step-Sisters but they didn\'t fit. but then, when Cinderella came, She went to try it on and well, YES. It fitted. and so they got married and blah blah blah and yeah, you know.But my friend, this special does have that story that I just said up there, but theres three  twists in this special, As you can see the main character in the special, our Student Council President, Takako is Cinderella, but they changed the name though. They changed it to Cinderella to Tsunderella. Add Tsundere plus ella and you get Tsunderella! Also, our lovely, sweet and kind Shion plays the fairy god mother, and as you can see, when Shion explained about the time thing to Takako, there is also something about ""tentacles"" and trust me, it didn\'t look so pretty... and last, instead of using a Pumpkin carriage with Horses and a man up there to tell the Horses to go, They used Kana for the carriage, and so in the specials, Kana was saying ""~nanodesuyo"" while she was flying/taking Takako to the ball or something. for her but then later her step sisters ripped itThen they left her then Cinderella cries, but then Fairy God Mother shows up,and Cinderella has her new dress on, then she turned some of her friends to Horses, and so, they got everything prepared and they went to the BALL!The Prince was sitting in his chair and there wasn\'t any girls that interested him, but then later... DUN DUN DUN DUNNN. CINDERELLA COMES!And so, The Prince and Cinderella dances together~ but then later it was late, and it was the time that Cinderella\'s Fairy Godmother told her about. And so, Cinderella had to run before the prince will see her in her old, raggy dress and she ran down stairs! And so, her glass slipper is left on one of the steps, and then Cinderella runned for her life!  Then later there was news thats related to the glass slipper. And so, the Prince went to EVERY girls houses, and then last, it was Cinderella\'s house. And so they came in, and they tried the 2 Step-Sisters but they didn\'t fit. but then, when Cinderella came, She went to try it on and well, YES. It fitted. and so they got married and blah blah blah and yeah, you know.But my friend, this special does have that story that I just said up there, but theres three  twists in this special, As you can see the main character in the special, our Student Council President, Takako is Cinderella, but they changed the name though. They changed it to Cinderella to Tsunderella. Add Tsundere plus ella and you get Tsunderella! Also, our lovely, sweet and kind Shion plays the fairy god mother, and as you can see, when Shion explained about the time thing to Takako, there is also something about ""tentacles"" and trust me, it didn\'t look so pretty... and last, instead of using a Pumpkin carriage with Horses and a man up there to tell the Horses to go, They used Kana for the carriage, and so in the specials, Kana was saying ""~nanodesuyo"" while she was flying/taking Takako to the ball or something.', 'This is funny as hell, the main character (Takako) is &quot;Tsunderella&quot;, the obvious pun on the word &quot;tsundere&quot; and &quot;Cinderella&quot;. With a fairy tale setting and guest appearances by Snow White, Red Riding Hood, Mirror Mirror on the Wall, and the evil Queen (at a gingerbread house) this is a nice little encore to the &quot;Otoboku&quot; series. Better to see the series first, to become familiar with the characters, otherwise the whole gag will be lost on you. ', 'omg this is a much watch! i was laughing my #$% off the whole time XDone of my favorite OVAs...ever ']"
Oscar's Oasis,https://myanimelist.net/anime/33430/Oscars_Oasis,"['What a good show, simple, effective, funny and gorgeous, thsi show literrally is a good way to waste wour time, so go ahead and check this, cuz is amazing, really luv this, doesnt need a complicated trama, characters or some elititst things like that, no just funny beetwen animals and a lot of thing, and works perfect, for me, this show is a must watch, the carachters are so compatible, even the extras are good like a sit com form 90s, if u like the comedy, with no sense you need to watch this show, promise you than is good, for me, is a masterpiece ', ""What.The.Hell.When I found out Oscar's Oasis was indeed an anime on myanimelist.net, I HAD to make a review for this childhood kino. It genuinely is quite surprising to hear that this is part Korean. I thought it was fully French, what a diverse world we live in.So I watched most of the series back in the day, but I have vivid memories of some events that took place, with it usually being the same thing over and over, I don't think I am missing out on a lot of stuff to talk about because ultimately, Oscar's Oasis is really just fun and games.It's an episodic...series, filled with funny characters, funny moments, funny situations, and generally everything needed to make for a good kids anime. 3D animation is the entire thing, but it has a good nostalgia call to it, even without, it's fine regardless, fits the theme well and there is seriously nothing jarring about it. The same goes for the sound here, pretty memorable soundtracks, some OST stick to me even today. Lack of actual dialogue but that just means this can be universally enjoyed.I remember talking rubbish about some of the logic here back when I was like 9 or 10 or something like that. Despite its lack of consistency (Oscar's tongue CAN go 50 meters and sprint 70 mph if he wanted to smh), I thought it was fun on the whole, even if sometimes very dumb. I'd watch this with the mindset as a child would, look for the dumb funny nonsense, and don't be a pseudointellectual like I was looking for the chef-d'œuvre in the form of artistic representation of Newton's Gravitation Law of Motion.10/10 for being a great kids anime. It's no Oggy and the Cockroaches tho 🤷🤷. series, filled with funny characters, funny moments, funny situations, and generally everything needed to make for a good kids anime. 3D animation is the entire thing, but it has a good nostalgia call to it, even without, it's fine regardless, fits the theme well and there is seriously nothing jarring about it. The same goes for the sound here, pretty memorable soundtracks, some OST stick to me even today. Lack of actual dialogue but that just means this can be universally enjoyed.I remember talking rubbish about some of the logic here back when I was like 9 or 10 or something like that. Despite its lack of consistency (Oscar's tongue CAN go 50 meters and sprint 70 mph if he wanted to smh), I thought it was fun on the whole, even if sometimes very dumb. I'd watch this with the mindset as a child would, look for the dumb funny nonsense, and don't be a pseudointellectual like I was looking for the chef-d'œuvre in the form of artistic representation of Newton's Gravitation Law of Motion.10/10 for being a great kids anime. It's no Oggy and the Cockroaches tho 🤷🤷.""]"
Mazinger Z tai Ankoku Daishougun,https://myanimelist.net/anime/4406/Mazinger_Z_tai_Ankoku_Daishougun,"[""Mazinger-Z vs General of Darkness is a pretty good passing of the torch.Mazinger Z is an undeniably iconic figure when it comes to the history of anime, one of the first pilotable mecha, cementing and popularizing many of the tropes that are still used 40 years after its inception, the way it was introduced in-series goes to show just how powerful the unit was by it being this unstoppable demon. Now imagine if this titan of power and fame gets absolutely demolished.The forces of the General of Darkness destroying the cities that Kouji worked so hard to protect sets up well just how helpless the...Mazinger will be in this fight. It's honestly disheartening seeing its wide arsenal be useless against the villains: his rocket punches being deflected, his breast beam barely scratching, his missiles almost ineffective, his breath rendered null. seeing the damaged robot head into battle only to have his wings melted and limbs torn during the fight feels like watching a legacy come to an end. In this moment of total despair comes in the one who will take over the title of the demon that fights to protect the world: Tsurugi and the Great Mazinger.Demonstrating how the new unit is an objectively better version of the old one in all regards is a great way to convince the viewer that the Great Mazinger is fit to replace the current protector of the world, and having him work alongside the beat-up Z is a touching method of show that it has good intentions. Great's upgraded weaponry decimating the foes is an incredibly reassuring scene, considering just how hopeless most of the movie was, not only did it convey how Kouji would be ok leaving Tsurugi with his role, but it works well convincing the viewer that the new protagonist is someone they want to watch.If anything, this movie's a fun watch to see something that anime doesn't do as much anymore: an anime icon passing the baton to a new generation. Mazinger will be in this fight. It's honestly disheartening seeing its wide arsenal be useless against the villains: his rocket punches being deflected, his breast beam barely scratching, his missiles almost ineffective, his breath rendered null. seeing the damaged robot head into battle only to have his wings melted and limbs torn during the fight feels like watching a legacy come to an end. In this moment of total despair comes in the one who will take over the title of the demon that fights to protect the world: Tsurugi and the Great Mazinger.Demonstrating how the new unit is an objectively better version of the old one in all regards is a great way to convince the viewer that the Great Mazinger is fit to replace the current protector of the world, and having him work alongside the beat-up Z is a touching method of show that it has good intentions. Great's upgraded weaponry decimating the foes is an incredibly reassuring scene, considering just how hopeless most of the movie was, not only did it convey how Kouji would be ok leaving Tsurugi with his role, but it works well convincing the viewer that the new protagonist is someone they want to watch.If anything, this movie's a fun watch to see something that anime doesn't do as much anymore: an anime icon passing the baton to a new generation.""]"
