Name,Anime_url,Review
Master Mosquiton '99,https://myanimelist.net/anime/1806/Master_Mosquiton_99,"['I was VERY excited to see this anime because of my experience with the OVA.The OVA, ""Master Mosquiton,"" is one of my favorites. It combines great animation, wonderful music, interesting characters, adult humor, nudity, and an ability to draw you in. It was a light-hearted tale of a vampire (Mosquiton) and his mistress (Inaho).The series takes all of that, dilutes it and stretches it so thin that you end up feeling like NOTHING happened after 26 episodes! I realize that the sex and adult content was removed so it would be seen by all ages on TV, but it was a mistake to do so:...Mosquiton was originally an adult dark comedy, and it worked.[ STORY ]The story starts very interesting and intriguing but it falls flat after repetitive episodes. The backstory later within the last 5 episodes almost saves the day but ultimately fails to make up for the series earlier shortcomings.Also, this story is a ""re-imagining"" from the OVA, which is fine, but it wasn\'t as strong a choice. ( OVA: 1920s, Mosquiton \'99:1999) 6/10[ ART ]The animation goes from TERRIBLE to fair and back again within the same scene. So disappointing since ""Master Mosquiton"" had excellent visuals. 4/10[ SOUND ]The music is pretty good. The 1920\'s big band music that trickled over from the OVA is tops and I very much enjoyed the opening theme and background music. Solid. 7/10[ CHARACTER ]Inaho is 100% annoying and vile, which is hard when she\'s the main character. Don\'t get me wrong, it\'s okay that she has many less-than-stellar traits, but she should have at least ONE redeeming quality. Mosquiton is also MUCH more of a wimp and lapdog this time around. He\'s still an adorable Bishounen (^_^). Yuki and Hoono, the two demons, are one-dimensional but are given more depth when you see their back story in their final episodes. There are also two main characters that are unique to the TV series and not the OVA: Wolf Lady and Frankie. The wolf lady proves to have a great backstory, (She cannot TOUCH a member of the opposite sex without lashing out violently/becoming more ""wolf-like"") which includes a great deal of heart breaking backstory. Frankie is boring and has no reason to be in this series.Camille, Mosquiton\'s first wife, who had a HUGE role in the OVA has no pull in the TV series. In the TV series they never establish her as Mosquiton\'s ex-wife she\'s just a henchman. Totally stupid for them to pass up her interesting story.The characters would be rated much higher, but the only good moments in their arc are their backstories, which only appear very late in the series. 5/10[ ENJOYMENT ]The first 20 episodes (give or take the few that stand out) are boring a strung out. When you get to the last 5 or so, your enjoyment goes up immensely. 6/10[ OVERALL ]Final verdict? WATCH THE OVA. It is truly fun, unique and interesting. If you have seen the OVA, and you want more Mosquiton goodness, you may want to watch this anime. It will at least give you some Mosquiton to savor. If you are NEW to this franchise, I would say pass the TV series up. You won\'t have the love of the characters already like I did- that\'s the only way I got through it. 6/10Thanks for reading. Hope this gives a good insight as to whether or not to see this show.~ Musashi Mosquiton was originally an adult dark comedy, and it worked.[ STORY ]The story starts very interesting and intriguing but it falls flat after repetitive episodes. The backstory later within the last 5 episodes almost saves the day but ultimately fails to make up for the series earlier shortcomings.Also, this story is a ""re-imagining"" from the OVA, which is fine, but it wasn\'t as strong a choice. ( OVA: 1920s, Mosquiton \'99:1999) 6/10[ ART ]The animation goes from TERRIBLE to fair and back again within the same scene. So disappointing since ""Master Mosquiton"" had excellent visuals. 4/10[ SOUND ]The music is pretty good. The 1920\'s big band music that trickled over from the OVA is tops and I very much enjoyed the opening theme and background music. Solid. 7/10[ CHARACTER ]Inaho is 100% annoying and vile, which is hard when she\'s the main character. Don\'t get me wrong, it\'s okay that she has many less-than-stellar traits, but she should have at least ONE redeeming quality. Mosquiton is also MUCH more of a wimp and lapdog this time around. He\'s still an adorable Bishounen (^_^). Yuki and Hoono, the two demons, are one-dimensional but are given more depth when you see their back story in their final episodes. There are also two main characters that are unique to the TV series and not the OVA: Wolf Lady and Frankie. The wolf lady proves to have a great backstory, (She cannot TOUCH a member of the opposite sex without lashing out violently/becoming more ""wolf-like"") which includes a great deal of heart breaking backstory. Frankie is boring and has no reason to be in this series.Camille, Mosquiton\'s first wife, who had a HUGE role in the OVA has no pull in the TV series. In the TV series they never establish her as Mosquiton\'s ex-wife she\'s just a henchman. Totally stupid for them to pass up her interesting story.The characters would be rated much higher, but the only good moments in their arc are their backstories, which only appear very late in the series. 5/10[ ENJOYMENT ]The first 20 episodes (give or take the few that stand out) are boring a strung out. When you get to the last 5 or so, your enjoyment goes up immensely. 6/10[ OVERALL ]Final verdict? WATCH THE OVA. It is truly fun, unique and interesting. If you have seen the OVA, and you want more Mosquiton goodness, you may want to watch this anime. It will at least give you some Mosquiton to savor. If you are NEW to this franchise, I would say pass the TV series up. You won\'t have the love of the characters already like I did- that\'s the only way I got through it. 6/10Thanks for reading. Hope this gives a good insight as to whether or not to see this show.~ Musashi', 'This is a anime from about 10 years ago, so give it a bit of leverage here.Story:The story is a re-imagining of the OVA, it places the characters in different places, in different times with slightly different personality changes.   It starts with the greedy Inaho and she finds Mosquiton and forces him to make a contract with her.    Every episode starts with her looking or searching for a piece of O-part that fits the key she has which is slightly annoying because that was every episode.EVERY EPISODE, it was fair but it seemed like you could watch a few episodes...for the light-hearted banter between the Mosquiton & Inaho.    It seems the darkness/adult-comedy/romance isn\'t there anymore, this more of a light-hearted/romance/comedy.  Which, even though it IS the same set of characters, the storyline worked a lot better in being a dark comedy rather than a light one.Some of the character\'s backstory is different, like Camille.  She\'s not with Mosquiton and Germaine or whatever is his name is isn\'t just some guy who seemed like the bad guy at the end.     I preferred it this way, honestly.  Camille in the OVA added something, but her presence here seemed better to me, I don\'t know.The ending episodes are the best, I wish they would have spread them out.  The Christmas one was especially my favourite because it reminded me so much of how Inaho acted in the OVA and their relationship.All in all, the story was fair, kind of fun and made you shake your head at Inaho, so I gave it a 6.Art:The art was alright for it\'s day, I believe that because this has been fan-subbed that the quality has been lost on VCRs.  A lot of people complain about older anime because of this, but I don\'t fault the art or animation.    I am sad that I couldn\'t give it a better rating, because the fun use of colour would have been much better and the animation much smoother and less pixelated had there been original dvd releases.  So -- 5.Sound:Great! They use some of the old OVA music in mixture with some new tunes and some music that makes you feel like ""Oh, this is getting good!""  I loved the music, I have nothing to complain about!  -9Character:I believe that in a light-hearted scenario that this is how the characters would act because there was honestly no darkness in this anime.  Mosquiton was very light hearted and I see how he became very domesticated during the series.    They were all the same basically but with two new characters: Wolf Lady and Frankie.I liked the character\'s development here, it\'s very touching in the ending episodes.  Frankie is often funny and I like his persistence.  I think they add something to the series.THE ONLY CHARACTER I DO NOT LIKE is Akito?  Inaho\'s cousin?  She is annoying, she acts just like Inaho and she reminds me of Sailor Moon?  I don\'t know, it\'s just with Inaho being a frustrating ass, Akito comes in and does the same thing.  When they are in an episode together, I just skipped one completely because it was just stupid.    Even in the end, she was practically useless.    There did not need to be a character to try to hog Inaho\'s spotlight by acting just like her, they show no family ties which makes her appearance more annoying.Enjoyment:  If you like Mosquiton, you\'ll like this kinda.  In my brain, I think of this as a super sequel in my brain where it\'s a certain way so I don\'t think of Inaho as the same exact one in 99\', because they are different in many ways.Overall:  It\'s a little better than decent, I found myself almost tearing near the end because I love Inaho/Mosquiton :]   I think you would too if you saw the OVA for the light-hearted banter between the Mosquiton & Inaho.    It seems the darkness/adult-comedy/romance isn\'t there anymore, this more of a light-hearted/romance/comedy.  Which, even though it IS the same set of characters, the storyline worked a lot better in being a dark comedy rather than a light one.Some of the character\'s backstory is different, like Camille.  She\'s not with Mosquiton and Germaine or whatever is his name is isn\'t just some guy who seemed like the bad guy at the end.     I preferred it this way, honestly.  Camille in the OVA added something, but her presence here seemed better to me, I don\'t know.The ending episodes are the best, I wish they would have spread them out.  The Christmas one was especially my favourite because it reminded me so much of how Inaho acted in the OVA and their relationship.All in all, the story was fair, kind of fun and made you shake your head at Inaho, so I gave it a 6.Art:The art was alright for it\'s day, I believe that because this has been fan-subbed that the quality has been lost on VCRs.  A lot of people complain about older anime because of this, but I don\'t fault the art or animation.    I am sad that I couldn\'t give it a better rating, because the fun use of colour would have been much better and the animation much smoother and less pixelated had there been original dvd releases.  So -- 5.Sound:Great! They use some of the old OVA music in mixture with some new tunes and some music that makes you feel like ""Oh, this is getting good!""  I loved the music, I have nothing to complain about!  -9Character:I believe that in a light-hearted scenario that this is how the characters would act because there was honestly no darkness in this anime.  Mosquiton was very light hearted and I see how he became very domesticated during the series.    They were all the same basically but with two new characters: Wolf Lady and Frankie.I liked the character\'s development here, it\'s very touching in the ending episodes.  Frankie is often funny and I like his persistence.  I think they add something to the series.THE ONLY CHARACTER I DO NOT LIKE is Akito?  Inaho\'s cousin?  She is annoying, she acts just like Inaho and she reminds me of Sailor Moon?  I don\'t know, it\'s just with Inaho being a frustrating ass, Akito comes in and does the same thing.  When they are in an episode together, I just skipped one completely because it was just stupid.    Even in the end, she was practically useless.    There did not need to be a character to try to hog Inaho\'s spotlight by acting just like her, they show no family ties which makes her appearance more annoying.Enjoyment:  If you like Mosquiton, you\'ll like this kinda.  In my brain, I think of this as a super sequel in my brain where it\'s a certain way so I don\'t think of Inaho as the same exact one in 99\', because they are different in many ways.Overall:  It\'s a little better than decent, I found myself almost tearing near the end because I love Inaho/Mosquiton :]   I think you would too if you saw the OVA']"
Meitantei Holmes: Mrs. Hudson Hitojichi Jiken no Maki / Dover Kaikyou no Daikuuchuusen no Maki,https://myanimelist.net/anime/20441/Meitantei_Holmes__Mrs_Hudson_Hitojichi_Jiken_no_Maki___Dover_Kaikyou_no_Daikuuchuusen_no_Maki,[]
Mitsubachi Maya no Bouken,https://myanimelist.net/anime/2571/Mitsubachi_Maya_no_Bouken,"[""First of all I wanted to state that I know this anime from when I was a child growing up in Poland. Back then none of the kids knew what an anime was unless it was something of the sort of Sailor Moon or DragonballZ. I had basically grown up thinking it was a Polish production or European at most, complete with Polish dubbing and a Polish intro so realising it's actually an anime based on Waldemar Bonsels's stories about Maya the Bee has been quite a journey.I decided to rewatch the full series afraid it'd be too boring and childish for me to...continue but I was happily proven wrong. Although a tad outdated it's a wonderful, funny series about the diverse lives of various insects and critters existing alongside them.The character designs of all the bugs are adorable and lovable, the animation - a little janky - but more expressive and you can definitely see the hand-drawn-ness of it in the way the characters move. Their endearing designs are a great lighthearted way to introduce a child to the world of insects without giving them trauma :PAlso I absolutely adore the backgrounds of the series. They seem to be done in watercolor or gouache, and they look beautiful and professionally done. As a watercolor fanatic I have saved a bunch of stills from the series as inspiration fodder.Maya the Bee also has pretty decent music composed for the series, with my favourites being the cicadas' and crickets' musical numbers and the intro. In the Polish dub the intro was sung by Zbigniew Wodecki who had done a wonderful job, the intro being so catchy in Poland almost every then-kid-now-adult knows at least the main part of the song.The characters can be a little bit basic but each of the main characters has their own distinctive way of being without coming off as bland. None of them are too perfect to be true and all have their strengths and weaknesses well balanced out. The main theme of the series is about how different they all are and how it's crucial not to judge each other harshly, as every creature's journey through life is different and deserves respect.Anyway, I had a blast coming back to the series and was delighted to see that even as an adult it succeeded in educating me about the world of insects and inspiring me with the beautiful painted landscapes. It's a charming series with great rewatch value. continue but I was happily proven wrong. Although a tad outdated it's a wonderful, funny series about the diverse lives of various insects and critters existing alongside them.The character designs of all the bugs are adorable and lovable, the animation - a little janky - but more expressive and you can definitely see the hand-drawn-ness of it in the way the characters move. Their endearing designs are a great lighthearted way to introduce a child to the world of insects without giving them trauma :PAlso I absolutely adore the backgrounds of the series. They seem to be done in watercolor or gouache, and they look beautiful and professionally done. As a watercolor fanatic I have saved a bunch of stills from the series as inspiration fodder.Maya the Bee also has pretty decent music composed for the series, with my favourites being the cicadas' and crickets' musical numbers and the intro. In the Polish dub the intro was sung by Zbigniew Wodecki who had done a wonderful job, the intro being so catchy in Poland almost every then-kid-now-adult knows at least the main part of the song.The characters can be a little bit basic but each of the main characters has their own distinctive way of being without coming off as bland. None of them are too perfect to be true and all have their strengths and weaknesses well balanced out. The main theme of the series is about how different they all are and how it's crucial not to judge each other harshly, as every creature's journey through life is different and deserves respect.Anyway, I had a blast coming back to the series and was delighted to see that even as an adult it succeeded in educating me about the world of insects and inspiring me with the beautiful painted landscapes. It's a charming series with great rewatch value."", 'The true OG anime. It\'s the beezneez of cinema. The intro song slaps ASS and it made me cry, especially the part where she looks at the moon all melancholic like. Ya know ""5月、誰もがこの5月が好き"".The art style of the classic renaissance era of the 1970s ages like fine wine in an oak barrel (or whatever the best barrel wood is). Not like the shit modern 3D art that they use in the movies and show (I spit on them).My favourite character is the Spider.So if you\'re in a mood for a thrilling adventure and a unforgettable experience give this a watch. ']"
Mizugumo Monmon,https://myanimelist.net/anime/4306/Mizugumo_Monmon,"[""Monmon is one of six anime films shown only in the Ghibli Museum's Saturn Theatre. It's just a short film animated by Studio Ghibli. I'm probably one the few people on MAL who's seen this. According to wikipedia each month the museum will show a different one of these six films. So to see them all you'd have to be in Japan for six months and go to the museum once a month. The only other other option is to watch a crappy recording from inside the theatre. There are some on youtube, but I don't know if they show the entire animation.As I said...the film is short. Only about 15 minuets. The animation is your typical Ghibli animation, so it's pretty good. The artwork is pretty simple. The sounds are all good. I can't remember how good the music was, but I think it was pretty good. Any Ghibli fan would probably like this movie. It's just too bad these movies are so hard to see. I'd write more of a review, but the film is very short so there is not much to write about. That, and my memory of it could be a lot better. the film is short. Only about 15 minuets. The animation is your typical Ghibli animation, so it's pretty good. The artwork is pretty simple. The sounds are all good. I can't remember how good the music was, but I think it was pretty good. Any Ghibli fan would probably like this movie. It's just too bad these movies are so hard to see. I'd write more of a review, but the film is very short so there is not much to write about. That, and my memory of it could be a lot better."", ""I saw this several years ago when I visited the Ghibli Museum and, as another reviewer said, it really is a shame that it isn't available to more people because it's so beautiful. The music was lovely and, since it's Ghibli, the animation was gorgeous as well. Such a sweet story but also bittersweet. I would go back to the museum solely for the purpose of seeing this again (I loved it so much)! If you're lucky enough to have the opportunity to visit the museum I hope you're able to see it. "", ""I really enjoyed this short film and it's such a pity that not a lot of people are able to see it. The music was amazing and as always even though the storyline was not sad, my eyes teared up. Highly recommend to watch this one while in Japan :) ""]"
Morita-san wa Mukuchi,https://myanimelist.net/anime/9774/Morita-san_wa_Mukuchi,"[""This OVA was made earlier than the TV series, but I made the mistake of watching it later. Unlike the TV episodes it is a full-length 24 minute episode. And it's damn good.It starts with a segment made up of yon-koma panels which speak. Well, basically you have the characters faces as they appear in the manga and there's dubbed audio. There's Miki, Chihiro and Hana doing some introductions of the characters and talking about random stuff for 2 minutes. After this starts the actual episode. And well, the only way I can describe it is that watching this will basically feel like reading 100...chapters of a 4-koma manga at once, if you know what I mean. It's just about mini-occurences and how the characters react to them, how they interact with each other etc. As you get to know them, understand their quirks, you grow to love them, bit by bit, as the chapters fly past.Well, the main appeal of this anime to me was the titular character, Morita-san herself. She's cute, she's lovable, and though she doesn't speak a lot, she thinks too much. Way too much, in fact. Her overthinking things and being unable to do anything as a result is a running gag in the series. The episode is all over the place though, really. There are funny moments, there's wholesome moments, there's some scenes with yuri bait and all in all it's one good OVA episode that I thoroughly enjoyed. Recommend it to everyone. chapters of a 4-koma manga at once, if you know what I mean. It's just about mini-occurences and how the characters react to them, how they interact with each other etc. As you get to know them, understand their quirks, you grow to love them, bit by bit, as the chapters fly past.Well, the main appeal of this anime to me was the titular character, Morita-san herself. She's cute, she's lovable, and though she doesn't speak a lot, she thinks too much. Way too much, in fact. Her overthinking things and being unable to do anything as a result is a running gag in the series. The episode is all over the place though, really. There are funny moments, there's wholesome moments, there's some scenes with yuri bait and all in all it's one good OVA episode that I thoroughly enjoyed. Recommend it to everyone.""]"
