Name,Anime_url,Review
Ikkitousen: Great Guardians Specials,https://myanimelist.net/anime/5333/Ikkitousen__Great_Guardians_Specials,"[""Worthy of a 10!For those who are fans of the ikkitousen series and love fan service, these special episodes are a treasure for the viewer.In this special the main characters go through challenges with the real goal of pleasing the fans of the series with fan service of the best quality. The situations they go through are unprecedented and satisfy the viewers' desires.The only negative point of these special episodes is the short time per episode. Other than this small detail, this work is worthy of a 10!Those who don't like the work don't know how to appreciate a fine fan service. "", 'Im surprised no one has written a rage review of this. The Ikkitousen Great Guardian Specials are definetly ""something"". You may get a good laugh from 3/5 2 minute episodes. If anything I was disappointed with the actual content and especially how Kakouen was portrayed(I wasnt happy about that). Anyways the fanservice is at a low for most of the episodes. Ova 2 and 5 were the only ones which seemed like Ikkitousen fanservice. Generally the episodes where very bland. I certainly was not expecting a story or maximum level content but this was a bit poor. If your a fan of the series I...would recommend watching it, but do not expect much.Story 5Enjoyment...meh 7Overall 6 would recommend watching it, but do not expect much.Story 5Enjoyment...meh 7Overall 6', ""Plain and simple fan service. The scenes are introduced by resident milf Goei in what looks like some sort of variety show 4th wall break format. Because of these intros and outros the scenes themselves really only last a minute or so and are just barely the thinnest excuse for setting up some raunchy lewd camera angles and as much exposed skin as they can show without having to pixelate it. I'll say what I always say in regard to shows and specials like this: there is real hentai out there for you to watch, this is just porn with extra steps. 5/10 ""]"
Jidao Long Shen,https://myanimelist.net/anime/51860/Jidao_Long_Shen,"[""This one has a really good MC, he's kinda OP and seems to know a lot, if you like bold MC that is not afraid to antagonize some villains (like Martial Master and Against the Sky Supreme) this one is for you.The story doesn't have a lot of introductions, but the MC does have a goal of revenge, but this anime is about his journey of getting a lot oh power ups. The cultivation system does seems a little confusing at first cause it has more than one, but eventually it's possible to get a grasp of it. I watched because there were supposed to...be romance, and there is (eventually), and also a lot of girls have an interest in the MC.The first girl may seem angry all the time, but often she has a reason to, she has a strong personality and she kinda grows on you. Hope it continues. be romance, and there is (eventually), and also a lot of girls have an interest in the MC.The first girl may seem angry all the time, but often she has a reason to, she has a strong personality and she kinda grows on you. Hope it continues.""]"
